
デザートトリップ,スマートファルコン,プラセンティア
デザートナイト,アドマイヤムーン,アバヤ(USA)
デジタルキャット,アグネスデジタル(USA),コスモハイクラス
デジタルフラッシュ,アグネスデジタル(USA),マチカネベニツバキ
デジャブ,バゴ(FR),ヤサカシーズン
デスティニーソング,メイショウボーラー,マルカデスティニー
デスティニーレイ,ショウナンカンプ,マルカデスティニー
デスティネイション,ストリートセンス(USA),ライフストーリー(USA)
デスティーノトップ,Corinthian(USA),ランフォーイット(USA)
テストマッチ,キングカメハメハ,アレキサンドリア
デストリーライズ,カネヒキリ,スイートマカロン(USA)
デスドロップ,キンシャサノキセキ(AUS),ミスキ(USA)
デスペルタル,フィガロ(USA),フェアリーライド
デスヨネ,クロフネ(USA),ウインプラチナム
テセラグッドノーズ,サウスヴィグラス(USA),ミエレ(USA)
テソーロ,ダイワメジャー,ベルワトリング(CHI)
テゾーロミノル,アサクサキングス,ピエナアマゾン
デックテープ,ゼンノロブロイ,ウェルカムフラワー
テッサロニキ,シニスターミニスター(USA),シャンハイハピネス
デッドポイント,ケイムホーム(USA),ソルティレージュ
テップシー,ヴァーミリアン,フックライン(GB)
テッペントッタル,マヤノトップガン,ホシノテンビー
デッラサルーテ,シンボリクリスエス(USA),バクシンカーリー
テツワンイナキチ,ワイルドラッシュ(USA),スイートローレライ(USA)
デトネイション,サウスヴィグラス(USA),カラーガード
テトラクォーク,ノヴェリスト(IRE),フェルミオン
テトラドラクマ,ルーラーシップ,リビングプルーフ
テトラルキア,ハーツクライ,マリアロワイヤル(IRE)
デトロイトクイーン,タヤスツヨシ,マルマツキセキ
デトロイトスター,アッミラーレ,マルマツフィーバー
デナリ,マンハッタンカフェ,ランフォザドリーム
デナリテソーロ,キンシャサノキセキ(AUS),レディーエリオット(GB)
デニストン,プリサイスエンド(USA),ブルーポラリス
デニムアンドルビー,ディープインパクト,ベネンシアドール
デニール,アドマイヤオーラ,ラベルフィーユ
テネイシャス,キングカメハメハ,ヒカルアマランサス
テネイシャスパール,カフェオリンポス(USA),メイソヴリン
テネレッツァ,キャプテントゥーレ,サイマルタシュ
デバンス,クリストワイニング(USA),タンポポプリンセス
デピュティスカイ,フレンチデピュティ(USA),アースマリン
デピュティプライム,フレンチデピュティ(USA),ジャドール
デビュースマルト,ファルブラヴ(IRE),デビュートウショウ
デピュートアゲン,フレンチデピュティ(USA),エキサイトアゲン(USA)
デビルオブスピーチ,タイキシャトル(USA),グッドトーク(USA)
デビルズハーツ,ハーツクライ,セルリアンブルー
デビルズヘアカット,シンボリクリスエス(USA),スペシャルワールド
デファーンドル,ネオユニヴァース,マーモリー(IRE)
デフィ,タートルボウル(IRE),ゴールドフェスタ(USA)
デフィニール,ブラックタイド,ローレルデフィー
デフィノワール,トーセンブライト,シャトーノワール
デブリン(USA),Congrats(USA),Hatta Flower(USA)
テムジン,ディープインパクト,アグネスミネルバ
デメテルヘイロー,キングヘイロー,ヤマノテンジン
デモニオ,ネオユニヴァース,シーザバッドガール(USA)
デュアルウィールド,アイルハヴアナザー(USA),ソーゴル(IRE)
デュアルスウォード,デュランダル,デュアルストーリー
デュアルデライト,プリサイスエンド(USA),ビクトリークエスト
デュアルフレイム,フレンチデピュティ(USA),ブローザキャンドル
デュアルマンデート,ダイワメジャー,ヒシシルバーメイド(USA)
デュアルメジャー,ダイワメジャー,デュアルストーリー
デュエットカラー,ナカヤマフェスタ,スターデュエット(USA)
デュッセルドルフ,ノヴェリスト(IRE),ガラディナー
デュナトス,サウスヴィグラス(USA),ダンスカーニバル
デュナミス,ストリートセンス(USA),チェルビム
デュパルクカズマ,エンパイアメーカー(USA),フェザーレイ
デュラブルシャーム,ゴールドアリュール,ギネビアケイ(USA)
デューイハミテージ,ディープスカイ,オナーザミント
デュークトレジャー,ロードアルティマ(USA),ソルトレイクスター
デュース,ゴールドアリュール,ライヴ(USA)
デューズワイルズ,カジノドライヴ(USA),ジューンアナガリス
デライトメッセージ,マルカシェンク,ウィンメッセージ
テラザジーニアス,タイムパラドックス,テラザイザベラ
テラザトゥインクル,スウェプトオーヴァーボード(USA),テルミークィーン
テラザトゥモロー,トランセンド,エトワールステージ
テラザドゥルキス,アンライバルド,シークレットダイヤ
テラザフィーリア,サムライハート,エトワールステージ
テラザホット,オンファイア,エトワールステージ
テラザマッハ,アドマイヤムーン,ゴールデンポケット
テラノヴァ,ヴィクトワールピサ,エアトゥーレ
テラノココロ,シンボリクリスエス(USA),プルーフオブラヴ
テラフォーマー,キングズベスト(USA),アースソング
デランブル,シンボリクリスエス(USA),ロージーチャーム
デリスモア,ワークフォース(GB),アルティマトゥーレ
デリツィエ,フリオーソ,レオコマチ
デリッツァリモーネ,キングカメハメハ,ドルチェリモーネ
テリトーリアル,Teofilo(IRE),コンサヴァトワー(USA)
テリングブロウ,Teofilo(IRE),ウェイヴランナー(GB)
デルヴォー,フサイチコンコルド,ブラストスイフト
デルエデン,ノヴェリスト(IRE),エスカナール
デルカイザー,キングカメハメハ,シェリール
テルキーネス,ノヴェリスト(IRE),レディベローナ
デルグレネ,ヴァーミリアン,レディストレイツ(IRE)
テルス,ハーツクライ,タッソーニー
テルタイザン,アッミラーレ,マチカネホホエミ
デルタバローズ(USA),Into Mischief(USA),Sweet Seventeen(USA)
デルニエオール,ステイゴールド,オリエンタルアート
デルニエリアリテ,ゼンノロブロイ,トキオリアリティー(USA)
テルノマイヒメ,ベーカバド(FR),カネサゼファー
テルプシコレ,タートルボウル(IRE),ラフォルトゥナ
テルペリオン,フリオーソ,エルベレス
デルマアツヒメ,トワイニング(USA),エイプリルヒロイン
デルマアブサン,ローエングリン,テクニカルラン
デルマアマギゴエ,コンデュイット(IRE),マルカアイチャン
デルマアマレット,アッミラーレ,ローズデュルワ
デルマイヨマンテ,キャプテントゥーレ,マダムブランシェ
デルマウオッカ,ローエングリン,アクロスザライト
デルマウーゾ,タートルボウル(IRE),カラフルトーク
デルマオイチ,ドリームジャーニー,ソヨカゼ２(FR)
デルマオウショウ,ダイワメジャー,マンデーデライト
デルマオカル,ミリオンディスク,アドマイヤラップ
デルマオギン,ハービンジャー(GB),センターステージ
デルマオチョウ,メイショウサムソン,スプリングアマイン
デルマオテモヤン,アサクサキングス,カザリムスビ
デルマオフクロサン,ホワイトマズル(GB),アルデュール
デルマカシャーサ,カジノドライヴ(USA),オメガロンド
デルマカゼタチヌ,ミリオンディスク,ローザロッサ
デルマカミカゼ,ストロングリターン,デルマアマノジャク
デルマガラシャ,ミリオンディスク,フレンドリービューティ(USA)
デルマカルヴァドス,サムライハート,ワイメア
デルマキセキ(USA),Scat Daddy(USA),Tashawak(IRE)
デルマキミコイシ,スウィフトカレント,デルマポッペア
デルマキミノナハ,ミリオンディスク,デルマユリア
デルマキュラソー,カジノドライヴ(USA),マルデデルマ
デルマキール,ヴィクトワールピサ,デルマポッペア
デルマグラッパ,スクリーンヒーロー,ユークロニア
デルマクラノスケ,ブラックタイド,アジアンビューティ
デルマケサゴゼン,ローエングリン,ヤマノケントップ
デルマコイシグレ,カジノドライヴ(USA),グランス
デルマコウモン,アドマイヤオーラ,シゲルヨリツキ
デルマゴシンゾサン,トワイニング(USA),ローザロッサ
デルマサイドカー,ネオユニヴァース,カンタオーラ
デルマサダヤッコ,タイキシャトル(USA),ファビュラスセンス
デルマサリーチャン,ホワイトマズル(GB),ローザロッサ
デルマサンダユウ,フレンチデピュティ(USA),レイナクーバ
デルマシェリー,ストロングリターン,デルマユリア
デルマジャイアン,Giant's Causeway(USA),マウントコブラ(USA)
デルマシャンパン,ヴァーミリアン,ランウェイスナップ
デルマジュロウジン,サムライハート,デルマステファニー
デルマスコッチ,ヴィクトワールピサ,マイワイルドローズ(USA)
デルマスバル,ローエングリン,アドマイヤラップ
デルマスピリタス,ノヴェリスト(IRE),デルマドゥルガー
デルマダイキリ,ワークフォース(GB),デルマプロティナ
デルマタスケ,スウィフトカレント,テンシノウタ
デルマタッシャデナ,サムライハート,ワイメア
デルマチャチャ,サムライハート,サバクノバラ
デルマチョウスケ,トワイニング(USA),アドマイヤラップ
デルマテキーラ,ブラックタイド,ティルトウイング
デルマネグローニ,エイシンフラッシュ,デルマノママナノダ
デルマネネ,ダイワメジャー,アクセラレイション(FR)
デルマネライウチ,アサクサキングス,ジャカランダテラス(AUS)
デルマノウヒメ,アサクサデンエン(GB),ローザロッサ
デルマバラライカ,ハービンジャー(GB),ラピッドオレンジ
デルマハワイコウロ,ワークフォース(GB),ジブリール
デルマフユゲシキ,ワークフォース(GB),スマートレディー
デルマブランデー,ヘニーヒューズ(USA),フリードリームズ(GER)
デルマプレイバック,ミリオンディスク,デルマプロティナ
デルマブンザエモン,キャプテントゥーレ,ワイメア
デルマベリーニ,タートルボウル(IRE),ジブリール
デルマベルモット,タートルボウル(IRE),メイクイットベター
デルママオタイ,スウィフトカレント,アジアンビューティ
デルママツタロウ,スウィフトカレント,テンシノウタ
デルママティーニ,ゼンノロブロイ,フレンチマリー
デルママンハッタン,マルカシェンク,ミュンシー(IRE)
デルマミセラレテ,タートルボウル(IRE),ダイワレーヌ
デルマミダレガミ,スウィフトカレント,ミュンシー(IRE)
デルマミモザ,アドマイヤコジーン,フラワーサークル
デルマヤブラコウジ,ジャングルポケット,サトルスマイル
デルマヨタロウ,マルカシェンク,ワイメア
デルマヨッチャン,カンパニー,サニーサイドアップ
デルマラム,タートルボウル(IRE),ノブレスオブリッジ
テルメディカラカラ,ハービンジャー(GB),ジョリーダンス
テルルフォレスト,トビーズコーナー(USA),ラフィーク
テレグライド,ロージズインメイ(USA),クイックリプライ(USA)
テレチャウ,タイキシャトル(USA),ショコラン
デロニクスレギア,フサイチホウオー,ロサガリカ
テロメア,パイロ(USA),タカヒロガートップ
デロングスター,ヴィクトワールピサ,アイアムルビー(USA)
テンエイアズマ,カンパニー,ピンクサプライズ
テンエイアース,パイロ(USA),テンエイミューズ
テンエイハヤブサ,ファスリエフ(USA),ピンクサプライズ
テンエイヒーロー,ステイゴールド,テンエイハトリコ
テンエイリリー,キングヘイロー,テンエイキララ
テンエイリード,リンカーン,テンエイハトリコ
テンオールゲッター,アドマイヤオーラ,イノセントハート(USA)
デンカノホウトウ,デュランダル,センボンザクラ
テンカムソウ,パーソナルラッシュ(USA),サッポロサクラ
テンキセキ,アグネスデジタル(USA),ホシノキンカ
テンクウ,ヨハネスブルグ(USA),ピサノドヌーヴ
テンクウマリー,トーセンブライト,トーセンママレード
デンコウアリオン,タイキシャトル(USA),デンコウレジーナ
デンコウアルル,マツリダゴッホ,シングムーン(USA)
デンコウアンジュ,メイショウサムソン,デンコウラッキー
デンコウイッセン,メイショウサムソン,ドゥザボサノバ(IRE)
デンコウウノ,メイショウオウドウ,ツリー
デンコウエポック,メイショウサムソン,エイプリルヒロイン
デンコウエルドラド,メイショウボーラー,デンコウレジーナ
デンコウガイア,ブライアンズタイム(USA),シルキーマニッシュ
デンコウキングダム,ローエングリン,アマランス
デンコウグランデ,ゴールドアリュール,バグワイザー(USA)
デンコウグロリアス,エンパイアメーカー(USA),チアズグレイス
デンコウケンジャ,ヨハネスブルグ(USA),オオシマパンジー
デンコウコハク,メイショウボーラー,ツリー
デンコウジェネシス,ハービンジャー(GB),アースマリン
デンコウシャフト,リーチザクラウン,ニシノヘレンド
デンコウシャーリー,メイショウオウドウ,デンサクヒロ
デンコウシュク,メイショウボーラー,デンコウレジーナ
デンコウスティール,グラスワンダー(USA),デンコウラッキー
デンコウタカミー,アグネスデジタル(USA),デンコウキララ
デンコウチャレンジ,マンハッタンカフェ,ベストオブチャンス
デンコウノホシ,キングヘイロー,セレサス
デンコウハシャ,バゴ(FR),レガシーウィンド
デンコウヒノマル,ダイワメジャー,レインボウスズラン
デンコウフドウ,アイルハヴアナザー(USA),ツリー
デンコウメジャー,ダイワメジャー,ホットスウェル(USA)
デンコウリキ,タイキシャトル(USA),デンコウレジーナ
デンコウリョウ,タニノギムレット,ニンナナンナ
テンザワールド,ダイワメジャー,クォリティシーズン
テンザンヒ,ナカヤマフェスタ,マイネグロリアーナ(USA)
テンザンフミスタ,ワイルドラッシュ(USA),ミストラルアゲン
テンシノコレクター,シーキングザダイヤ(USA),テンシテンシ
デンセツノマジョ,オンファイア,アドマイヤダッシュ
テンタマユキノブ,ローズキングダム,ペリウィンクル
テンテマリ,スズカフェニックス,テンイムホウ
デンデラリュウ,サウスヴィグラス(USA),グロリアスシーン
テンナイトパール,ゴールドアリュール,コーンドリー
テンナインズ,ブライアンズタイム(USA),アルビアン(USA)
テンノイタダキ,スマートファルコン,プロヴァンス
テンノカガヤキ,マンハッタンカフェ,メジロカトリーヌ
テンノサクラコ,カネヒキリ,ボーイントンキャニオン(USA)
デンパサール,ロージズインメイ(USA),タスク(USA)
デンバーテソーロ(CAN),Violence(USA),Cloud of Smoke(USA)
テンプルツリー,ブラックタイド,シルクヴィーナス
テンポディヴァルス,ロードカナロア,アンナータ
テンモース(USA),Speightstown(USA),Lemon Kiss(USA)
テンワールドレイナ,ローエングリン,レイナクーバ
テーオーアモーレ,ヨハネスブルグ(USA),グッデーコパ
テーオーエナジー,カネヒキリ,シルキークラフト(USA)
テーオーエレナ,ヴィクトワールピサ,ノーザンシャトル
テーオーエンブレム,トーセンホマレボシ,リトルハーモニー
テーオージーニアス,ゴールドアリュール,リーグルメアリー(USA)
テーオーソルジャー,ゴールドアリュール,ウェディングベリー
テーオーパートナー,ヘニーヒューズ(USA),ミスアイーカメ
テーオービクトリー,ブラックタイド,タイキクララ
テーオービックバン,ゼンノロブロイ,ゴットザビート
テーオーフォルテ,ハービンジャー(GB),グッデーコパ
テーオーフォース,シンボリクリスエス(USA),キャンディーストア
テーオーヘラクレス,シンボリクリスエス(USA),ウェディングベリー
テーオーヘリオス(USA),Fusaichi Pegasus(USA),リーグルメアリー(USA)
テーオールチア,シニスターミニスター(USA),マキシムカフェ
データヴァリュー,クロフネ(USA),クリックヒア
