

ドアトゥブリス,グランプリボス,スイートスズラン
トイトイトイ,メイショウボーラー,チャンピオンダイヤ
トイトイブルース,ロジユニヴァース,マーズプリンセス
トイミサキ,マヤノトップガン,ヒシレーシー
ドゥアイドゥ,ゴールドアリュール,ユーオーミー
トゥインクルカラー,クロフネ(USA),キウィカラー(NZ)
トゥイーディア,ハービンジャー(GB),ラナンキュラス
ドゥエベリーニ,マンハッタンカフェ,フレンチカクタス
ドゥエルインハート,タイキシャトル(USA),ジューンブライド
ドヴェルグ,ネオユニヴァース,アラマサダンサー
ドゥエンデ,ディープブリランテ,ミヤコレッドローズ
ドゥオーモ,ディープインパクト,アスクコマンダー
トウカイアゼリア,ダノンシャンティ,トウカイファイン
トウカイアルバ,ハービンジャー(GB),トウカイファミリー
トウカイヴィオラ,アイルハヴアナザー(USA),トウカイオスカー
トウカイエクレール,ジャングルポケット,トウカイウェーブ
トウカイエポナ,ハービンジャー(GB),トウカイポピー
トウカイエントリー,マーベラスサンデー,シュルードレディ(USA)
トウカイエンプレス,ハーツクライ,トウカイロータス
トウカイオルデン,ハーツクライ,トウカイミステリー
トウカイガンバ,マイネルラヴ(USA),トウカイローレル
トウカイクルーク,エンパイアメーカー(USA),トウカイティアラ
トウカイクローネ,オレハマッテルゼ,アイペイバック
トウカイシェーン,ダイワメジャー,トウカイポピー
トウカイシュテルン,ストリートセンス(USA),トウカイセレブ
トウカイジュリア,タートルボウル(IRE),トウカイマーチ
トウカイシーカー,フリオーソ,トウカイレジーナ
トウカイストラーダ,ジャングルポケット,トウカイマーチ
トウカイパイロ,パイロ(USA),トウカイラブ
トウカイパシオン,ヨハネスブルグ(USA),トウカイポプリ
トウカイハッピー,ワークフォース(GB),ローズシティ
トウカイバレット,ネオユニヴァース,オータムブリーズ
トウカイビヨンド,ゴールドアリュール,トウカイデンヒル
トウカイフィーバー,エンパイアメーカー(USA),トウカイポプリ
トウカイフェスタ,トウカイテイオー,トウカイデンヒル
トウカイフォーゲル,トウカイテイオー,トウカイパステル
トウカイプリーズ,ファンタスティックライト(USA),トウカイラブ
トウカイベリンダ,ハーツクライ,トウカイオスカー
トウカイボヌール,メイショウサムソン,トウカイファミリー
トウカイボーイ,キンシャサノキセキ(AUS),ダーリングベリー
トウカイマインド,ゴールドアリュール,トウカイデンヒル
トウカイメジャー,ダイワメジャー,トウカイミステリー
トウカイメール,タイキシャトル(USA),トウカイウェーブ
トウカイララバイ,パイロ(USA),トウカイロゼット
トウカイリオナ,ケイムホーム(USA),トウカイパフィー
トウカイレジェンド,トウカイテイオー,サマーディザイア
トウカイレーヌ,ディープインパクト,トウカイミステリー
ドウカンヤマ,サウスヴィグラス(USA),グラッドリー
トウキョウコール,フリオーソ,タップダンス
トウキョウタフガイ,キングカメハメハ,リュートフルシティ
トウキョウムテキ,ヴァーミリアン,ツルマルダンサー
トゥクトゥクボーイ,ダノンシャンティ,レッツグルーヴ
トウケイアインマル,ゴールドヘイロー,トウケイルーブル
トウケイアロー,オンファイア,グリーンサンライズ
トウケイイダテン,タニノギムレット,マリエッタ
トウケイウルフ,サムライハート,フォーティマジック
トウケイエース,キングカメハメハ,ディナーパーティ(IRE)
トウケイゴコウ,ロージズインメイ(USA),ギオンゴールド
トウケイサミドリ,キングズベスト(USA),トウケイサクラ
トウケイシデン,ロージズインメイ(USA),ユアライフスタイル
トウケイシンシテイ,ゴールドヘイロー,プリモピアット
トウケイタイガー,タイムパラドックス,ヒノデモンテローザ
トウケイダンディ,ロージズインメイ(USA),プラントオジジアン
トウケイハルカ,スズカマンボ,エンチャンティング(IRE)
トウケイファイター,ゼンノロブロイ,イントゥザライト
トウケイファルコン,スペシャルウィーク,サンセットロード
トウケイフェアリー,ネオユニヴァース,マイネノエル
トウケイフクキタル,グラスワンダー(USA),プッシュ
トウケイヘイゾウ,ゴールドヘイロー,リュウヨウ
トウケイホクト,ディープブリランテ,シルクシャンゼリゼ
トウケイムスタング,キンシャサノキセキ(AUS),ウエスタンアイル(USA)
トウケイライデン,パイロ(USA),シークレットアート
トウケイロイヤル,フサイチリシャール,トミーラヴ
トウケイワラウカド,ゴールドヘイロー,アイスダンス(UAE)
トゥザキングダム,シンボリクリスエス(USA),トゥザスターダム
トゥザクラウン,キングカメハメハ,トゥザヴィクトリー
トゥザフロンティア,ロードカナロア,トゥザヴィクトリー
ドウザンブルー,マンハッタンカフェ,ティエッチグレース(USA)
ドウジマボーイ,ソングオブウインド,ラティアス
トウショウアパッチ,ファスリエフ(USA),ハイジトウショウ
トウショウエディタ,ストーミングホーム(GB),サニートウショウ
トウショウカウント,サウスヴィグラス(USA),バーニントウショウ
トウショウギフト,カリズマティック(USA),ウイッチトウショウ
トウショウコマンチ,カネヒキリ,ブリッジトウショウ
トウショウジャイロ,ダイワメジャー,シーイズトウショウ
トウショウジルバ,キンシャサノキセキ(AUS),スサーナトウショウ
トウショウスレッジ,カネヒキリ,メイトウショウ
トウショウセレクト,マイネルセレクト,メイトウショウ
トウショウチヌーク,ソングオブウインド,シニョリーナベラ(USA)
トウショウチャート,タイムパラドックス,スカイトウショウ
トウショウディスク,ジャングルポケット,シリウストウショウ
トウショウデヴィル,ロージズインメイ(USA),コルサトウショウ
トウショウデュエル,ローエングリン,ヘヴントウショウ
トウショウドラフタ,アンライバルド,ウイッチトウショウ
トウショウノワール,ゼンノロブロイ,デューントウショウ
トウショウパシオン,メイショウボーラー,デコトウショウ
トウショウビクター,ステイゴールド,スイープトウショウ
トウショウピスト,ヨハネスブルグ(USA),シーイズトウショウ
トウショウプライド,ローエングリン,シータトウショウ
トウショウブランド,スタチューオブリバティ(USA),シータトウショウ
トウショウブーム,メイショウボーラー,マタハリトウショウ
トウショウレイダー,ファルブラヴ(IRE),オーロラトウショウ
トウシンアサヒ,キングカメハメハ,ジヴェルニーアート(USA)
トウシンイーグル,ハーツクライ,エリモアメジスト
トウシンカイザー,オルフェーヴル,スーア(IRE)
トウシンゴールド,ハーツクライ,カサブランカスマイル(CHI)
トウシンシロフジ,チチカステナンゴ(FR),セシルカット
トウシンタイガー,ゴールドアリュール,ライブリーチューン(USA)
トウシンダイヤ,ダイワメジャー,ベネンシアドール
トウシンムサシ,ダイワメジャー,プリティベティ
トウシンモンステラ,キングカメハメハ,ピンクパピヨン
ドゥスール,エンパイアメーカー(USA),クライフォザトップ
トゥットベーネ,ディープブリランテ,ツルマルローズ
ドウディ,コンデュイット(IRE),ストームイメージ
ドゥドゥドゥ,ロージズインメイ(USA),ドゥーワップ
トゥニーナ,ディープスカイ,レッドグラス
トゥプエデス,ローズキングダム,シルバーベル
ドゥフトライネン,アドマイヤボス,アサギヌ
ドゥマン,ハーツクライ,ヤマノラヴ
ドゥモアゼルタタン,ローレルゲレイロ,シャルトリューズ
トゥモローアンセム,ヤマニンセラフィム,アニー
トゥモローウィング,シニスターミニスター(USA),パーフィディア(USA)
トゥモローキッス,アイルハヴアナザー(USA),クイーンロイド
トゥモローズアイ,ネオユニヴァース,トゥモローズライト
ドゥモワゼル,ショウナンカンプ,ステキプレゼント
トゥラヴェスーラ,ドリームジャーニー,ジャジャマーチャン
ドゥラリュール,ゴールドアリュール,グランドホイッスル
ドゥリアリティ,スターリングローズ,ヒシラスティ
ドゥリトル,トーセンホマレボシ,ウィストラム
トゥリパ,カルストンライトオ,シーフェアリー
トゥリパーノ,ステイゴールド,エクセプショナル
トゥルエノ,ダンスインザダーク,キャラメレ
ドゥルガー,ケイムホーム(USA),マドモアゼルノン
トゥルボー,オルフェーヴル,フェアエレン(USA)
トゥルーウインド,ゴールドアリュール,レールマラン(USA)
トゥルーカラーズ,アルデバラン２(USA),メイクマイバンドル
トゥルースカイ,ディープスカイ,グリーンヒルマック
トゥルータキオン,エイシンフラッシュ,ヴィーヴァタキオン
トゥルードリーム,ドリームジャーニー,ヴィーヴァレジーナ
トゥルーハート,ハーツクライ,スコアズビー
トゥルーヒーロー,ブライアンズタイム(USA),ナパ
トゥルームーン,マツリダゴッホ,アイアムトゥルー(USA)
トゥルーラヴキッス,ゼンノロブロイ,スモークンフローリック(USA)
トゥンバドーラ,スズカマンボ,オーベルゲイド(FR)
ドゥーエノルドゥ,ナカヤマフェスタ,ケイツーノース
ドゥーカ,タイキシャトル(USA),シェリーバレンシア
トゥートエール,バンブーエール,エンジェルシェア
トゥーナタイム,スクリーンヒーロー,エイシンパンドラ
トゥープラウド,スターリングローズ,エンドレスパワー
ドゥーブル,プリサイスエンド(USA),エシャペ
ドゥール,ファスリエフ(USA),シュガーミント
トゥールエッフェル,フレンチデピュティ(USA),ラブリネスオブパリ
トゥールマレー,ハービンジャー(GB),オーラレガーレ
トゥーレ,キャプテントゥーレ,エアラグドール
トゥーレドゥー,ゼンノロブロイ,ミスアリバイ(USA)
トエハタエ,テレグノシス,ヘバラー(GB)
トオイショウワノ,ローエングリン,オカゲサマデ
トオルンバ,アドマイヤムーン,クイーンオブナプレス(GB)
トガミサクラ,キャプテンスティーヴ(USA),サルサクイーン
トガメ,バイオマスター(USA),マソオ
トキオストーム,キングヘイロー,サクラフェリーチェ
ドキドキモーニング,メイショウボーラー,アイペイバック
トキノアイチャン,エンパイアメーカー(USA),カミングトゥルー
トキノアビー,フリオーソ,メイプルラブチャン
トキノヴァンクール,モンテロッソ(GB),ワイルドダンス
トキノエクセレント,アッミラーレ,ダンシングドミニア
トキノオー,シンボリクリスエス(USA),セキサンキセキ
トキノカサドール,ローレルゲレイロ,トキノナスティア
トキノクレール,フリオーソ,ラブリーランサム
トキノゲッコウ,シーキングザダイヤ(USA),イエロージャスミン
トキノケリー,モンテロッソ(GB),メグリ
トキノサンサン,サクラプレジデント,リスティアエナー
トキノシシリー,アドマイヤオーラ,スイートシシリー
トキノシップー,パイロ(USA),メイプルラブチャン
トキノステラ,キングヘイロー,モガミヒメ
トキノセレブ,ワイルドラッシュ(USA),エリモセレブ
トキノディライト,ワイルドラッシュ(USA),レインオアシャイン
トキノパイレーツ,モンテロッソ(GB),エルサフィール
トキノブルース,ダンカーク(USA),エメラルドチャーム
トキノマツカゼ,サウスヴィグラス(USA),ミスダイナクリス(USA)
トキノメガミ,トビーズコーナー(USA),マーベラスローズ
トキノリアン,フォーティナイナーズサン(USA),タイキヴァルキリー(IRE)
トキノロブロイ,ゼンノロブロイ,オンヴェルベット(USA)
トキメキジュピター,モンテロッソ(GB),クレバーダンス
トキメキスワロー,キングヘイロー,トキメキハニー
トキメキライツ,シンボリクリスエス(USA),ケイエスアカリ
トキメキロマンス,ヴァーミリアン,メグミロマンス
ドギャン,ロージズインメイ(USA),ボディラブ
トキワ,エンパイアメーカー(USA),ルナジェーナ
ドクターデューン,バトルプラン(USA),ドクターベローナ
ドクターワイ,フォーティナイナーズサン(USA),グリーンヒルソング
ドクトルサンクス,ナカヤマフェスタ,セルフィッシュ
トコシエ,ワークフォース(GB),マチカネエンジイロ
ドコフクカゼ,ワイルドラッシュ(USA),デピュティプリミエ
トサイチ,ゼンノロブロイ,キアロディルーナ(USA)
トサノナデシコ,サムライハート,ホリノティアラ
トシガール,アドマイヤムーン,ソルトレイクブルー
トシザキミ,ジャイアントレッカー(USA),トシキセキ
トシザラブリー,スタチューオブリバティ(USA),トシキセキ
トシストロング,オレハマッテルゼ,ソルトレイクスター
トシチャン,サムライハート,ヒラリータイザン
トシファイブスター,フジキセキ,ゴールドグレース
トスカニーニ,シンボリクリスエス(USA),ギルティーコンシェンス(IRE)
ドスコイ,グラスワンダー(USA),ファーマレッド
ドストライク,ディープブリランテ,リリーポンド(USA)
トダメチャ,シンボリクリスエス(USA),ランデブー
トチノコンコルド,モルフェデスペクタ(USA),モルフェミシエロ
トチノゴールド,フォーティナイナーズサン(USA),アムルタート
トチノタイヨー,プリサイスエンド(USA),フジヤマビジン
トチノペガサス,ローレルゲレイロ,ラブイズカヌマ
トチノマドンナ,パイロ(USA),サマークイーン
トチノマリリン,ケイムホーム(USA),プリリンモンロー
トッカ,アジュディケーティング(USA),ウィングベガ
トッカータ,ブラックタイド,ペルセクション(USA)
トッケンドーナ,シンボリクリスエス(USA),タイキプリンセス(USA)
トッコディルーチェ(USA),Uncle Mo(USA),Touch of Splendor(USA)
ドットスマイル,ケイムホーム(USA),ダノンクラフト
トップアドバンス,アルデバラン２(USA),バクシンスクリーン
トップアリソン,ロジユニヴァース,ヴァリュー(USA)
トップインパクト,ディープインパクト,レッドヴィーナス
トップウ,ダイタクヤマト,ホシノティアラ
トップヴォイス,オルフェーヴル,レッドヴィーナス
トップエンデヴァー,マヤノトップガン,ベッラベリッシモ(IRE)
トップエンパイア,エンパイアメーカー(USA),フォービート
トップオブテーラー,タイキシャトル(USA),プレアデス
トップオブドリーム,デュランダル,チャニングガール(USA)
トップギア,バトルプラン(USA),ステラーホープ
トップゴーイング,マンハッタンカフェ,イタリアンオリーブ
トップゴールド,ゴールドアリュール,プリンセスメイク
トップザサブライ,サムライハート,トキオシンフォニー(USA)
トップシークレット,スウィフトカレント,フサイチエレガンス(USA)
トップスター,シニスターミニスター(USA),トーホウフローラ(USA)
トップソリスト(USA),War Front(USA),Moth(IRE)
トップダウン,クロフネ(USA),コードネーム
トップダンサー,スズカマンボ,コリンズグラス
トップターゲット,ネオユニヴァース,スイートレディ
トップディーヴォ,キングカメハメハ,セクシーザムライ(USA)
トップノート,ダイワメジャー,カルチャートップ
トップハーレー,スペシャルウィーク,ストーミングヘヴン(USA)
トップフィリア,スウェプトオーヴァーボード(USA),ハッピートーク
トップフェイス,スターリングローズ,ネロフェニーチェ
トップフライアー,スタチューオブリバティ(USA),シングフォアジョイ
トップホライゾン,ディープブリランテ,レッドプライム
トップマリア,アッミラーレ,ロクマリア
トップメダリスト,キングカメハメハ,ローランモンジュー(GB)
トップライジング,ジャイアントレッカー(USA),ローランハビーバ
トップライセンス,キンシャサノキセキ(AUS),キャリアコレクション(USA)
トップラン,ブラックタイド,ラヴコマンダー
トップリバティ,スタチューオブリバティ(USA),トップアクトレス
トップロマン,アジュディミツオー,アルクトゥルス
ドッペルゲンガー,タイムパラドックス,アリー(USA)
トドイワガーデン,サウスヴィグラス(USA),ラブイズエンジェル
ドナアブディアス,ディープインパクト,レディシャツィ(PER)
ドナアンブロージア,パイロ(USA),ポッドコンジュ
ドナアーディ,ダノンシャンティ,ブルーフェアプレー
ドナカデンツァ,ルーラーシップ,シャイニングアレキ
ドナキンバリー,タートルボウル(IRE),アズライト
ドナジェイダ,エイシンフラッシュ,ポッドレイ
ドナソレイユ,スニッツェル(AUS),ドナビジュー
ドナパンテーラ,アンライバルド,エリモロマンス
ドナピコ,ドリームジャーニー,サンスプリング(ARG)
ドナブライドル,ダンカーク(USA),スパニッシュソウル
ドナプリモ,フリオーソ,ドナビジュー
ドナブルネッタ,ルーラーシップ,トキノミスフレンチ
ドナブレス,オルフェーヴル,フェアリーブレス
ドナペリドット,キンシャサノキセキ(AUS),オルティア(USA)
ドナホーク,ローレルゲレイロ,ドナビジュー
ドナル,キングズベスト(USA),イナズマアマリリス
ドナルトソン,サウスヴィグラス(USA),アポロアドミラル
ドニアザード,バチアー(IRE),ヒカリフレーム
ドニゼッティ,Bernstein(USA),ギフトオブソング(USA)
トニーシャルマン,ファルブラヴ(IRE),シータトウショウ
トニーシャレード,スマートロビン,スマートレモラ
トニーハピネス,スマートファルコン,ミッシェルラブ
トニーファイブ,メイショウボーラー,デザートチャーム
トニーブラン,スマートファルコン,スマートドレス
トニーブリス,タニノギムレット,スマートアイリス
トニーポケット,ジャングルポケット,デビルインマインド
トノフ,ゴールドアリュール,ロックトニック(AUS)
ドヒョウギワ,ゴールドアリュール,フォクシーレッグス
トブガゴトク,シニスターミニスター(USA),バライロー
トマトチャン,キンシャサノキセキ(AUS),フールフォアラブ
トミケンアディム,トーセンホマレボシ,ヴィエナトウショウ
トミケンアユート,ファスリエフ(USA),モカモカ(USA)
トミケンアレス,オレハマッテルゼ,レディマハロ
トミケンアールト,サウスヴィグラス(USA),プリモローズ
トミケンヴァール,エイシンフラッシュ,リファインド
トミケンエンデレア,カジノドライヴ(USA),プリスティン(USA)
トミケンオウドウ,チーフベアハート(CAN),ラックチケット
トミケンカリム,サマーバード(USA),ペイドリン(USA)
トミケンキパジ,スクワートルスクワート(USA),シルバーアクト
トミケンキルカス,タイキシャトル(USA),サウンドアメニティ
トミケンゲヌーク,アイルハヴアナザー(USA),ルビウス
トミケンサンパティ,パイロ(USA),スイートカフェ
トミケンジェスト,サクラバクシンオー,シークレットデスティニー(USA)
トミケンシェルフ,サイレントディール,アグリフェスタ
トミケンジョメルト,タートルボウル(IRE),アルレガーロ
トミケンスラーヴァ,タイキシャトル(USA),タイキクララ
トミケンスーペル,バトルプラン(USA),チュウワビーナス
トミケンセーグラ,メイショウボーラー,プレシャスペスカ
トミケンタバサム,ディープスカイ,ミュージカル２(IRE)
トミケンタルモ,エンパイアメーカー(USA),シルククインビー
トミケンチャダル,シニスターミニスター(USA),ニシノシンデレラ(USA)
トミケンナプロスト,アドマイヤマックス,ダーティダンシング
トミケンバディリ,ワイルドラッシュ(USA),フォーモサアピール
トミケンフィーナ,ゴールドアリュール,フェアリーステップ(USA)
トミケンブリクセム,スウェプトオーヴァーボード(USA),ジョウノマドンナ
トミケンブリランテ,シンボリクリスエス(USA),プラチナガール
トミケンフリンク,フリオーソ,ラッキーピンキー
トミケンプレミオ,ファスリエフ(USA),モカモカ(USA)
トミケンプロズバ,クロフネ(USA),ビップフライト
トミケンペンサーレ,バトルプラン(USA),フューチャローザ
トミケンボイジフ,トゥザグローリー,マイネフェニーチェ
トミケンボハテル,アドマイヤムーン,ヴァルネリーナ(IRE)
トミケンミステリオ,トゥザグローリー,ソソノ
トミケンミルト,キングヘイロー,サウンドアメニティ
トミケンムトル,エンパイアメーカー(USA),ピサノアリュメール
トミケンモヴェール,カネヒキリ,プリモローズ
トミケンユークアイ,メイショウボーラー,アマゾナイト
トミケンライニ,ゼンノロブロイ,アルウェット
トミケンリディカ,ルーラーシップ,オーガストウェイ
トミケンルパウス,カンパニー,メダリオンスター
トミケンルーア,フレンチデピュティ(USA),オーバーザムーン
ドミナドール,ディープスカイ,トラストトゲピー
ドミナートゥス,ルーラーシップ,デグラーティア
ドミネイトアゲン,エンパイアメーカー(USA),オーブリエチア
ドミネーター,プリサイスエンド(USA),カネトシフィオーレ
トミノヴェール,アドマイヤムーン,レインボーロマンス
トミノカモン,フリオーソ,アイキャンデイ
ドミノパス,キングズベスト(USA),アグネスカルミア(USA)
トミノバーディー,スウィフトカレント,トミノプリティー
トミノプランドール,ネオユニヴァース,レインボーロマンス
トムプレジール,ワイルドラッシュ(USA),オスカル
トモジャヴァリ,エンパイアメーカー(USA),ホーマンピクシー
トモジャヴェール,エイシンアポロン(USA),バトルキクヒメ
トモジャオーサム,ワイルドラッシュ(USA),アートオブダンサー
トモジャオール,エンパイアメーカー(USA),アポロティアラ
トモジャクアルト,スウェプトオーヴァーボード(USA),ブーティー
トモジャクリスタル,ダイワメジャー,ウィローパドック
トモジャクール,メイショウボーラー,セキサンキセキ
トモジャスティス,タイキシャトル(USA),エグゼリーナ
トモジャストリーク,ストリートセンス(USA),クルミ
トモジャタイクーン,ルーラーシップ,プリティジョディー
トモジャック,マンハッタンカフェ,レオティアラ
トモジャナイト,ヘニーヒューズ(USA),ソーゴル(IRE)
トモジャハリーフ,バゴ(FR),トップジョリー
トモジャバルジャン,ダノンシャンティ,シフォンベール
トモジャパルムドル,ケープブランコ(IRE),シルクヴィーナス
トモジャバロンド,サウスヴィグラス(USA),オペラガール
トモジャファイブ,ジャスタウェイ,ジューシージーン(GB)
