
トモジャプリマ,ブラックタイド,クイーンオブハルカ
トモジャポルックス,ゴールドアリュール,ビジューブリアン
トモノコテツ,ブラックタイド,ベネラ
トモノセンス,ストリートセンス(USA),アスターフォーマリア(USA)
トモノタイガ,ザール(GB),ホロトラストシーン
トモノチャイルド,モルフェデスペクタ(USA),ホロトラストシーン
トモノブラック,マヤノトップガン,ゲイリーブリリアン
トモノマックス,ノボジャック(USA),クリーマックス
トラヲサイゴニ,エンパイアメーカー(USA),シェアエレガンス
ドライヴシャフト,トワイニング(USA),ノブレスオブリッジ
ドライヴスター,カジノドライヴ(USA),ケイエムサウザー
ドライヴナイト,カジノドライヴ(USA),カウントオンミー
ドライサンプ,ニューイングランド,エデン
トライデントミノル,ディープスカイ,アンジェラスキッス(USA)
ドライトウショウ,マーベラスサンデー,ザップトウショウ
ドライバーズハイ,カジノドライヴ(USA),ポレモス
トライブキング,ディープインパクト,ブロームフォンテン(IRE)
トライン,ディープインパクト,マルケサ(USA)
トラヴィス,ステイゴールド,スターフェスタ
トラキアンコード,マンハッタンカフェ,レッドルンバ(IRE)
トラキチシャチョウ,マヤノトップガン,タイキプレリュード(USA)
トラクスタン,ブラックタイド,レスティヴコマンダ
ドラグーン,パイロ(USA),アーキオロジー(USA)
ドラグーンシチー,ロードカナロア,メイショウアンデス
ドラゴンイモン,ダンスインザダーク,エンディアメント
ドラゴンウィザード,ティンバーカントリー(USA),グレイスマジック
ドラゴンウィスカー,スマートボーイ,ヘヴンズカーニバル
ドラゴンエアル,タイムパラドックス,シルクアウローラ
ドラゴンオサム,クロフネ(USA),リンガスマドンナ
ドラゴンカップ,ステイゴールド,シルヴァーカップ(IRE)
ドラゴンカントリー,ティンバーカントリー(USA),ミホダイリン
ドラゴンクイン,シルバーチャーム(USA),サクラマシェリ
ドラゴンゲート,メイショウボーラー,デュークタイフーン
ドラゴンシュバリエ,ダイワメジャー,シェルズレイ
ドラゴンズタイム,ブライアンズタイム(USA),ジョウノオーロラ
ドラゴンストリート,ディープインパクト,フィラストリート(USA)
ドラゴンストーム,ハーツクライ,ストームホイッスル
ドラゴンダナ,ゼンノロブロイ,シーガルサリー
ドラゴンチャンプ,ゼンノドラゴン(USA),サダムヴィーナス
ドラゴンテリー,ディープインパクト,コージーロージー(USA)
ドラゴンバローズ,キングカメハメハ,ポーリッシュピンク(IRE)
ドラゴンハート,オウケンブルースリ,アルフィルク
ドラゴンブラック,バブルガムフェロー,レジェルマン
ドラゴンホマレ,トーセンホマレボシ,プラチナチャリス(GB)
ドラゴンボーテ,タニノギムレット,フサイチアイビー(USA)
ドラゴンボート,ロードアルティマ(USA),トミーラヴ
ドラゴンホール,ストロングリターン,サンゴノウミヲ
ドラゴンマジック,ステイゴールド,マジカルウーマン
ドラゴンマッチョ,Macho Uno(USA),ジュエルオブジュエルズ(USA)
ドラゴンランス,ドリームジャーニー,カレイジャスミン
トラジェクトリー,バゴ(FR),ミスティーダンス
ドラジュワール,キングズベスト(USA),パーカーズミル
トラスト,スクリーンヒーロー,グローリサンディ
トラストアゲン,フレンチデピュティ(USA),テレフォニカ(USA)
トラストエンジェル,ストーミングホーム(GB),タイキプレリュード(USA)
トラストケンシン,ハーツクライ,アフェランドラ
トラストスパイダー,ディープインパクト,ストーミーウェザー(USA)
トラストティール,ドリームジャーニー,シャンハイレディ
トラストテッペン,トランセンド,カウントオンミー
トラストナイト,シンボリクリスエス(USA),ミスフーバフーバ(USA)
トラストノブナガ,ヘニーヒューズ(USA),ロイヤルリネージ(AUS)
トラストハート,ストーミングホーム(GB),アールヴィストーゾ
トラストピカリ,ローエングリン,スウィフトレディー
トラストマヴィア,シンボリクリスエス(USA),ストーミーウェザー(USA)
トラストユキムラ,シニスターミニスター(USA),スプリームスー(IRE)
トラストレイカ,ケイムホーム(USA),シャコージュノー
トラストロン,ヘニーヒューズ(USA),セイントブルック(USA)
ドラセナ,ルーラーシップ,アドマイヤラック
トラソニャータ,ルーラーシップ,ストラスペイ
トラネコ,スズカマンボ,ヒミノオトヒメ
トラファイアー,ディープブリランテ,スールドゥカノウ
トラベリング,ゴールドアリュール,シークレットジプシー(USA)
ドラマクイーン,パイロ(USA),リスティアエナー
ドラマチック,フレンチデピュティ(USA),アタランテ
ドラマチックコード,ロッコウオロシ(USA),ハギノローザ
ドラム,アドマイヤムーン,シンバル２(IRE)
ドラムスティック,ロージズインメイ(USA),パーカッショニスト
ドラヤキ,アンライバルド,シナンジュ
トランヴェール,アグネスデジタル(USA),ロマンスプレゼント
トランキーロ,ハーツクライ,ナヴィガトリア
ドランケンマスター,メジロベイリー,ミスザイール
トランシャン,アイルハヴアナザー(USA),ティアランドール(USA)
トランスパレント,シンボリクリスエス(USA),ダノンベルベール
トランプ,ショウナンカンプ,アマビリータ
トリアエズナマ,ヘニーヒューズ(USA),ダービーキングダム(GB)
トリオンフ,タートルボウル(IRE),メジロトンキニーズ
ドリカムテイオー,ブラックタキシード,ミッキーミッキー
トリガーゾーン,サマーバード(USA),タイフウジョオー
トリコロールブルー,ステイゴールド,ペンカナプリンセス(IRE)
トリコロールライト,ローエングリン,アロマキャンドル
トリック,トーセンジョーダン,スターシンフォニー
トリックコンボ,メイショウボーラー,フリーソウル
トリップオブラブ,サクラプレジデント,クイーンモモコ
トリニダード,プリサイスエンド(USA),シャイニングアイズ
トリニティチャーチ,ワイルドラッシュ(USA),フリーダムトレイル
トリニティハート,マツリダゴッホ,トウカイデンヒル
トリプライト,ワイルドラッシュ(USA),タンザナイト
トリプルアロー,アンライバルド,マザーロード
トリプルキセキ,キンシャサノキセキ(AUS),アモリスト(USA)
トリプルスリー,コンデュイット(IRE),トリプルリーチ
トリプルベル,ハービンジャー(GB),ツクバエトワール
トリプルレインボー,トビーズコーナー(USA),ラブレインボー
ドリュウ,タイムパラドックス,ダブルプライム
トリリオネア(GB),Dubawi(IRE),Many Colours(GB)
ドリーミーモトヒメ,ハイアーゲーム,ローレルドリーム
ドリームアチーブ,ルールオブロー(USA),バンブーズルド
ドリームアプローズ,ナカヤマフェスタ,トップビクトリア
ドリームアロー,トランセンド,パシャ
ドリームイースト,キングヘイロー,ドリームレインボー
ドリームエルダー,スターリングローズ,スパイシー
ドリームオブユー,シンボリクリスエス(USA),ジューンアナガリス
ドリームガイド,マイネルラヴ(USA),マーガレットママ
ドリームガーサント,トビーズコーナー(USA),ドリームゴールド
ドリームキャンパス,バトルプラン(USA),ファインミスト
ドリームキラリ(USA),Giant's Causeway(USA),Truant
ドリームキング,サウスヴィグラス(USA),ドリームダイヤ
ドリームキングダム,マンハッタンカフェ,ドリームダイヤ
ドリームクリスマス,サウスヴィグラス(USA),ドリームレインボー
ドリームコンサート,サウスヴィグラス(USA),ウィーンコンサート
ドリームシイ,アポロキングダム(USA),セレナーデ
ドリームジェダイ,サムライハート,ジュリエトウショウ(USA)
ドリームジャンボ,ベーカバド(FR),ピュアドリーム
ドリームシューター,フサイチコンコルド,ホールオブフェーム
ドリームスイーブル,ミリオンディスク,バトルバーズアイ
ドリームスカイハイ,ディープスカイ,シーズババズディライト(USA)
ドリームスピリット,ディープブリランテ,ティーアイディップ
ドリームスピード,アグネスデジタル(USA),ドリームレインボー
ドリームズライン,ドリームジャーニー,ジョディーズライン
ドリームセオリー,ステイゴールド,ドリームスキーム(GB)
ドリームセンス,シンボリクリスエス(USA),パインブライト
ドリームソルジャー,ドリームジャーニー,カレイメモワール
ドリームタイド,ブラックタイド,コスモトップレディ
ドリームタイム,サイレントディール,スーパーシンガー
ドリームダンサー,ドリームジャーニー,ドリームレインボー
ドリームダークアイ,アドマイヤマックス,ドリームダンシーズ
ドリームチャイルド,ネイティヴハート,セレナーデ
ドリームチーフ,ドリームスプレッド,シルクストレイン
ドリームディバ,トワイニング(USA),マリンパンサー
ドリームデーア,シンボリクリスエス(USA),ドリームヒット
ドリームドルチェ,マイネルラヴ(USA),オリジナルデザート
ドリームネイチヤー,ロージズインメイ(USA),ルナトウショウ
ドリームパッカード,パイロ(USA),ドリームゴールド
ドリームハヤテ,メイショウボーラー,トーホウハヤカゼ
ドリームパワー,キングヘイロー,ニシノコマチ
ドリームバンバン,トランセンド,タケノチャンス
ドリームピサ,ヴィクトワールピサ,ウェーブクイーン
ドリームファイア,オンファイア,ガッドジーン
ドリームフェア,タニノギムレット,スターオブブリッジ
ドリームフォー,パイロ(USA),エターナルドリーム
ドリームプランナー,ワークフォース(GB),シビサーバ(USA)
ドリームブルー,ナカヤマフェスタ,サンターナズソング
ドリームポリーニ,タイキシャトル(USA),クールレディ
ドリームマオ,ゴールドアリュール,ドリームレインボー
ドリームマジック,ルーラーシップ,スターリットラヴ
ドリームマークス,フサイチリシャール,ローレンシーバード
ドリームミリオン,ステイゴールド,ドリームヴィーナス
ドリームメダリスト,サウスヴィグラス(USA),ドリームマイウエイ
ドリームライザー,エスポワールシチー,ポリリズム
ドリームリヴァール,タニノギムレット,リヴァリーガーデン
ドリームリン,キンシャサノキセキ(AUS),スカイノリン
トルシュローズ,アグネスデジタル(USA),ガリカローズ
トルストイ,ディープインパクト,グレースアドマイヤ
トルセドール(USA),Malibu Moon(USA),Travelator(USA)
ドルチェラヴィータ,ルーラーシップ,エメラルドヴァレー
ドルチェリア,エンパイアメーカー(USA),テンザンデザート
ドルチェレガート,マツリダゴッホ,シルキードルチェ
ドルチャーリオ,アドマイヤムーン,ラドルチェ(USA)
ドルドルエイト,サムライハート,ノーブルペニー(USA)
ドルドルレヴェ,シニスターミニスター(USA),サクラオンハート
トルナベント,フィガロ(USA),モエレピンクレディ
トルネードアレイ,ディープインパクト,ブルーミングアレー
トルネードトウホウ,サンライズバッカス,ハロードリーム
ドルフィンマーク,ヴィクトワールピサ,レッドクローシュ
トルペード,ケイムホーム(USA),サイエンスアカデミー(USA)
トルマリ,キンシャサノキセキ(AUS),ピンクトルマリン(USA)
ドルメロ,エンパイアメーカー(USA),チェリーエンジェル
ドルンベルガー,タイキシャトル(USA),ドナマッハ
トルークマクト,アドマイヤジャパン,ロゼ
トレヴィフ,ケイムホーム(USA),タガノザイア
トレクァルティスタ,キングカメハメハ,ハッピーパス
ドレサージュ,ステイゴールド,アジアンミーティア(USA)
トレジャーガール,ロードアルティマ(USA),テイエムブルーアイ
トレジャード,タイキシャトル(USA),コウヨウルビー
トレジャートローヴ,ハービンジャー(GB),ローザブランカ
トレジャーマップ,ステイゴールド,ポイントフラッグ
ドレスアフェアー,スペシャルウィーク,ジェミードレス
トレスグスト,ダイワメジャー,キープザフェイス
ドレストゥナインズ,キングヘイロー,ダイナグロリア
ドレストップ,ロードアルティマ(USA),ドレスウェーブ
ドレッドノータス,ハービンジャー(GB),ディアデラノビア
ドレッドノート,メイショウオウドウ,ボンヌマール
トレノフレイバー,カネヒキリ,ローズドサハラ
トレボーネ,アグネスデジタル(USA),ハートフルボイス
ドレミファドン,スパイキュール,スターフェスタ
トレンドマーク,サムライハート,ソフトタッチ
トレンドライン,カジノドライヴ(USA),ポップチャート
ドレーク,ルーラーシップ,ディアアドマイヤ
トレースイスラ,サウスヴィグラス(USA),メイショウオウヒ
トロイメライ,アグネスデジタル(USA),ストロングレダ
トロヴァオ,カネヒキリ,サワズソング(USA)
ドロウアカード,ダイワメジャー,アスドゥクール
ドロカリス,デュランダル,ベラミカントリー
ドロダンゴ,ザール(GB),アイノブリーズ
ドロップゴール,ヨハネスブルグ(USA),グローリアスデイズ
ドロテーア,ノヴェリスト(IRE),レティセントガール
トロハ,ワークフォース(GB),サルスエラ
トロピカルガーデン,ハイアーゲーム,ウディバードソング(USA)
トロピカルストーム,ハービンジャー(GB),シーサイドブリーズ
トロピカルスパート,フリオーソ,タヒチアンメモリ
トロワゼトワル,ロードカナロア,セコンドピアット
トロントテソーロ(USA),Shanghai Bobby(USA),Rhapsody Queen(USA)
トワイニングウルフ,トワイニング(USA),フォアボード
トワイライトタイム,マンハッタンカフェ,レディトゥプリーズ(USA)
トワイライトライフ,ゴールドアリュール,ラプターセイハート
トワノホホエミ,スペシャルウィーク,シェイクラブハート
トワノユメ,トワイニング(USA),パピチャン
トワードポラリス,ダイワメジャー,ノヴァホーク(GB)
ドンアルゴス,ドリームジャーニー,ドナフュージョン
トンイ,ディープブリランテ,プランシングレディ
ドンカスターボーイ,カネヒキリ,エララ
ドンゲイボルグ,スウェプトオーヴァーボード(USA),スカアハ
ドンコルネ,タイムパラドックス,アイランドカフェ
トンドゥアモール,スパイキュール,オリジナルデザート
ドントウォーリー,スパイキュール,エスケイチャーミイ
トントンソーモ,ディープスカイ,ベレッツァ
ドンナディヴィーノ,メイショウボーラー,ウインパレード
ドンナビアンカ,ゴールドアリュール,ファンドリオボッコ
ドンナマニーフィカ,ホワイトマズル(GB),クールトップレディ
ドンナモンジャ,フサイチリシャール,シルキーブリス
ドンヒューズ,ヘニーヒューズ(USA),ヒアーズトウショウ
ドンビー,タイムパラドックス,ヒカルカグヤヒメ
ドンビーアフレイド,トーセンブライト,パームアイランド
ドンフィアレス,ワークフォース(GB),シルクメガヒット
ドンフォルティス,ヘニーヒューズ(USA),グロッタアズーラ
ドンプリムローズ,ゴールドヘイロー,ヴィジョンサクラ
ドンブルーローズ,キンシャサノキセキ(AUS),ヴァリュー(USA)
トンボイ,アドマイヤマックス,ショウナンアオバ
ドンボラーレ,ドリームジャーニー,リキマドレード(USA)
ドンマネー,アグネスデジタル(USA),ドナビジュー
ドンレッドローズ,スターリングローズ,スマイリングルーラ
トーア,ディープブリランテ,リーピングキャット(USA)
トーアアサヒ,サムライハート,トーアトワイライト
トーアアステリオス,アルデバラン２(USA),トーアミッシェル
トーアヴェルドン,ケイムホーム(USA),トーアツキアカリ
トーアウラシマ,ファルブラヴ(IRE),トーアタマテバコ
トーアエグレット,スマートファルコン,トーアプルメリア
トーアカグヤヒメ,サムライハート,トーアタマテバコ
トーアコロチャン,スマートボーイ,トーアスカイヴュー
トーアシラヌイ,メイショウボーラー,トーアプルメリア
トーアスサノオー,カリズマティック(USA),トーアセンヒメ
トーアセレーネ,バゴ(FR),トーアクレセント
トーアチチカカ,チチカステナンゴ(FR),トーアトワイライト
トーアツキヒカリ,ルーラーシップ,トーアツキアカリ
トーアディラン,カンパニー,トーアビバリーヒル
トーアノタメニ,チーフベアハート(CAN),トーアミッシェル
トーアバカラ,カジノドライヴ(USA),トーアセンヒメ
トーアヒマワリ,ファルブラヴ(IRE),トーアクレセント
トーアヒミコ,クロフネ(USA),トーアセンヒメ
トーアプリンセス,オルフェーヴル,ピンクファンタジー
トーアライジン,デュランダル,トーアライトニング
トーアリズム,ソングオブウインド,トーアライトニング
トーアレラ,ハーツクライ,トーアライトニング
トーイイースター,ビービーガルダン,ターフエヴォルヴ
トーイティアモー,ダノンシャンティ,ビクトリアクロス
トーイハクレン,スターリングローズ,ウインレコード
トーイレッカー,ジャイアントレッカー(USA),カンタベリービート
ドーヴァー,アドマイヤムーン,オルダニー(USA)
トーキョーキッド,カジノドライヴ(USA),ジェイケイシャトル
トーキングドラム,キングカメハメハ,トランシーフレーズ
トークトゥハー,カネヒキリ,プリティーサンサン
トークフレンドリー,クロフネ(USA),マルカフレンドリー
トークーアルタイル,モンテロッソ(GB),ヒシヴェリタス
トークーブケパロス,タイムパラドックス,サンデーシャドウ
トーコーヴィーナス,クロフネ(USA),ホーネットピアス
トーコーウラノス,ゴールドアリュール,ヒシアイドル
トーコーガイア,ゴールドアリュール,アナスコール(USA)
トーコーグリーン,アグネスタキオン,ヴェスタ(USA)
トーコージュエリー,ジャングルポケット,プラチナベール
トーコーディオーネ,エンパイアメーカー(USA),タイキメビウス
トーコープラネット,ネオユニヴァース,マダムチェロキー
トーコーブリザード,マツリダゴッホ,スノースタイル
トーコーポセイドン,キングカメハメハ,クルザダアメリカーナ(BRZ)
トーコーメロディ,ヤマニンセラフィム,サウンドアメニティ
トーコーリバース,ハービンジャー(GB),マイケイティーズ
トーコーロマン,ロドリゴデトリアーノ(USA),オーナーズクリーク
トーシンキング,ベーカバド(FR),オグリダイアン
トーシンコンタント,プリサイスエンド(USA),ラブハミング
トーシンヌメラトム,トーセンホマレボシ,コフィーチャン
トーシンバルゲルド,ジャングルポケット,マキハタスリリング
トーシンラルジャン,リーチザクラウン,オンリーザロンリー(FR)
トーセンアイトーン,ステイゴールド,ノヴァホーク(GB)
トーセンアスター,エイシンフラッシュ,タチアナ
トーセンアッシャー,マンハッタンカフェ,トーセントップラン
トーセンアペリラ,トーセンブライト,トーセンユーモア
トーセンアマリリス,トーセンモナーク,トーセンビーナス
トーセンアリエス,トーセンモナーク,トーセンクレスト
トーセンアルタイル,ハービンジャー(GB),ケアレスウィスパー
トーセンアルバータ(AUS),More Than Ready(USA),アルヴァータ(AUS)
トーセンアレス,アドマイヤドン,レース(USA)
トーセンアンタレス,ヨハネスブルグ(USA),アドマイヤキャロル
トーセンアンバー,ディープインパクト,ワルツオブキャット
トーセンヴァロン,ディープインパクト,ベルワトリング(CHI)
トーセンヴィガー,トーセンホマレボシ,ペルヴィアンリリー
トーセンウィズダム,トーセンロレンス,トーセンムンク
トーセンウィナー,トーセンホマレボシ,トーセンミネルバ
トーセンウインク,トーセンロレンス,アードゥイン(GB)
トーセンヴィータ,トーセンホマレボシ,トーセンフリージア
トーセンヴェント,トーセンホマレボシ,ビオンドパンテーラ
トーセンエアリー,トーセンホマレボシ,レッドヴォーグ
トーセンエクラ,トーセンホマレボシ,トーセンブリリアン
トーセンエターナル,トーセンブライト,エターナルレイズ
トーセンエピソード,トーセンファントム,トーセンソニア
トーセンエポナ,ジャングルポケット,トーセンエトワール
トーセンオービット,トーセンモナーク,トーセンバスケット
トーセンカナロア,ブラックタイド,メジロレント
トーセンカノープス,ノヴェリスト(IRE),エリーゼパレス(IRE)
トーセンカリーナ,トーセンブライト,トーセンメッツ
トーセンキャニオン,トーセンブライト,トーセンママレード
トーセンクラージュ,アイルハヴアナザー(USA),スペシャライズ
トーセンクリス(AUS),Redoute's Choice(AUS),Weekend Beauty(AUS)
トーセンクリーガー,トーセンロレンス,トーセンスクリュー
トーセンクルーズ,トーセンブライト,トーセンヴェール
トーセングロウ,トーセンブライト,トーセンビクトリア
トーセンクロノス,ヨハネスブルグ(USA),ジーントウショウ
トーセングロリア,シンボリクリスエス(USA),バーガンディレッド(USA)
トーセンコスモ,グラスワンダー(USA),トーセンサファイア
トーセンジャスパー,トーセンファントム,トーセンディオール
トーセンジョリー,ワークフォース(GB),トーセンウェルカム
トーセンスティール,フレンチデピュティ(USA),トーセンパピヨン
トーセンスパンキー,スペシャルウィーク,バースデイローズ
トーセンスピネル,トーセンホマレボシ,カネトシコンサイス(USA)
トーセンスラッガー,ヴァーミリアン,スギノセンヒメ
トーセンスーリヤ,ローエングリン,トーセンガラシャ
トーセンセラヴィ,ディープインパクト,トーセンジョウオー
トーセンゼロス,エンパイアメーカー(USA),エリモエポナ
トーセンデューク,ディープインパクト,スーア(IRE)
トーセンニケ,オルフェーヴル,ブライトメッセージ
トーセンノワール,トーセンブライト,シャトーノワール
トーセンバジル,ハービンジャー(GB),ケアレスウィスパー
トーセンパッソ,トーセンブライト,リエートフィーネ
トーセンハリケーン,シンボリクリスエス(USA),トーセンハピネス
トーセンハルカ,ロジユニヴァース,シルクフレアー(USA)
トーセンハルカゼ,キングカメハメハ,トーセンハピネス
トーセンバーディー,トーセンモナーク,トーセンエッセンス
トーセンビクトリー,キングカメハメハ,トゥザヴィクトリー
トーセンフェイム,コンデュイット(IRE),トーセンティアラ
トーセンフォース,トーセンモナーク,トーセンマッハ
