
トーセンプラウド,トーセンファントム,トーセンスマッシュ
トーセンブル,トーセンブライト,トーセンクラッチ
トーセンプルメリア,アグネスデジタル(USA),トーセンアイリス
トーセンブレイヴ,キングカメハメハ,ギーニョ
トーセンブレス,ディープインパクト,ブルーミンバー
トーセンフレール,ベーカバド(FR),エルフィンパーク
トーセンフローラ,コンデュイット(IRE),トーセンラピュタ
トーセンペンタゴン,シンボリクリスエス(USA),トーセンキャッスル
トーセンマタコイヤ,ディープインパクト,ミュージカルウェイ(FR)
トーセンマティーニ,タートルボウル(IRE),トーセンオーラ
トーセンミッション,アグネスデジタル(USA),バーガンディレッド(USA)
トーセンミラージュ,スペシャルウィーク,ティエッチマンボ(USA)
トーセンメテオ,ワークフォース(GB),トーセンプリンセス
トーセンメリッサ,トーセンブライト,トーセンマドンナ
トーセンモナルカ,キングカメハメハ,トーセンジョウオー
トーセンラーク,アルデバラン２(USA),タケイチゼット
トーセンリゲル,グラスワンダー(USA),レッドフォーリア
トーセンリラ,トーセンブライト,トーセンデイジー
トーセンルドラ,トーセンホマレボシ,トーセンインディ
トーセンループス,トーセンロレンス,ベビーキール
トーセンレオ,トーセンロレンス,スマイルサポート
トーセンロザリオ(IRE),Galileo(IRE),Dance For Fun(GB)
トータルソッカー,ダンスインザダーク,ウェンブリー
トータルビクトリー,ファスリエフ(USA),ベネチアンテンズ
トータルプラス,ローズキングダム,ラビングトスカーナ
トータルマジック,ハーツクライ,マヤノアブソルート
トーテムラリー,ハーツクライ,ペッシュドール
トーバスヌーマ,ワークフォース(GB),ヴァインバッハ
ドーファン,ルーラーシップ,シャルロットノアル
トーホウアイレス,ハーツクライ,トーホウドルチェ
トーホウアルテミス,ハーツクライ,トーホウガイア(USA)
トーホウウノ,ハービンジャー(GB),アドマイヤスペース
トーホウエネロ,クロフネ(USA),トーホウアモーレ
トーホウカトレア,キングズベスト(USA),トーホウアモーレ
トーホウガーベラ,ハービンジャー(GB),エーシンアガペー
トーホウキャサリン,キングズベスト(USA),クーヴェルチュール
トーホウグラマラス,エンパイアメーカー(USA),シャインエフォート
トーホウグローリー,ネオユニヴァース,トーホウメドゥーサ(USA)
トーホウケタール,ワークフォース(GB),トーホウスキャット
トーホウシルエット,トーホウエンペラー,トーホウグレース
トーホウシーマ,ハーツクライ,トーホウビーナス
トーホウスペンサー,ジャングルポケット,トーホウアモーレ
トーホウスマート,ネオユニヴァース,トーホウアスカ
トーホウディアーナ,ノヴェリスト(IRE),ヴァルホーリング(GB)
トーホウデサント,ジャングルポケット,トーホウビーナス
トーホウドミンゴ,ネオユニヴァース,トーホウリッチ
トーホウトリニティ,ダンスインザダーク,トーホウレビン
トーホウノブナガ,トーホウエンペラー,トーホウカウンター
トーホウハニー,ステイゴールド,トーホウメドゥーサ(USA)
トーホウハンター,アグネスデジタル(USA),トーホウヘレン
トーホウピアノ,ジャングルポケット,トーホウグリーン
トーホウビスカヤ,ストリートセンス(USA),ビーナスライン
トーホウビースト,トーホウエンペラー,トーホウフローラ(USA)
トーホウフライト,スズカマンボ,トーホウリッチ
トーホウボニータ,クロフネ(USA),タイセイハニー
トーホウボンバー,ファンタスティックライト(USA),トーホウアイリス
トーホウリリー,ネオユニヴァース,トーホウガイア(USA)
トーホウリーガル,シンボリクリスエス(USA),トーホウクラウン
トーホウレジーナ,キングズベスト(USA),トーホウアスカ
トーホウレゼルヴ,ゼンノロブロイ,トーホウアスカ
トーホクアロー,ウイングアロー,トランスパランス
トーホクガッテン,メジロベイリー,ガッテンモントレー
トーホククロス,ウイングアロー,アキノクロス
トーホクコルト,メジロベイリー,トランスパランス
トーホクスマイル,ウイングアロー,トランスパランス
トーホクダッシュ,キンググローリアス(USA),アキノクロス
トーホクノキズナ,ウイングアロー,チアズフリート
トーホクフェアリー,ウイングアロー,トランスパランス
トーマス,シンボリクリスエス(USA),コウヨウアイリーン
ドーモスイマセン,ロードアルティマ(USA),ナナコフレスコ
トーヨーエース,キンシャサノキセキ(AUS),フラワーアーチ(IRE)
トーヨーピース,ホワイトマズル(GB),ドラゴンフラワー
トーラスクイーン,スペシャルウィーク,ピシーズクイーン
トーラスジェミニ,キングズベスト(USA),エリモエトワール
