

ナイア,ルーラーシップ,カトルズリップス
ナイアガラモンロー,アドマイヤムーン,マルハチメイフェア
ナイキアドヴァンス,サムライハート,ナイキアクトレス
ナイキアフォード,タイムパラドックス,ナイキアクトレス
ナイキスパークル,スパイキュール,ナイキアクトレス
ナイキフェイム,サイレントディール,ナイキアクトレス
ナイスヴィグラス,サウスヴィグラス(USA),ナイストップクイン
ナイスガイラバー,キングカメハメハ,オートサンデー
ナイスキック,パイロ(USA),ナカヤマブリーズ
ナイスジャスミン,プリサイスエンド(USA),ジツリキオーシャン
ナイスドゥ,フサイチセブン,ナイスヴァレー
ナイスポジション,ショウナンカンプ,エレガンス
ナイスワン,フサイチリシャール,ジョージアンベイ(USA)
ナイツブリッジ,キンシャサノキセキ(AUS),スペシャルポケット
ナイトインブラック,ローエングリン,ステレオタイプ
ナイトオブスターズ(IRE),Sea The Stars(IRE),Rub a Dub Dub(GB)
ナイトオブナイツ,ハービンジャー(GB),シャイニングアレキ
ナイトジュレップ,マツリダゴッホ,タニノジュレップ
ナイトスカイ,ディープスカイ,テイクマイミラクル
ナイトスプライト,タートルボウル(IRE),サザンフェアリー(USA)
ナイトタイム,オレハマッテルゼ,クリスティビーム
ナイトバナレット,ディープブリランテ,ナイキフェイバー(USA)
ナイトフィーバー,サウスヴィグラス(USA),スズカノオジョー
ナイトフォックス,サクラバクシンオー,アドマイヤシズカ
ナイトブラスター,カネヒキリ,ユタカヒメ
ナイトブルーミング,リンカーン,フックライン(GB)
ナイトミュージアム,ディープインパクト,ニンフェアアルバ(IRE)
ナイトメア,アイルハヴアナザー(USA),チアフルドーラ(USA)
ナイトレイド,ローエングリン,プレンティフェスタ
ナイトレイン,ゴールドアリュール,シーズインクルーデッド(USA)
ナイルストーリー(USA),Pioneerof the Nile(USA),Princess Two(USA)
ナイルデルタ,タートルボウル(IRE),アレキサンドリア
ナインオクロック(USA),Bodemeister(USA),Cleverconversation(USA)
ナインゴラン,コンデュイット(IRE),モエレカトリーナ
ナインテイルズ,ローエングリン,マイネフォクシー
ナインハーフ,ワイルドラッシュ(USA),メジロベイシンガー
ナインハーモニー,エイシンフラッシュ,ハミングライフ
ナウシカ,タニノギムレット,タニノローゼ
ナウパカ,フリオーソ,エリモエトワール
ナヴラトリ,ヴァーミリアン,スヴレッタ(USA)
ナオアンドユリ,ローエングリン,スリータキオン
ナオトラ,バトルプラン(USA),シルクプリズム
ナオミノエガオ,ステイゴールド,ゴーオンマイウェイ
ナガイスパン,ナカヤマフェスタ,ミツワオーロラ
ナカザルオー,サクラプレジデント,ゲーリックキャット(USA)
ナガタウルフ,ケイムホーム(USA),ダノンクラフト
ナガラエンカ,ジャングルポケット,アンティール
ナガラオリオン,アドマイヤマックス,オオシマセリーヌ
ナガラキコウシ,メイショウボーラー,オオシマセリーヌ
ナガラスマイル,オレハマッテルゼ,トップビクトリア
ナガラスワロー,タニノギムレット,アンティール
ナガラダンサー,ナカヤマフェスタ,オオシマセリーヌ
ナガラフライト,スタチューオブリバティ(USA),オオシマセリーヌ
ナガラフラワー,ダンスインザダーク,ガリカローズ
ナガラブレーブ,メイショウボーラー,コートリーブレーヴ
ナガラリバー,ジャングルポケット,アンティール
ナゲッツ,ベーカバド(FR),マチカネホホエミ
ナスタイザン,バゴ(FR),テンザンオペラ
ナスノカツラ,ヴィクトワールピサ,ナスノフィオナ
ナスノカンザン,エンパイアメーカー(USA),ナスノフィオナ
ナスノキセキ,スウェプトオーヴァーボード(USA),センティーレ
ナスノシンフォニー,ハーツクライ,ナスノシベリウス(USA)
ナスノセイカン,ハーツクライ,ナスノフィオナ
ナスノチドリ,ダノンシャンティ,ユーチャリス(USA)
ナスノフラッシュ(USA),Sidney's Candy,Royalstraightflush(USA)
ナスレンザン,メイショウボーラー,テンザンオペラ
ナタリーバローズ,メイショウサムソン,ルビーレジェンド
ナターシャ,スズカマンボ,デューントウショウ
ナチュラリー,ゴールドヘイロー,マジックウェーブ
ナチュラルキラー,カジノドライヴ(USA),リルティングソング
ナチュラルシンジュ,オウケンブルースリ,ナチュラルナイン
ナチュラルビート,アサクサデンエン(GB),フジヤマビジン
ナチュラルワンダー,Malibu Moon(USA),パーティミニスター(USA)
ナチュレルギエム,ゴールドアリュール,アワシャ(IRE)
ナツ,アドマイヤオーラ,メイショウヤマブキ
ナツィオナーレ,タニノギムレット,ラウリシルヴァ
ナックオトメ,フリオーソ,ナックザトモミ
ナックグラフィー,ダノンシャンティ,シルクグラフィック
ナックコウテイ,タニノギムレット,ホッジポッジ
ナックコマチ,カネヒキリ,ナックザトモミ
ナックテイオー,ゴールドアリュール,チャーミングクリス(USA)
ナックビーナス,ダイワメジャー,レディトゥプリーズ(USA)
ナックマカロン,キャプテンスティーヴ(USA),ナックトップロード
ナックムスメ,フリオーソ,ナックトップロード
ナツコダチ,ファスリエフ(USA),マヤノラトゥール
ナッシング,アッミラーレ,トップロンシャン
ナッシングエルス,ダノンシャンティ,スマイルプライズ
ナッツスター,マツリダゴッホ,ヴンダーゾンネ
ナットレッドスカイ,アメリカンボス(USA),ホライズンピアス
ナツミチャン,ローエングリン,スカーレットミカ
ナツミプレジール,エスポワールシチー,シンコウベルデ
ナディア,ノヴェリスト(IRE),カスクドール
ナディエージダ,フレンチデピュティ(USA),ワンモアグリッター
ナデシコスピリッツ,フサイチコンコルド,オークスピリッツ
ナデシコハート,ヤマニンセラフィム,スターリーナイト
ナナコ,ナカヤマフェスタ,マイウィン
ナナセマル,ディープブリランテ,シャドウキャスター
ナナチャンプ,シニスターミニスター(USA),シルキーリゾート
ナナナモエ,サウスヴィグラス(USA),タイムトゥラン
ナナパンチ,ショウナンカンプ,ブラックジョーク
ナナヒカリ,カネヒキリ,ルートファイブ
ナナヨンハーバー,タイムパラドックス,ビエントハーバー
ナナルテア,オルフェーヴル,ヨナグッチ(USA)
ナニスンネン,クロフネ(USA),スギノフォルモーザ
ナノセカンド,キンシャサノキセキ(AUS),スイートチャーム(USA)
ナハストーン,キングカメハメハ,ザグレース
ナホラフェット,キングヘイロー,スウィープイン
ナポリタン,ヴィクトワールピサ,ピサノグレース
ナポレオン,ハービンジャー(GB),ミメティコ(IRE)
ナポレオンズワード,エンパイアメーカー(USA),オーサムチャーム(USA)
ナマシボリ,カジノドライヴ(USA),ソトーグラシオ
ナマハゲ,エイシンアポロン(USA),オリエントサンデー
ナミカゼ,マヤノトップガン,イシノスター
ナムラアイアイサー,ヨハネスブルグ(USA),ナムラドロシー
ナムラアヴィ,サマーバード(USA),ナムラドロシー
ナムラアッパレ,ネオユニヴァース,ナムラミーティア
ナムラアッパー,カンパニー,ナムラハル
ナムラアラシ,エンパイアメーカー(USA),ナムラシゲコ
ナムラアリス,ディープブリランテ,ナムラアピア
ナムラアース,アドマイヤムーン,ビストロドゥパリ
ナムライチバンボシ,フサイチリシャール,サドーダンサー
ナムライットウセイ,ヤマニンセラフィム,ナムラカエデジョウ
ナムライッポン,ストーミングホーム(GB),ナムラハル
ナムラウラン,ケイムホーム(USA),ナムラレガシー
ナムラエルサ,マツリダゴッホ,レーヌヴェルト
ナムラオウテ,ロージズインメイ(USA),ストロングソレイユ
ナムラオッケー,ヨハネスブルグ(USA),ナムラミーティア
ナムラオニヘイ,ヨハネスブルグ(USA),ナムラボルテージ
ナムラオルガ,トゥザグローリー,ナムラカメーリア
ナムラカグヤヒメ,エンパイアメーカー(USA),ナムラウタヒメ
ナムラカブト,トーセンホマレボシ,ナムラナデシコ
ナムラカメタロー,ヨハネスブルグ(USA),ナムラチアーズ
ナムラガンバロー,ダノンシャンティ,ナムラエメラルド
ナムラガンマン,ヨハネスブルグ(USA),ナムラシャルマン
ナムラキヌ,ゼンノロブロイ,ナムラシゲコ
ナムラキンボシ,ゴールドアリュール,ゴールドオアシス
ナムラクロエ,サマーバード(USA),ナムラカメーリア
ナムラゴエモン,ディープスカイ,クロスシーカー
ナムラサラ,カンパニー,ニュートラディション(FR)
ナムラシェパード,ヨハネスブルグ(USA),パンカティリオ(USA)
ナムラシシマル,アポロキングダム(USA),ナムラネネ
ナムラシャーク,スマートファルコン,アーダーチャリス
ナムラジュノー,トーセンホマレボシ,ナムラビーム
ナムラジョニー,ダンカーク(USA),ナムラビーム
ナムラシロッコ,トーセンホマレボシ,ナムラアトラクト
ナムラシンウチ,ゼンノロブロイ,ナムラシゲコ
ナムラシングン,ヴィクトワールピサ,ドリームオブジェニー(FR)
ナムラシンゲキ,トゥザグローリー,カイテキセレブ
ナムラスター,スニッツェル(AUS),ガーネットスター
ナムラストレート,エンパイアメーカー(USA),ソアリングピアス
ナムラストロベリー,ヨハネスブルグ(USA),ナムラチアーズ
ナムラスパルタクス,カネヒキリ,ストロングソレイユ
ナムラセンリョウ,ストロングリターン,セシルカット
ナムラタイショウ,アドマイヤジャパン,ネクストタイム
ナムラダイダロス,トーセンホマレボシ,ナムラユリア
ナムラタマ,エイシンフラッシュ,エメラルドリバー
ナムラタメゴロー,ディープブリランテ,ナムラキャサリン
ナムラチヨガミ,ヨハネスブルグ(USA),サンクイーン２(USA)
ナムラテンゲル,トゥザグローリー,ドリームティアラ
ナムラドノヴァン,ディープブリランテ,パンカティリオ(USA)
ナムラドリー,トーセンホマレボシ,ナムラアピア
ナムラナマステ,トーセンホマレボシ,ナムラグルーヴ
ナムラノール,マツリダゴッホ,ナムラマリオン
ナムラバイオレット,チーフベアハート(CAN),ナムラテンニョ
ナムラバウアー,トーセンホマレボシ,ナムラチアーズ
ナムラバクサイ,ワイルドラッシュ(USA),ナムラミステリー
ナムラハリー,ワイルドラッシュ(USA),ナムラエフォート
ナムラハレルヤ,ワークフォース(GB),ナムラキャサリン
ナムラバンザイ,ヨハネスブルグ(USA),ソアリングピアス
ナムラハンベエ,サムライハート,ナムラカエデジョウ
ナムラピアス,アポロキングダム(USA),ソアリングピアス
ナムラヒューマン,スクリーンヒーロー,ナムラアミューズ
ナムラヒロイン,ワイルドラッシュ(USA),クールベット
ナムラファラー,トーセンホマレボシ,ナムラカメーリア
ナムラファルネーゼ,アグネスデジタル(USA),ナムラオーキッド
ナムラブル,ホワイトマズル(GB),トップレディスター
ナムラヘラクレス,カネヒキリ,ナムラカエデジョウ
ナムラホビット,ヴァーミリアン,ナムラカメーリア
ナムラボンド,ディープブリランテ,サクセスマリ
ナムラボーナス,ヨハネスブルグ(USA),ガーネットスター
ナムラマッチェリ,ディープブリランテ,ナムラケイオス
ナムラマナナ,スクリーンヒーロー,ナムラネネ
ナムラマリア,キングズベスト(USA),ナムラボルテージ
ナムラマル,スクリーンヒーロー,ピクトリアル
ナムラマントル,マツリダゴッホ,ナムラクニヒメ
ナムラミラクル,スパイキュール,アーダーチャリス
ナムラミルク,トーセンホマレボシ,ナムララピス
ナムラムツゴロー,ディープブリランテ,サンクイーン２(USA)
ナムラムラサキ,トーセンホマレボシ,ナムラオーキッド
ナムラムート,サウスヴィグラス(USA),ナムラテンニョ
ナムラメスナー,ロージズインメイ(USA),ガーネットスター
ナムラメルシー,エンパイアメーカー(USA),ディアナムラ
ナムラメロン,ベルシャザール,ナムラココロ
ナムラモア,トゥザグローリー,ピクトリアル
ナムラモンブラン,サウスヴィグラス(USA),ヘイハニー
ナムラモンロー,エンパイアメーカー(USA),ナムラドロシー
ナムラユッキー,スマートロビン,ナムラスプレンダー
ナムラユメ,ゼンノロブロイ,ビストロドゥパリ
ナムラライラ,ルーラーシップ,カイテキセレブ
ナムラランボー,エンパイアメーカー(USA),ソアリングピアス
ナムラルパン,ハーツクライ,ビストロドゥパリ
ナムラルビー,スクリーンヒーロー,ガーネットスター
ナムラルーシー,ゼンノロブロイ,ナムラアトラクト
ナモカモネ,ダノンシャンティ,リュバンドール
ナモンブライアン,ネオユニヴァース,カンタトリーチェ
ナラトゥリス,ルーラーシップ,イストワール
ナラヤマトサンザン,エスポワールシチー,レインボーデザイア
ナリイチ,ワークフォース(GB),センシュアルドレス
ナリズミー,サクラプレジデント,イノセントガール
ナリタアネラ,オペラハウス(GB),ナリタジューン
ナリタアマランサス,フリオーソ,オレゴントレイル
ナリタアマリリス,ハーツクライ,ゴールドグレース
ナリタエイト,キングカメハメハ,スペシャルフロート
ナリタカピリナ,オルフェーヴル,オースミマコ
ナリタクローネ,ジャングルポケット,ナリタジューン
ナリタゴールド,ステイゴールド,シーキングマイラブ(USA)
ナリタサウス,サウスヴィグラス(USA),ナリタルナパーク
ナリタシェリー,ネオユニヴァース,オースミリンド
ナリタシーズン,フレンチデピュティ(USA),スルーザシーズン
ナリタスターワン,ショウナンカンプ,ボーンスター
ナリタトップスター,ディープインパクト,ウェイクアップマギー(IRE)
ナリタノヘア,マンハッタンカフェ,オースミマコ
ナリタハーデス,バゴ(FR),オースミコスモ
ナリタブルー,アイルハヴアナザー(USA),フェルメールブルー
ナリタプレジデント,ディープインパクト,エイシンジョアンナ
ナリタポセイドン,ハーツクライ,マチカネハツシマダ(USA)
ナリタマカニ,ワークフォース(GB),ナリタジューン
ナリタマクリス,ダイワメジャー,マクリス
ナリタミニスター,シニスターミニスター(USA),コテキタイ
ナリタリュウ,ルーラーシップ,ナリタシークレット
ナリチュウドラゴン,スパイキュール,ジュエリーバード
ナリチュウラブ,マイネルラヴ(USA),ジラベル(USA)
ナリッシュ,ヘニーヒューズ(USA),アデュラリア
ナリノクインビー,ワークフォース(GB),ハンターズマーク(USA)
ナリノスマイル,ワークフォース(GB),グレナディーン
ナリノスワンキー,ジャングルポケット,スワンキーポーチ
ナリノメジャー,ダイワメジャー,ヴェストリーレディ(USA)
ナリノリリー,ヴァーミリアン,モアスマイル
ナリノレッドスター,スウェプトオーヴァーボード(USA),ファイブスター
ナリノレーヴドール,エイシンフラッシュ,ロンギングエリー
ナリユキマカセ,オレハマッテルゼ,ペン
ナルカミ,キンシャサノキセキ(AUS),ブリッジトウショウ
ナルトチャン,メイショウボーラー,トウカイパフィー
ナルノステファニー,ディープブリランテ,アルディーミル(USA)
ナルハヤ,サクラプレジデント,カルナアヴァンセ
ナンカイオチヨ,ヴァーミリアン,エイシンバンビーナ
ナンクルナイサー,サウスヴィグラス(USA),ナイストップクイン
ナンゴクアイネット,スターリングローズ,オーデコロン
ナンゴクハルネット,ダイワメジャー,ナンゴクプラネット
ナンゴクミチカ,オンファイア,ナンゴクプラネット
ナンゴクユメネット,カネヒキリ,スイートレジーナ
ナンゴクロックオン,ダンツシアトル(USA),テンザンヒカリ
ナンシーファミリー,タイムパラドックス,リードハイシ
ナンセイハッピー,ゴールドアリュール,ナンセイキラメキ
ナンセカンセ,フリオーソ,ディアン
ナンチンノン(USA),Parading(USA),Etro(USA)
ナンネッタ,キンシャサノキセキ(AUS),シアトルサンセット(USA)
ナンバーナイン,タニノギムレット,レインボーシックス
ナンブホマレ,ネオユニヴァース,ヒカルアルテミス
ナンベーサン,スウェプトオーヴァーボード(USA),グロッタアズーラ
ナンヨーアイリッド,ケイムホーム(USA),シンコウベルデ
ナンヨーアミーコ,ハービンジャー(GB),ピクシーダスト
ナンヨーアーミー,キングカメハメハ,シャルルヴォア
ナンヨーイヴェール,ワークフォース(GB),エーシンヴァーゴウ
ナンヨーイザヨイ,エイシンフラッシュ,シャルルヴォア
ナンヨーウゼン,クロフネ(USA),シンコウベルデ
ナンヨーウラヌス,タニノギムレット,ナンヨーサフラウア
ナンヨーエテ,ロードカナロア,ケイアイエリザベス
ナンヨーオボロヅキ,キンシャサノキセキ(AUS),モデルウォーク
ナンヨーオートヌ,キンシャサノキセキ(AUS),エイシンラトゥナ(USA)
ナンヨーシンゲツ,キングズベスト(USA),ナンヨーサフラウア
ナンヨーセゾニエ,ハービンジャー(GB),ライトレール
ナンヨーテンプル,ゼンノロブロイ,ハイカックウ
ナンヨービーナス,ルーラーシップ,アドマイヤフッキー
ナンヨーファミユ,ワイルドラッシュ(USA),フォトジェニー
ナンヨープランタン,ルーラーシップ,テキサスルビー
ナンヨーブルジョン,ヴィクトワールピサ,ミリアム
ナンヨープルートー,ディープインパクト,ハイカックウ
ナンヨーマーク,ゼンノロブロイ,フィリス
ナンヨーマーズ,ハーツクライ,アクティビスト
ナンヨーリノ,マンハッタンカフェ,イタリアンオリーブ
ナーウル,ブラックタイド,プリティアンブレラ
ナーゲルリング,レッドスパーダ,トシザコジーン
ナーゴナーゴユーリ,シニスターミニスター(USA),チキリアッパー
