
パープルプリンス,ハービンジャー(GB),メイカ
パープルミネルバ,サンライズバッカス,パープルスター
パープルローズ,ステイゴールド,ハーストーリー
パープレー,マツリダゴッホ,スカイワード
ハーベストムーン,マンハッタンカフェ,レツィーナ
バーボン,サムライハート,ラブバレンタイン
パーミストリー,アドマイヤムーン,フェンスイ(UAE)
パーミッション,ゼンノロブロイ,ヴェントス
バーミンガム,ヘニーヒューズ(USA),ファニーモーク(USA)
バーミーブリーズ,キンシャサノキセキ(AUS),ウィンドハック(GER)
バームブラック,ノヴェリスト(IRE),マイネサヴァラン
ハーモトーム,タニノギムレット,ダーティダンシング
ハーモニーウィル,サウスヴィグラス(USA),リンクシェーマ
ハーモニーウェイン,ビービーガルダン,ステイトネラ
ハーモニーエール,パーソナルラッシュ(USA),キョウワセイラン
ハーモニーゲイリー,ダノンシャンティ,ドリームモーメント(GB)
ハーモニージャック,ボストンハーバー(USA),ゴールドユウ
ハーモニードリーム,パイロ(USA),クレバードリーム
ハーモニーフェスト,アグネスデジタル(USA),ピュアフレグランス
ハーモニーフォルス,ベーカバド(FR),コトノハ
ハーモニーブラス,ヴァーミリアン,スイートライラック
ハーモニーブルラン,サウスヴィグラス(USA),プリティロマンサー
ハーモニーヘルメス,アサクサキングス,アンジュールラブ
ハーモニームジーク,フサイチリシャール,ホイレーク
ハーモニーメシアン,ホワイトマズル(GB),ホホエミ
ハーモニーライズ,メイショウボーラー,ファイヤーオパール
ハーモニールスラン,ハービンジャー(GB),バブルドリーム(FR)
パーラミター,プリサイスエンド(USA),オンリーユー
ハーランズワンダー,Awesome Again(CAN),ハーランズルビー(USA)
パーリオミノル,ディープインパクト,ヴィヴァシャスヴィヴィアン(USA)
ハーリーバーリー,パイロ(USA),アグネスパンドラ
パールアッシュ,ディープスカイ,シュシュファレル
パールウェディング(USA),Tapit(USA),Above Heaven(USA)
パールオブウエスト,ステイゴールド,グワダラハラ(GER)
パールズベスト,キングズベスト(USA),ハシッテホシーノ
バールドバイ,Dubawi(IRE),ポップアイコン
パールフューチャー,ネオユニヴァース,スターペスミツコ
ハーレック,カルストンライトオ,スノーヴァーダント
ハーレムライン,マンハッタンカフェ,マクリス
バーンザブリッジ,ネオユニヴァース,マヤノアブソルート
バーンザワールド,ヨハネスブルグ(USA),オールオールオール
バーンスター,ゼンノロブロイ,ヒシアニマ(IRE)
バーントシェンナ,カネヒキリ,ランタナ
バーンフライ,ゴールドアリュール,ロードクロサイト(USA)
