

バアサマ,エンパイアメーカー(USA),ジェニュラビーン
パイ,オンファイア,コロナドスマイル
バイアウト,キャプテントゥーレ,チケットトゥダンス(IRE)
ハイアガール,ホワイトマズル(GB),ミッキーマドラー
バイアストリート,ストリートセンス(USA),マチカネベニザクラ(IRE)
ハイアビリティー,キングヘイロー,ロッチダンス
ハイアーヴォルト,メイショウボーラー,リングフィンガー
ハイアーグラウンド,シンボリクリスエス(USA),アスピリンスノー
ハイアーパーク,ハイアーゲーム,フレンドパーク
ハイヴォルテージ,サウスヴィグラス(USA),スズカノオジョー
ハイエストクイーン,シンボリクリスエス(USA),タニノハイクレア
ハイエストシルバー,シンボリクリスエス(USA),ハイエストホワイト
バイオスパーク,オルフェーヴル,ナナヨーティアラ
パイオニアゴールド,ステイゴールド,セントフロンティア(AUS)
パイオニアバイオ,ルーラーシップ,アニメイトバイオ
パイオニアワーク,スマートファルコン,ディスカバリングビューティー(USA)
バイオネッタ,サマーバード(USA),シャインベル
バイオレットフィズ,タニノギムレット,プライムオブユース(USA)
バイオレントブロー,バゴ(FR),バイオレントハート
ハイオンザリスト,ローエングリン,ミヤビオウカ
バイオンディップス,マンハッタンカフェ,リトルディッパー
バイガエシ,ジャングルポケット,ナイストップクイン
バイカルフォンテン,カンパニー,ハーツブラッド
ハイギア,アサクサデンエン(GB),フリートサクシード
ハイクアウト,トランセンド,スウィートウィン(USA)
パイクステソーロ,クロフネ(USA),スマートレモラ
ハイクラスバイオ,ブラックタイド,クレヴァネスバイオ
ハイクリア,キングズベスト(USA),リップル
バイザスコット,ゼンノロブロイ,バイザキャット(USA)
ハイジャ,シニスターミニスター(USA),ハイフレンドディア(USA)
バイスブルー,ディープスカイ,アプリシエーション(IRE)
ハイタイド,ブラックタイド,ケイエスホノカ
バイタルコード,ロードカナロア,バイタルスタイル
バイタルフォルム,アッミラーレ,ポピーリース
バイタルフォース,Quality Road(USA),タップゴールド(USA)
バイタルワンダー,グラスワンダー(USA),エターナルロマンス
ハイチーズ,タートルボウル(IRE),チーズマヨ
バイツァダスト,オレハマッテルゼ,ゴールドグレイス(AUS)
ハイテルカイト,カネヒキリ,リアクションレート
ハイデンガールズ,サウスヴィグラス(USA),チーキーガールズ
ハイドラン,ローエングリン,ミミオブパラダイス
ハイドロフォイル,クロフネ(USA),レースウィング
ハイドロポリス,ルールオブロー(USA),ミスイザベラ(USA)
ハイドンセット,ハーツクライ,メルセンヌナンバー
パイナワレア,ヨハネスブルグ(USA),バクシンスクリーン
ハイハット,ブラックタイド,センノメグミ
ハイパワーゴッド,マツリダゴッホ,ハイパワーグレイス
ハイパワーストーム,スタチューオブリバティ(USA),ハイパワーグレイス
ハイパーエンジェル,イーグルカフェ(USA),エビスサンデー
ハイパーチャージ,ステイゴールド,グランドエナジー
ハイパーノヴァ,アイルハヴアナザー(USA),スペシャルクイン
ハイピュアリティ,ショウナンカンプ,キョウエイピュア
ハイヒール,トーセンホマレボシ,ドリームスケイプ
ハイヒールモモタン,クロフネ(USA),キーポケット
ハイブログ,スマートファルコン,ピースデピュティ
バイマイサイド,ステイゴールド,マンティスハント
ハイマウンテンラブ,スウェプトオーヴァーボード(USA),ラブポエット
ハイマックス,ストーミングホーム(GB),スカイバレンタイン
ハイヤーアプシス,ダノンシャンティ,テイクミーハイヤー
バイヨネット,アジュディミツオー,パーフェクトレディ
バイラ,ヘニーヒューズ(USA),コウエイテンプウ
バイラルメディア,ナカヤマフェスタ,エガオヨシ
ハイランドグラス,スターリングローズ,カネショウバナナ
ハイランドクーラー,ベーカバド(FR),メジロルーシュバー
ハイランドピーク,トーセンブライト,ハイランドダンス
ハイランドリュウセ,ジャングルポケット,フィフスアベニュー
バイラール,スマートファルコン,クレバーパルマ
パイルーチェ,ナカヤマフェスタ,パイクーニャン
バイレ,スズカマンボ,ヒカルトクタイセイ
ハイレベルバイオ,マンハッタンカフェ,ボシンシェ(USA)
ハイレートクライム,ディープブリランテ,スルーレート
パイロキシン,パイロ(USA),イシノスティール
パイロキネシスト,パイロ(USA),グランドホイッスル
パイロサンデー,パイロ(USA),ラブリーカランコエ
パイロスター,パイロ(USA),クラクエンキャット
パイロット,サムライハート,アリエナイ
バイーア,キングヘイロー,サルヴァドール
ハヴアサニーデイ,アイルハヴアナザー(USA),マイネカンナ
ハヴアナイスディ,ベーカバド(FR),スイートウインク
ハウエバー,ローエングリン,アイーンベル
パヴォーネ,シンボリクリスエス(USA),プリンセスミラクル
ハウキュート,アポロキングダム(USA),ヤマトプリティ
ハウトア,プリサイスエンド(USA),オーミチェリッシュ
バウトナカヤマ,バトルプラン(USA),リファールナカヤマ
ハウナニ,ロードカナロア,ユキチャン
ハウマーナ,フリオーソ,ゴーゴースズカ
ハウメア,キングカメハメハ,ダイヤモンドディーバ(GB)
ハウライト,アドマイヤオーラ,ミスバレンタイン
ハウリング,ハードスパン(USA),アースソング
バウンスバッカー,エイシンフラッシュ,ドリームパール
ハガキノハナ,シニスターミニスター(USA),リアルアーネスト(USA)
パガットケーブ,ハーツクライ,トロピカルブラッサム(USA)
バカラボナセーラ,ナカヤマフェスタ,アサンブラージュ
バガーチ,トーセンホマレボシ,ブライトキャップ
ハギノアグレッシブ,クロフネ(USA),ハギノクィーン
ハギノアテナ,クロフネ(USA),ハギノアーク
ハギノアレス,ハーツクライ,ハギノアーク
ハギノカエラ,ハービンジャー(GB),ハギノプリンセス
ハギノグランコート,ディープスカイ,ハギノサフィラ
ハギノグランデ,ヴィクトワールピサ,メイルストローム
ハギノサムサラ,シンボリクリスエス(USA),ハギノハニー
ハギノセゾン,シンボリクリスエス(USA),ハギノエアロ
ハギノハイブリッド,タニノギムレット,ハッピーペインター
ハギノパトリオット,キングカメハメハ,エリモファイナル
ハギノプレスト,ルーラーシップ,ハギノプリンセス
ハギノフロンティア,ヘニーヒューズ(USA),アンブライドルドブリーズ(USA)
ハギノレイラニ,キングカメハメハ,ハギノポンパドール
パキュートハート,カジノドライヴ(USA),キャントセイワーズ
パキラパワー,アポロキングダム(USA),ローランデイラミ(GB)
バギー,ヴィクトリー,クイッククラフティ(USA)
ハグクミ,アドマイヤムーン,シナノザクラ
ハクサンウインク,シルポート,ウインク
ハクサンエルモ,ハーツクライ,オークヒルズ
ハクサンオダイリ,デュランダル,ウインク
ハクサンキャノン,シルポート,ダーレームーン
ハクサングロウ,ストリートセンス(USA),ダーレームーン
ハクサンシップ,クロフネ(USA),ヒシフェアレディ
ハクサンジョイ,アドマイヤムーン,ラティエラ
ハクサンスカイ,マイネルラヴ(USA),ナナミメロディー(IRE)
ハクサンステラ,キンシャサノキセキ(AUS),ミサトバレー
ハクサンタイヨウ,ブラックタイド,クルンプホルツ
ハクサンテンシ,モンテロッソ(GB),バタラバ
ハクサンナチュラル(USA),Broken Vow(USA),Holiday Gold(USA)
ハクサンフエロ,シルポート,メンブランツァ
ハクサンフレンチ,フレンチデピュティ(USA),リキセレナード
ハクサンラピッド,シルポート,アイサレジョウズ
ハクサンルドルフ,アドマイヤムーン,キングスミール
ハクサンレガシー,ロージズインメイ(USA),レガシーパーパス
ハクサンレモン,シルポート,ミサトバレー
ハクサンワールド,キングカメハメハ,カノヤトップレディ
ハクシュカッサイ,ローエングリン,シンセツ
ハクシンヴィーナス,マーベラスサンデー,ポルタトーリ
バクシンスカイ,ディープスカイ,バクシンヒロイン
バクシントゥーレ,キャプテントゥーレ,バクシンクリーク
パクスアメリカーナ,クロフネ(USA),グローバルピース
パクスディオラム,ロードカナロア,オメガクリスマス
ハクバオー,ハードスパン(USA),パーティークィーン
バクハツ,スマートファルコン,ファニーストーリー
ハグミー,アドマイヤジャパン,ミスバレンタイン
バクヤ,ジャイアントレッカー(USA),ヤマカツカトリーヌ
ハクユウヴィグラス,サウスヴィグラス(USA),アースエマーブル
ハクユウカンベエ,マイネルラヴ(USA),ロイヤルキャリー
ハクユウゴールド,ゴールドアリュール,カンタトリーチェ
ハクユウジャック,ノボジャック(USA),ナッツベリー
ハクユウスターダム,ダンスインザダーク,アズチェーナ
ハクユウトライ,ロードカナロア,イシュタルキャスト
ハクユウファイアー,マンハッタンカフェ,ヤマノオーロラ
ハクユウボイジャー,アグネスデジタル(USA),ウインエルドール
ハクユウマックス,アドマイヤマックス,シンシアナ
ハクユウロゼ,ファスリエフ(USA),サイレンスマリア
ハグラー,カジノドライヴ(USA),スフィーダ
バケットリスト,シンボリクリスエス(USA),レチャーダ
ハコダテオウカ,ルーラーシップ,ラヴリージョウ
ハコダテカーニバル,シンボリクリスエス(USA),ラヴリージョウ
ハコダテキミコ,サムライハート,ホットマイハート
ハコダテダリア,ステイゴールド,ラヴリージョウ
ハコダテマイカ,ヴィクトリー,プラチナチャーム
ハザードマップ,フリオーソ,ニシノシャトル
パシオンシャンス,カネヒキリ,タツグレース
バジガクアトラス,キングズベスト(USA),ケイアイカミノアシ
バジガクアミスター,アジュディミツオー,スマートパレード
バジガクアリア,ロージズインメイ(USA),クレバーピルエット
バジガクカラッツ,パイロ(USA),ケイアイデメテル
バジガクサリーレ,キングズベスト(USA),ヤマショウナイナー
バジガクスペラーレ,アジュディケーティング(USA),カフェドフレール
バジガクソレイユ,ロージズインメイ(USA),スペシャルリリー
バジガクノルン,アポロキングダム(USA),フリーダムガール(USA)
バジガクハヤテ,スクワートルスクワート(USA),ハセノヒロイン
バジガクパルフェ,キャプテントゥーレ,コウエイマーベラス
バジガクブルーム,パイロ(USA),アベックプレジール
バジガクブレイズ,パイロ(USA),マチカネユウビ
バジガクベルク,パイロ(USA),スイートベルモット
バジガクミライ,ヴァーミリアン,メジロマルチネス
バジガクミワチャン,クーリンガー,ギンマク
バジガクラビット,ブラックタイド,イゾルデ
バジガクルージュ,セイントアレックス(USA),ヴェネチアンレッド
バジガクレディー,スマートファルコン,コスモリバー
ハシカミ,キャプテンスティーヴ(USA),アオバ
パシコペンネッタ,スターリングローズ,エイシンナポリタン
ハシノオージャ,キョウワスプレンダ,キュートシルフ
ハシノテンザンビ,アサクサキングス,プレミアクロス
ハシノフウジン,モルフェデスペクタ(USA),モルフェメイト
パシフィックロード,トビーズコーナー(USA),ペルルフィーヌ
パシュパティナート,ヴィクトワールピサ,カトマンドゥ(FR)
ハシルキセキ,プリサイスエンド(USA),リターンケープ
ハシルセンセイ,キッケンクリス(USA),コウヨウヒロイン
バシルーラ,ヴァーミリアン,スズカシャンティー
バシレウスライオン,キンシャサノキセキ(AUS),バシマー(IRE)
ハシレウマザンマイ,カジノドライヴ(USA),ブローザキャンドル
パシージョ,ブラックタイド,フォトジェニック
パスアンフューチャ,タイムパラドックス,ロージーズシスター(USA)
パスイ,カネヒキリ,レディルナ
バスカヴィル(USA),Bernardini(USA),Divalarious(USA)
バスクインザサン,ハーツクライ,ミルシャイナー
バスタータイプ,ホワイトマズル(GB),グローバルソング
パスティエーラ,キングカメハメハ,パストフォリア
パスティス,ハーツクライ,ハヤランダ(FR)
バスデイプレゼント,ファスリエフ(USA),サルトリーガール
パステラリア,エンパイアメーカー(USA),レディパステル
パストゥレイユ,ダノンシャンティ,カドリーユ
パストマスターズ,ルーラーシップ,マッキーロイヤル
パストラル,マツリダゴッホ,アンローランサン
パズドリーム,ドリームジャーニー,シュガークラフト
パスファインダー,ディープインパクト,ディスカバリングビューティー(USA)
パスポート,パイロ(USA),ベルグチケット
パズルリンクス,ヨハネスブルグ(USA),ポラリス
バズーカ,スニッツェル(AUS),ギュイエンヌ
ハセノパイロ,パイロ(USA),タイキアヴェニュー
ハゼル,ダイワメジャー,カネスベネフィット
ハダシノオウサマ,アサクサキングス,マイネフェニーチェ
ハタノオヌール,サウスヴィグラス(USA),ハタノガイア
ハタノガナール,ハーツクライ,クラスター(USA)
ハタノキセキ,カネヒキリ,ハタノメドゥーサ
ハタノコンフリクト,シンボリクリスエス(USA),ハタノファベルジェ
ハタノサンドリヨン,ヨハネスブルグ(USA),ハタノメドゥーサ
ハタノダムール,ヒルノダムール,シアトルハッピー
ハタノディアマンテ,エンパイアメーカー(USA),ハタノボニート(USA)
ハタノテネーブル,ハーツクライ,ハタノファベルジェ
ハタノデフィ,ブラックタイド,ハローソーソー(IRE)
ハタノリヴィール,フレンチデピュティ(USA),ヴィヴィッドエンジェル(USA)
ハタノレジーナ,アイルハヴアナザー(USA),ハタノガイア
バタラ,ダノンシャンティ,フォーマルアプローバル(USA)
ハチキンブイパワー,キンシャサノキセキ(AUS),クロススピード
ハチジョウガンザン,トランセンド,アイズビューティー
パチパチパチ,サマーバード(USA),レイクミード
パチャマル,アドマイヤジャパン,パルステージ
パチュリー,キンシャサノキセキ(AUS),スーリア
バッカルコーン,ゼンノロブロイ,オリヒメチャーム
パツキン,メイショウボーラー,リプルマーク
パッキーノ,ファルブラヴ(IRE),シャイニングスルー
バックインスタイル,カネヒキリ,エシュクアルバー(USA)
バックドアルート,ステイゴールド,ウィキッドリーパーフェクト(USA)
バックナンバー,ロージズインメイ(USA),ペレブラッサム
バックファイヤー,ダイワメジャー,アーマイン(USA)
バックラッシュ,キングヘイロー,ホクセーメジャー
バッケンシェール,ワークフォース(GB),フェイムドグレイス
ハッシュタグ,クロフネ(USA),サンデースマイル２(GB)
ハッシュレート,エイシンフラッシュ,ロビングショット
パッショネイトラン,ヴァーミリアン,アサティスジョオー
パッショノン,ロージズインメイ(USA),ブライトンビコー
パッション,アフリート(CAN),フェルメールブルー
パッションチカ,ナカヤマフェスタ,コルチカ(GB)
パッシングブリーズ,クロフネ(USA),ブローザキャンドル
パッシングポイント,メイショウボーラー,ハートアイリス
ハッスルカフェ,バゴ(FR),ホットファッション
ハッスルバッスル,ネオユニヴァース,ミネルバサウンド
ハッスルボーイ,グラスワンダー(USA),ティーケーキセキ
パッセ,パイロ(USA),パドブレ
バッターカネムラ,ミスキャスト,ハリスンマリー
ハッチャンハッピー,ゴールドヘイロー,アールデコ
ハッツオフ,メイショウボーラー,リリカルヴァース
バッテリーパーク,ブレイクランアウト(USA),アンペア
バットオールソー,ストロングリターン,ブロンドヒロイン
パットサイテ,アッミラーレ,ルリイロノチキュウ(USA)
ハットプレイ(USA),ハットトリック,Soleil Lady(USA)
ハットラブ,ワークフォース(GB),ミルルーテウス
ハットワンスター,スクリーンヒーロー,リュクス
パッパカ,サマーバード(USA),キャラメルチャン
パッパーレ,ジャイアントレッカー(USA),スズカセレナード
パッピンス,メイショウボーラー,キシュウプリンセス
ハッピーアップ,トワイニング(USA),ペニーアップ(USA)
ハッピーアロー,キングヘイロー,テンビーエース
ハッピーオーキッド,ルーラーシップ,ハッピーラン
ハッピーカリソン,ベーカバド(FR),ゴッドインチーフ
ハッピーカンパニー,カンパニー,ハッピーチケット
ハッピーギフト,アサクサキングス,オトヒメ
ハッピークリスマス,ダイワメジャー,マッキーアイドル
ハッピーグリン,ローエングリン,レディセラヴィ
ハッピーサンディー,カジノドライヴ(USA),ガンアンドローズ
ハッピーサークル,キンシャサノキセキ(AUS),ハナマル
ハッピースティーヴ,キャプテンスティーヴ(USA),カノヤアカツキ
ハッピースプリント,アッミラーレ,マーゴーン(USA)
ハッピーチアフル,ゼンノロブロイ,アグネスチーアフル
ハッピーチャージ,アサクサデンエン(GB),ナナヨーハッピー
ハッピーデイズ,サムライハート,オレンジジャスミン(IRE)
ハッピーテーラー,アッミラーレ,シェアザハート
ハッピードータア,オウケンブルースリ,ホマレエイカン
ハッピードール,ゴールドアリュール,ビッグクロワッサン
ハッピーナッツ,トランセンド,リリーオブザバリー
ハッピーパウダー,クロフネ(USA),ルミナスハッピー
ハッピーハッピー,シニスターミニスター(USA),ホッコーユニバース
ハッピーハナコサン,シビルウォー,ハシルモーガン
ハッピーハロウィン,ヴァーミリアン,ハロウィンパレード
ハッピーパーティー,クロフネ(USA),ハッピーディレンマ
ハッピーフィート,ジャングルポケット,グローバルフィート
ハッピーフライト,アイルハヴアナザー(USA),エスフライト
ハッピープリティー,トワイニング(USA),リトルブレッシング
ハッピーブーケ,プリサイスエンド(USA),ウインアズライト
ハッピーポイント,カジノドライヴ(USA),マッチポイント
ハッピーポケット,ジャングルポケット,レナンセラ(USA)
ハッピーマイロード,エアジハード,ハッピードロップ
ハッピーマテリアル,アイルハヴアナザー(USA),オーディエンス
ハッピームーン,アドマイヤムーン,オンワードミシェル
ハッピーメモリアル,エスポワールシチー,スタミナスピード
ハッピーメモリーズ,アルカセット(USA),フローラルジュノー
ハッピーモーメント,ディープインパクト,アドマイヤハッピー
ハッピーユニバンス,ジャングルポケット,アドマイヤセラヴィ
ハッピーランラン,ワークフォース(GB),ハッピーラン
ハッピーリフレイン,ナカヤマフェスタ,リヴァリーン
ハッピーリーベ,マイネルラヴ(USA),ナムラトレジョリ
ハッピールミエール,スウェプトオーヴァーボード(USA),ハッピーオーシャン
バッファゴー,ディープブリランテ,サンフラワーガール
パッポーネ,ハーツクライ,パッションローズ
ハツラツニッコウ,リーチザクラウン,インラヴ(GB)
ハテ,ソングオブウインド,シティオブライト
バティスティーニ,キングカメハメハ,バプティスタ
パテティーク,アドマイヤマックス,コスモパルムドール(USA)
ハドウホウ,ゴールドヘイロー,ニシオマジョリック
ハドソンホーネット,ロージズインメイ(USA),コパノベンザイテン
パドックキラー,ゴールドアリュール,サクラカンパネラ
ハトホル,モンテロッソ(GB),フローズンムーン
ハトマークエース,パイロ(USA),マンイーター
ハトマーククィーン,スズカマンボ,マンイーター
ハトマークレディ,ヨハネスブルグ(USA),マンイーター
ハトマークワルツ,フレンチデピュティ(USA),マンイーター
パドミニ,セイントアレックス(USA),プリモエナジー
パトリシアロンド,フレンチデピュティ(USA),レッドバラード(USA)
パドルウィール,クロフネ(USA),レストレスハート
バトルオサンナ,キンシャサノキセキ(AUS),ヨウヨウ
バトルオスカー,ダンスインザダーク,メジロテディベア
バトルガニアン,ハーツクライ,ホットレッグス
バトルガラクシア,キングヘイロー,ライジングフラッグ
バトルキャンデー,ショウナンカンプ,バトルペルレ
バトルクウ,ケイムホーム(USA),シリウストウショウ
バトルグランドリイ,ブラックタイド,グランシェール
バトルサンバ,バトルプラン(USA),ルスナイサンバ
バトルスピリッツ,Sea The Stars(IRE),ボールルーム(IRE)
バトルセキトバ,コンデュイット(IRE),ミスエアクラフト(USA)
バトルチャンプ,バトルプラン(USA),ハリウッドナニー
バトルデゼル,ダノンシャンティ,メイショウアゲハ
バトルハクオウ,マンハッタンカフェ,ピースヴィクトリア
バトルハヤチメ,パイロ(USA),ヴェニーズワルツ
バトルハヤバセ,キングズベスト(USA),バアゼルローズ
バトルハルトマン,メイショウボーラー,ノルブリンカ
バトルピッピ,バトルプラン(USA),バトルパンタナール
バトルフォンテ,ブラックタイド,サンデープレゼント
バトルフガクオウ,シンボリクリスエス(USA),バトルサクヤビメ
バトルマイスター(USA),Bodemeister(USA),Elusive Horizon(USA)
バトルミンクス,バトルプラン(USA),スズカミンクス
バトルラインダンス,アサクサキングス,ガレリアトウショウ
バトルランチャ,デュランダル,カネツフラップ
バトルロックハート,ハーツクライ,バトルスマイル
バトルローア,バトルプラン(USA),マイネローレライ
ハドロサウルス,コンデュイット(IRE),ソニックバード(USA)
バトードラムール,ヨハネスブルグ(USA),ミスサイベリア(USA)
ハナエミ,メイショウボーラー,ハナカゲ
ハナオウギ(USA),Super Saver,インターリム(IRE)
ハナザカリ,ルーラーシップ,チャームウィーク
ハナジロー,ディープスカイ,アスール
ハナズウェポン,オレハマッテルゼ,プラセール
ハナズシャウト,ハーツクライ,マヤノメイビー
ハナズチューリップ,オレハマッテルゼ,デライトスライト
ハナズバカラ,カジノドライヴ(USA),ハナズジャンプ
ハナズプルメリア,キングカメハメハ,スイートフルーレ(USA)
ハナズレジェンド,ハーツクライ,ムーンライトゼファー(AUS)
ハナゾムカシノ,ナカヤマフェスタ,パレストウショウ
ハナソメイ,タートルボウル(IRE),エポキシ
バナナボーイ,サムライハート,カネショウバナナ
バナナボート,タイムパラドックス,ツクバオトメ
