
バナナムーチョ,キンシャサノキセキ(AUS),クリムゾンクローバ
ハナノキセキ,ミリオンディスク,ラブハミング
ハナノコマキ,フリオーソ,ハナノゴジュウマル
ハナノパレード,ゴールドヘイロー,カミノヤマレンジャ
ハナノバンジョウ,フォーティナイナーズサン(USA),コロニアルディーバ
ハナノバード,サマーバード(USA),エイプリルバード
ハナビクイーン,パーソナルラッシュ(USA),ヘライギャル
ハナビサンバ,オレハマッテルゼ,キクカエンプレス
ハナブショウ,ヘニーヒューズ(USA),イチノヤジョウ
ハナミン,ジャングルポケット,フィールザファン
ハナモモ,ホワイトマズル(GB),サンデーストーリー
ハナリュウセイ(USA),Cowboy Cal(USA),Deceptive(USA)
ハナレイムーン,ディープインパクト,ハウオリ
ハニエル,ハーツクライ,サリエル
バニスター,パイロ(USA),アポロサティー
ハニハニハーモニー,ディープブリランテ,セブンスハーモニー
バニラキャンティ,アグネスデジタル(USA),エーシンパーティー(USA)
ハニークローシュ,ジャングルポケット,リマンドインパクト
ハニーゴールド,ステイゴールド,ダッシングハニー
ハニーコーン,フリオーソ,ディーズプレスト
ハニージェイド(USA),Harlan's Holiday(USA),Hard Hat(USA)
バニーテール,カネヒキリ,ウィンターコスモス
ハニーフィッツ,ゴールドアリュール,ヒシアイドル
ハニーフェイバー,ヴィクトワールピサ,キッズフェイヴァー
ハニープレッツェル,スニッツェル(AUS),ハニーハント
ハニーブーケ,ベーカバド(FR),ニシノナデシコ
ハニーポット,サウスヴィグラス(USA),マキシムカフェ
ハニームーン,メイショウサムソン,ブライズメイト
ハニーレイ,サムライハート,ミスバレンタイン
ハニーロコガール,ロージズインメイ(USA),サマーロコガール
ハネムーンソング,マツリダゴッホ,シングムーン(USA)
パノラマ,アドマイヤムーン,ティエッチグリーン(USA)
パパドプロス,エスポワールシチー,ママラヴスマンボ
ハバナブラウン,エンパイアメーカー(USA),ドクターマリ
パパラヴズマンボ,スズカマンボ,プリモタイム
パピエ,ショウナンカンプ,オリガミ
ハビトゥス,ファルブラヴ(IRE),スギノキューティー(USA)
ハピネストソング,ニューイングランド,フライトソング
ハピネスヒーロー,アサクサキングス,スズキャンドル
ハピネスメーカー,マツリダゴッホ,ホクトグレイン
ハピリン,アサクサキングス,ギャラントユウリ
パフォーマプロミス,ステイゴールド,アイルビーバウンド
パフォーム,マツリダゴッホ,マイネアルデュール
バプティシア,タートルボウル(IRE),レディハニー
パフュームクラスタ,パイロ(USA),グリッツェルン
パブリックフレンド,マンハッタンカフェ,ケリーズビューティ
パブリノ,ヴィクトワールピサ,トライマイクイン
バブリーバローズ,ステイゴールド,バブリームード
バブルトップ,リンカーン,スタイルオブメロン
バブルパーティー,メイショウボーラー,マルカフルート
パブロ,キンシャサノキセキ(AUS),ゲルニカ(ARG)
パブロフテソーロ,タイキシャトル(USA),ベネディーレ
ハマオリ,タートルボウル(IRE),ヌチバナ
ハマヒルガオ,クロフネ(USA),ミスアンコール
ハミルトン,ダイタクバートラム,トップデラッキ
ハミルトンパーク,ジャングルポケット,フランシール
ハミングパッション,ハーツクライ,ダンシングクイーン
パムッカレ,コンデュイット(IRE),フェイドレス
ハムレット,シンボリクリスエス(USA),フサイチミニヨン
バモス,ヘニーヒューズ(USA),バーラプレッタ
ハヤイガナ,ヨハネスブルグ(USA),レイクミード
ハヤイネペコチャン,ダンスインザダーク,クレバースプリント
ハヤカゼ,デリケートワン,キヨカ
ハヤグリーヴァ,ダンスインザダーク,フサイチヨーコ
ハヤテ,ブラックタイド,アブソリューション
ハヤテジョー,ブラックタイド,トップオブザヒル
ハヤブサカノン,バゴ(FR),ゴートゥザノース
ハヤブサキセキ,サムライハート,クレバークレバー
ハヤブサゲッツ,アドマイヤムーン,イチゴイチエ
ハヤブサザムライ,サウスヴィグラス(USA),フェスティバル
ハヤブサタイザン,マヤノトップガン,ヒロサンシャイン
ハヤブサヒカリ,ファルブラヴ(IRE),ダンスインザムーン
ハヤブサピクシー,ジャングルポケット,ユウサンポリッシュ
ハヤブサプリプリ,キングカメハメハ,プリモウェイ(USA)
ハヤブサプリンス,ミスキャスト,エーシンフォチュナ
ハヤブサマカオー,シニスターミニスター(USA),ハヤブサエミネンス(USA)
ハヤブサライデン,キングヘイロー,プリティーメアー
ハヤブサレジェンド,ヘニーヒューズ(USA),イチゴイチエ
ハヤブサレディゴー,サウスヴィグラス(USA),ダッシングハニー
ハヤマデイズ,ローレルゲレイロ,グラナディラ
バライロコマチ,スターリングローズ,ツルミローズ
パラヴィオン,マツリダゴッホ,クイックメール
パラオラリー,エンパイアメーカー(USA),ペッシュドール
パラゴン,グリーンアプローズ(USA),ミヤウンブランド
パラシオプリンセサ,カリズマティック(USA),ストリートパレード(USA)
パラダイスガーデン(USA),Closing Argument(USA),Forbidden Paradise
パラダイスシップ,クロフネ(USA),パラダイスイズヒア
バラダガール,ハーツクライ,バラダセール(ARG)
パラノキセキ,パラダイスクリーク(USA),グラマーガール
パラノーマル,ステイゴールド,マイネソーサリス
バラブシュカ,ブレイクランアウト(USA),エストレーラ
パラボラ,キングズベスト(USA),ダイアゴネル(IRE)
パラボラッチョ,メイショウボーラー,ノーザンサンライズ
バラモノガタリ,スパイキュール,ニッシンナイナー
バララットゴールド,ワークフォース(GB),フォルクローレ
パラレルユニバース,ネオユニヴァース,エーソングフォー(USA)
パラレルワールド,エスポワールシチー,ケージーホマレ
パラワンエルニド,アッミラーレ,サヴァント(USA)
バランドロ,ストーミングホーム(GB),ベラドーラ２(IRE)
バリアスカラーズ,ヴァーミリアン,ジョーベアトリチェ
ハリウッドクイーン,スペシャルウィーク,エイムアットビップ
バリエンテ,ストロングリターン,プレラット
バリオスサンダー,キングズベスト(USA),ジェノヴァ(IRE)
バリオラージュ,ディープインパクト,ファーストバイオリン(USA)
パリカラノテガミ,ジャングルポケット,シンコウローズ
バリキ,ハーツクライ,カネスベネフィット
ハリケーンバローズ(USA),Uncle Mo(USA),Naughty Mambo(USA)
ハリケーンライヒ,ロッコウオロシ(USA),バービーライヒ
ハリケーンリリー,マイネルセレクト,トウエンクィーン
バリス,ステイゴールド,プラントパラダイス
バリスコア,フリオーソ,シャトーモア
パリスハート,メイショウボーラー,レリックレーヌ
パリテソーロ(USA),Declaration of War(USA),Patricias Prospect
バリバリ,ワイルドラッシュ(USA),パーティミント
パリファッション,フレンチデピュティ(USA),ミークレイチェル
ハリマノワタリドリ,ゴールドアリュール,ジャスミンブリーズ
ハリマホーマ,ブラックタキシード,マルマツキセキ
パリモンマルトル,ローズキングダム,パリサンジェルマン
バリングラ(IRE),Fastnet Rock(AUS),Sweet Dreams Baby(IRE)
パリンジェネシス,タートルボウル(IRE),メジロジョーンズ
バリンジャー,ステイゴールド,バイユーストーム(USA)
ハリー,ヴィクトワールピサ,レイズアンドコール
ハリーバリパーティ,ダイタクリーヴァ,コアレスグレイス
ハリーレガシー,ヴィクトワールピサ,バルドウィナ(FR)
パル,スリリングサンデー,サドバーシッド(IRE)
ハルヲヨブオンナ,サウスヴィグラス(USA),カアチャンコワイ
ハルイチバン,スタチューオブリバティ(USA),ジーエスレインボー
ハルカカナタ,スパイキュール,クイーンオブハルカ
ハルカジェット,スパイキュール,デザートブレーク
ハルカナユメ,ローエングリン,ファミリズム
ハルカナルブルー,アジュディケーティング(USA),アドマイヤディア
ハルカノテソーロ,ハービンジャー(GB),ユキノマーメイド
ハルキスター,ハービンジャー(GB),メジロミドウ
ハルキストン,ロージズインメイ(USA),ベルモントベロニカ
ハルク,ベーカバド(FR),サンデーエイコーン
ハルクシーザー,モルフェデスペクタ(USA),ベルアミイ
パルクデラモール,ディープインパクト,レディシャツィ(PER)
パルクフェルメ,ゼンノロブロイ,ピューリティー(GER)
パルクリール,ダノンシャンティ,コスモクラッベ
ハルクンノテソーロ,ファスリエフ(USA),トウカイベルタ
パルクールダンサー,ローレルゲレイロ,ケイウンコスモ
ハルコマチ,タイムパラドックス,ユウターマライア
バルコラベーロ,クロフネ(USA),アペラシオン
ハルサエクレバ,スペシャルウィーク,フレッシュバニラ(USA)
パルシア,エイシンフラッシュ,ローザフィオーレ
ハルスケッテ,シンボリクリスエス(USA),レミニセンス
ハルズハッピー,アドマイヤコジーン,ファインビンテージ
バルダッキーノ,メイショウボーラー,クロムハート
バルダッサーレ,アンライバルド,メイルリヒト
バルタンセージ,マヤノトップガン,スナークルピナス
ハルティア,フィガロ(USA),デラセーラ(USA)
パルティトゥーラ,マンハッタンカフェ,フォルテピアノ
パルティータ,ベーカバド(FR),オールオールオール
パルティーレ,ローエングリン,アルテシア
バルデス,ハービンジャー(GB),ディアデラノビア
パルトネルラーフ,ヴァーミリアン,サクセスウイッチ
パルトネール,カジノドライヴ(USA),ヴェルテュ
バルトフォンテン,アンライバルド,バーデンフォンテン
バルドル,ニューイングランド,ラピッドリーラン
バルドルチア,ダイワメジャー,バルドネキア(IRE)
バルトロメオ,ディープインパクト,フォルテピアノ
パルドン,サウスヴィグラス(USA),ロッキーダンサー
パルナッソス,クロフネ(USA),カスタリア
ハルネセジール,オウケンブルースリ,サマークイーン
ハルノタビ,ドリームジャーニー,サンスプリング(ARG)
ハルノフェスタ,ナカヤマフェスタ,ピクトリアル
ハルノフラワー,ストーミングホーム(GB),シルクオリンピア
ハルノマンボ,スズカマンボ,ランタナ
バルバスバウ,トウカイワイルド,エプソムアイリス
バルバムーシュ,アドマイヤマックス,アンフォイルド(USA)
パルパルパピヨン,ゴールドアリュール,ビジューブリアン
パルパルパンダ,キャプテントゥーレ,エアデデュー
バルバロッサ,ルーラーシップ,トランシーフレーズ
パルファイア,オンファイア,チヨノビンコ
パルファンデュロワ,キングカメハメハ,ブーケフレグランス
パルフェクォーツ,ダイワメジャー,ピューリティー(GER)
パルフェット,パイロ(USA),フレンチポップス
バルフルーリー,スズカフェニックス,ディアジーローズ
バルベーラ,ルーラーシップ,ジュリエットソング
バルマスケ,ゴールドアリュール,カロスキューマ(USA)
ハルマツイブキ,スウェプトオーヴァーボード(USA),ツルハチクィーン
パルマリア,ロードカナロア,エルダンジュ
パルミエ,ケイムホーム(USA),イースタンロマン
バルミーゴーラ,タイムパラドックス,ゴールデンアリー
バレエダンサー,ハーツクライ,ホワイトウォーター(USA)
ハレカイ,タートルボウル(IRE),ラベ
パレスショウグン,エスポワールシチー,ヴィラデステ
パレスドラゴン,ローレルゲレイロ,マサカーネ
パレスパラダイス,プリサイスエンド(USA),コトノハ
パレスハングリー,トランセンド,スタミナスピード
パレスヘイロー,キングヘイロー,ベルベットイーグル
バレッティ,キングカメハメハ,ザレマ
パレットキャット,ルールオブロー(USA),インシステント(USA)
バレットタイム,バゴ(FR),ザカラーオブラヴ
バレットテソーロ(IRE),Camelot,Falling Rain(IRE)
ハレヒメ,タイムパラドックス,メヌエットシチー
バレリオ,ステイゴールド,リリウム
バレンタインジェム,ノヴェリスト(IRE),ケイティーズジェム
バレンタインデキス,キングズベスト(USA),キスカラハジメヨウ
バレンタインハート,ルーラーシップ,プレイフォーノビー
バレンティーノ,ベーカバド(FR),スタートラッカー
ハレー,ケイムホーム(USA),ドントヒットオンミー(USA)
パレード,ディープインパクト,ハニーローズ(ARG)
バレーナボス,アドマイヤマックス,アメリカンタイトル
バレーノロッソ,ノヴェリスト(IRE),イタリアンレッド
バレーロ,ヴィクトワールピサ,ベルベットローブ(USA)
ハロガロ,ローエングリン,サクラフーガ
バロネスブルー,アグネスデジタル(USA),ラフレッシュブルー
バロンエール,ブラックタイド,スペシャルウィッチ
バロンボーテ,エイシンアポロン(USA),ウインラシェーナ
バロー,キングズベスト(USA),アップワードスパイラル(GB)
ハロークオリティ,タイキシャトル(USA),ストームクオリティ
ハローダーリン,ローエングリン,ハローハピネス
バローネステラート,ナカヤマフェスタ,トリアノン
ハロービギン,ゴールドヘイロー,ボレロビート
ハローマイディア,ブラックタイド,ハローレイチェル(USA)
ハローユニコーン,ハーツクライ,サンタローズ
ハロールーラー,ルーラーシップ,フロムアップランド
ハワイアンブリーズ,ドリームジャーニー,ソヨカゼ２(FR)
パワフルヴォイス,ネオユニヴァース,ソウルフルヴォイス
パワフルテソーロ,ゼンノロブロイ,アンクレット
パワフルノンコ,ワークフォース(GB),ノンコ
パワフルヒロコ,メイショウボーラー,パワフルリーフ
パワポケゴールド,カンパニー,エアブリエ
パワポケロワージ,スウィフトカレント,ロワージ(GB)
パワーアッシュ,シニスターミニスター(USA),マヤフィオーレ
パワーオブワード,メイショウボーラー,ビクトリアノニジ
パワーズオブテン,アドマイヤマックス,ヤマカツセイレーン
パワースターディ,ロージズインメイ(USA),スマートプラン
パワースピネル,ナカヤマフェスタ,パワーオブフェイス
パワースプレンダー,プリサイスエンド(USA),パワープリンセス
パワースラッガー,ウインラディウス,クリスタルフローラ
パワーバンド,ディープブリランテ,スイートマカロン(USA)
パワーピッチング,クロフネ(USA),セイウンクレナイ
パワーフレーズ,クロフネ(USA),アイアンブリッジ
パワーポケット,エンパイアメーカー(USA),タカラグリーン
パワーローラン,デュランダル,マヤラブハート
バンカイ,マヤノトップガン,ベガフライト
バンキッシュライン,アドマイヤジャパン,スマイルホープ
ハンキードーリ,エンパイアメーカー(USA),アドマイヤジュノー
バンクシアパーク,スニッツェル(AUS),メイカ
バングライオン,ネオユニヴァース,ゴールドプライシズライジング(USA)
ハングリーハート,アッミラーレ,ハートサムデイ
ハングリーベン,ベーカバド(FR),サマーコード
バングルバングル,ゴールドアリュール,キャッツプライド(USA)
ハンゲキノノロシ,トーセンホマレボシ,ジェンハオサイマ
バンケットスクエア(USA),Bellamy Road(USA),キャシーズラブ
パンコミード,キングカメハメハ,ポップコーンジャズ
バンゴール,キングカメハメハ,ローザブランカ
ハンサムウーマン,ヨハネスブルグ(USA),ハイパーラッシュ
ハンサムスター,バトルプラン(USA),ミスズアムール
パンサーバローズ(USA),ハードスパン(USA),Grandma Martha(USA)
バンシー,アッミラーレ,タママリア
ハンズスミス,アルデバラン２(USA),ビューティコマンダ
ハンズヘイロー,キングヘイロー,アイラインローザー
バンズーム,シンボリクリスエス(USA),ペディクラリス
バンダイクイーン,サムライハート,スイートレジーナ
バンダイクブラウン,タイキシャトル(USA),シルキーリリー
バンダナ,ハーツクライ,エンベゼル(USA)
バンタム,クロフネ(USA),ミユキ
バンダムザブラッド,ハーツクライ,キングズラヴ(USA)
ハンターテソーロ,スウェプトオーヴァーボード(USA),ピアグラス
パンツァネッラ,ルーラーシップ,シルバーフォックス
ハンディマン,サウスヴィグラス(USA),ヒカルエガオ
パンテラ,ヘニーヒューズ(USA),ランデブー
バンドゥーラ,スクリーンヒーロー,ブリュードロア
バンドオンザラン,スズカコーズウェイ,セクシーシューズ
パンドラフォンテン,アドマイヤジャパン,バーデンフォンテン
ハンドリー,フリオーソ,タムロマンサーナ
ハンドレッドアーツ,デュランダル,グレートテン
ハンドレッドライフ,サマーバード(USA),トリプルハート
バンドワゴン,ホワイトマズル(GB),ピラミマ(USA)
パンナムクリッパー,アフリート(CAN),クイックリプライ(USA)
ハンナリ,アグネスデジタル(USA),トップモデル
バンバンブギー,シニスターミニスター(USA),シルクプリズム
バンパークロップ,クロフネ(USA),グレートハーベスト
バンブトンエガオ,バゴ(FR),ニースセブンティン
バンプファイア,ルースリンド,スノーヴァーダント
バンブーキングペレ,マヤノトップガン,バンビーナココ
バンブーデルピエロ,アフリート(CAN),ソラーティカ(USA)
バンブーリバプール,マンハッタンカフェ,チリビリビン
バンリノユウシャ,ゴールドアリュール,リバティスプライト
ハーキマーダイヤ,タイムパラドックス,クリスタルクール
ハーキュリーズ,ディープインパクト,タックスヘイブン
バーキンブライアン,ダノンシャンティ,ラスリーズ
パーキー,ロードカナロア,パダナ(GER)
パークス,ベルシャザール,ハタノボニート(USA)
ハーグリーブス,エンパイアメーカー(USA),プレシャスライフ
バークレアヴィガ,ジャングルポケット,クラサヴィカ
バーサーカー,サウスヴィグラス(USA),フリーバード
バージニアビーチ,キンシャサノキセキ(AUS),バージニアキャット(USA)
バージンアンバー,タイムパラドックス,サンライトリーダ
パーシーズベスト,ディープインパクト,パーシステントリー(USA)
バースデイ,ダイワメジャー,クリアーチャンス
バースデーカラー,ダンシングカラー,パホーマンスロード
バーストハンター,マヤノトップガン,ニシノナデシコ
バースフォンテン,ゴーカイ,クインポイント
パーセプション,ストリートセンス(USA),タッチ２(USA)
パーソナルブルー,パーソナルラッシュ(USA),ラフレッシュブルー
パーソナルベスト,アルデバラン２(USA),エミリア
パーソナルベルン,パーソナルラッシュ(USA),フクウンラブスター
パーソナルマキ,パーソナルラッシュ(USA),マキハタスペシャル(AUS)
ハーツイグニション,ハーツクライ,ビリーヴミー(IRE)
ハーツジュニア,ハーツクライ,エリーナ
ハーツフェルト,ハーツクライ,マチカネタマカズラ(USA)
ハーツブライト,ハーツクライ,シーカーマ(USA)
ハーティタイトル,サムライハート,イケタイトル
パーティメーカー,パイロ(USA),スプリングパレット
バーディーイーグル,ブライアンズタイム(USA),ホームスイートホーム(USA)
バーディーズカフェ,マンハッタンカフェ,ヴードゥーレディ(USA)
バーディーチャンス,ゴールドアリュール,サヤカ(USA)
パーティードレス,デュランダル,グロンシャール
パーティーピーポー,ワークフォース(GB),ヴィヴァチッシモ
ハート,カンパニー,オーロラビコー
ハートイズハート,アンライバルド,タオルミーナ
バードウィーク,シンボリクリスエス(USA),ハタノディアナ
ハートオブスワロー,ハーツクライ,イソノスワロー
ハードカウント,ダイワメジャー,レスレクシオン(USA)
パートカラー,バトルプラン(USA),サクラジュノー
ハードクラップ,クロフネ(USA),ポエティクシーズン
ハートクレスト,ワークフォース(GB),マリアヴェロニカ
ハートナイス,カネヒキリ,シャイニングアイズ
ハートノエース,サムライハート,シゲルヨリツキ
ハードパンチャー,トーセンホマレボシ,シズパンチ
ハートビューティ,ロドリゴデトリアーノ(USA),レディリリカル
ハードファクト,ハードスパン(USA),ロシャーニ(IRE)
ハートフルタイム,エンパイアメーカー(USA),オールタイムベスト
ハートブレイク,トビーズコーナー(USA),クレバードリーム
バードランド,ノヴェリスト(IRE),ソングバード
ハートランドシチー,ハーツクライ,ケープタウンシチー
ハートランドナルド,ダンスインザダーク,ヴァルールーズ(GB)
ハートリッチ,ハービンジャー(GB),デアリングハート
ハードルソング,オレハマッテルゼ,フレンチミステリー
ハートレー,ディープインパクト,ウィキッドリーパーフェクト(USA)
バーニングガール,シンボリクリスエス(USA),プリティホワイト
バーニングペスカ,パイロ(USA),メイショウガンツ
バーニングマン,ナカヤマフェスタ,シャープキック
バーニーズ,フォーティナイナーズサン(USA),グランシェール
バーバリライオン,オンファイア,アポロカリビアン
ハーバーライナー,スズカマンボ,レイナウッド
ハーピスト,ハーツクライ,ケルティックハープ
ハービル,ショウナンカンプ,ビキニクィーン
ハービンマオ,ハービンジャー(GB),ダンシングマオ
ハービーナ,ハービンジャー(GB),ニフティハート
ハービーボンズ,ハービンジャー(GB),ユメノキズナ
ハービーラヴド,ゼンノロブロイ,ウイントゥルーラヴ
パーフェクトウェイ,ロードカナロア,パーフェクトダンス
パーフェクトクイン,マツリダゴッホ,チアズフィアレス
パーフェクトデイ,ステイゴールド,プライムナンバー
パーフェクトプラン,サウスヴィグラス(USA),エナジーブルー
ハープスプレンダー,ゼンノロブロイ,ケルティックハープ
ハーフバック,ジャスタウェイ,キトゥンブルー
ハーフパンツ,プリサイスエンド(USA),スイートペルシーク(IRE)
ハーフハーフスター,シニスターミニスター(USA),アサクサロータス
パープルウィッシュ,サンライズバッカス,パープルスター
パープルジェイド,メイショウボーラー,プリンセスブルー
パープルスクエア,ディープスカイ,スクエアアウェイ
パープルツルカメ,エーシンフォワード(USA),パインアキナ
パープルヌーン,トランセンド,アランダ
パープルパルピナ,タイキシャトル(USA),スパイシーソース(USA)
パープルハート,ファスリエフ(USA),サニーハシレ
パープルヒストリー,スマートファルコン,ヤヨイコマチ
パープルヒビキ,プリサイスエンド(USA),スイートウィリアム
