

ボアヴィスタ,ロードカナロア,アビ(GB)
ポアンカレ,サムライハート,ホッジポッジ
ホイアン,トーセンホマレボシ,レインボーフェロー
ホイストポイント,トーホウエンペラー,スピードビウ
ポイズンピル,ブラックタキシード,ネヴァゾンターク
ボイセンベリー,ベーカバド(FR),ジェベルロバーツ
ホイッスルベルン,キングヘイロー,リリカルホイッスル
ポインテッドラン,プリサイスエンド(USA),レイクウッド
ポイントオブエイム,ロージズインメイ(USA),ビビアンアロー
ポイントパイパー,コマンズ(AUS),ラッシュカッター(IRE)
ポイントプラス,グラスワンダー(USA),ベネチアンテンズ
ポイントブランク,Ghostzapper(USA),ポイントアシュリー(USA)
ホイールバーニング,ヴィクトワールピサ,ピサノグレース
ホウオウウィング,ルーラーシップ,エイシンオーガスタ
ホウオウカーニバル,マツリダゴッホ,ザッツザウェイ
ホウオウサファイア,サウスヴィグラス(USA),ワンモアヒット
ホウオウサブリナ,ルーラーシップ,トラヴェシーア
ホウオウサマンサ,オルフェーヴル,タニノカリス
ホウオウサンダー,ゴールドアリュール,ヤマノオーロラ
ホウオウサンドラ,ヘニーヒューズ(USA),ヒカルマイゴール
ホウオウシックス,オルフェーヴル,タニノローゼ
ホウオウジャッジ,マンハッタンカフェ,フサイチジェット(USA)
ホウオウシャロン,エイシンフラッシュ,ホットレディ
ホウオウジャンプ,ハービンジャー(GB),スワンキーポーチ
ホウオウスクラム,アイルハヴアナザー(USA),クラックコード
ホウオウステップ,ハービンジャー(GB),オルトリンデ
ホウオウドリーム,ルーラーシップ,メジロドーベル
ホウオウパフューム,ハーツクライ,マチカネタマカズラ(USA)
ホウオウファースト,ファスリエフ(USA),ウインヴァネッサ
ホウオウブーケ,メイショウボーラー,クレイステルス
ホウオウマリリン,ダイワメジャー,クーデンビーチ(IRE)
ホウオウレックス,ダノンシャンティ,クリスマスツリー
ホウザンキングダム,エイシンデピュティ,ホウザングラマー
ホウショウナウ,ゴールドアリュール,ホウショウルビー(USA)
ホウショウバレン,ネオユニヴァース,ホウショウルビー(USA)
ホウショウブレット,ロージズインメイ(USA),ホウショウワールド(USA)
ボウゼノキョウ,パイロ(USA),パールスノー
ボウソウマッスル,アドマイヤマックス,バレイブランシュ
ボウパラディ,ハーツクライ,ラストリゾート
ボウマンミル,Street Cry(IRE),ファダラン(USA)
ホウヨウカルチャー,ベーカバド(FR),シャンハイハピネス
ホウヨウジーナス,トランセンド,マイディアダーリン
ホウヨウバルキリー,スターリングローズ,カラーガード
ホウライクィーン,タニノギムレット,ホウライマドンナ
ホウライジェンヌ,サウスヴィグラス(USA),ホウライトキメキ
ホウライシップ,アッミラーレ,ホウライトキメキ
ホウライショコラ,スタチューオブリバティ(USA),ホウライビクトリア
ホウライスピード,エイシンデピュティ,ホウライトキメキ
ホウライフリート,サウスヴィグラス(USA),ホウライマドンナ
ホウライマリーン,サウスヴィグラス(USA),ホウライビクトリア
ボウルオブチェリー,タートルボウル(IRE),オルゲイユ
ボウルズ,エイシンフラッシュ,アグネスメープル
ホウロクダマ,ショウナンカンプ,タマヒカル
ポエタリリカ,パイロ(USA),メイルリヒト
ポエティック,キングズベスト(USA),ザリーン
ポエム,ゼンノロブロイ,シマノラピス
ホクサイ,アルデバラン２(USA),ミヤビアゼリア
ホクザンマロン,フォーティナイナーズサン(USA),バルミーウインド
ホクセツ,アイルハヴアナザー(USA),オーミチェリッシュ
ホクセツエール,エイシンサンディ,テイクマイハート
ホクセツヒーロー,スクリーンヒーロー,リトルチュチュ
ホクセツプリンス,アジュディケーティング(USA),スリーチケット
ホクセンシシオー,ベルシャザール,マーベラスロマン
ホクセンジョウオー,サムライハート,モルフェキイ
ホクセンノキボー,タイキシャトル(USA),マリエッタ
ホクセンノマイ,ジャングルポケット,ラブイズミラクル
ホクソウブリッツ,リバースモード,ヒカルセレーネ
ホクソウフローラ,ドーントレダー,パスタイム
ホクソウラン,リバースモード,スズランメイク
ホクトグラスオー,サウスヴィグラス(USA),ミスアサティス
ホクトジャガー,ワイルドラッシュ(USA),チェルシーガール
ホクトスズラン,ワークフォース(GB),シシャモチャン
ホクトタキオン,ベーカバド(FR),グッドコマチ
ホクトマックイーン,ゼンノドラゴン(USA),ビジネスロマン
ボクノナオミ,ゴールドアリュール,ドゥーワップ
ボクハチャーリー,Myboycharlie(IRE),ダルシャ(FR)
ホクラニ,ショウナンカンプ,ハルエサン
ホクリュウオウ(USA),Blame(USA),Queen Beautyrest(USA)
ホクレアネイチャー,ブライアンズタイム(USA),ポラリストウショウ
ホクレアポパイ,イーグルカフェ(USA),プリンセスイブ
ホジェリアアスール,アドマイヤムーン,ジョイフルティアラ
ホシコチャン,トーセンホマレボシ,ウエスタンバスター(USA)
ポジターノ,ローエングリン,ジュラン
ポジティブスタンド,ハービンジャー(GB),スタンドオンエンド(USA)
ポジティブラリー,ダイワメジャー,インディボールド(USA)
ホシルミエール,ヴァーミリアン,ジュエリークイーン
ボスアンルーリー,ナカヤマフェスタ,ハッシュバンバン(FR)
ボスキャットグレイ(USA),ディスクリートキャット(USA),Two Bad Girls(USA)
ポステリタス,グラスワンダー(USA),トーワフォーチュン
ホスト,ファルブラヴ(IRE),ヴェルナッツァ(USA)
ボストンアプリコ,カンパニー,ボストンメリー
ボストンテソーロ(USA),Temple City(USA),Spirited Away(USA)
ボストンビリーヴ,アグネスタキオン,イサミサクラ
ホタル,ジョーカプチーノ,フィクシャス
ボタングラス,スウィフトカレント,ボタンフジ
ボチボチ,ソングオブウインド,モルフェアトラクト
ホッカイノソラ,ベーカバド(FR),キリーンガール(USA)
ホッコーエレノア,クロフネ(USA),ホッコーマスタング
ホッコーカゲムシャ,ストリートセンス(USA),ホッコーマスタング
ホッコーゴウケン,キングカメハメハ,フィーユ
ホッコースイセイ,メイショウボーラー,ホッコーエクレール
ホッコータピタン,サウスヴィグラス(USA),カネトシパリッシュ(ARG)
ホッコービフレスト,キングカメハメハ,ゴールドグレース
ホッコーフウガ,ゴールドアリュール,マダムチェロキー
ホッコーフジヤマ,グラスワンダー(USA),フジヤマビジン
ホッコーペネロープ,アイルハヴアナザー(USA),ホッコーティアラ
ホッコーマグニート,ワイルドラッシュ(USA),ドリームヒット
ホッコーマグマ,ゴールドアリュール,エアステビア
ホッコーモモタン,ベーカバド(FR),ホッコーマスタング
ホッコーライデン,アグネスデジタル(USA),ホッコーエクレール
ポッシビリタース,プリサイスエンド(USA),ブーケドロゼブルー
ポッセンホーフェン,エンパイアメーカー(USA),ラメール
ポッドガイ,パイロ(USA),ライヴマジック
ポッドガビ,ゼンノロブロイ,サーキットレディ(USA)
ポッドキャッツ,ブライアンズタイム(USA),ストームイメージ
ポッドクヒオ,キングカメハメハ,ヴァインバッハ
ポッドグレイシー,スマートファルコン,カネショウメロン
ポッドジゼル,ゴールドアリュール,スイレン(USA)
ポッドシャア,フォーティナイナーズサン(USA),シルクフェアリー
ポッドジョイ,マーベラスサンデー,マクロホーネット
ポッドジョーカー,キングカメハメハ,モガミヒメ
ポッドジーニー,ストリートセンス(USA),エリモエポナ
ポッドタイム,マヤノトップガン,サルトリーガール
ポッドティノ,ドリームジャーニー,アグリフェスタ
ポッドビアンカ,ベーカバド(FR),ヘリオポーズ
ホットファイヤー,ハービンジャー(GB),サワノプリマベーラ
ポッドブル,ゼンノロブロイ,ミスフェリチタ
ポッドブロンコ,ワークフォース(GB),スカーレットダンス
ホットライン,ベーカバド(FR),ハネダキセキ
ポッドルイージ,キングヘイロー,インプレッシヴ
ポッドルーカス,シニスターミニスター(USA),ヘリオポーズ
ポップアップスター,マンハッタンカフェ,ロリポップガール(USA)
ポップオーヴァー,サクラバクシンオー,ポップチャート
ポップコーンドール,トワイニング(USA),ポップコーンプリンセス(USA)
ポップシンガー,スマートファルコン,ケイアイポップス
ポップスフラッシュ,エイシンフラッシュ,アンソロジー
ポップレーベル,カンパニー,ポップチャート
ボデギータ,ゼンノロブロイ,キャンディーベル
ホトバシルチカラ,マヤノトップガン,サンデーキッス
ボナヴィーゴ,ディープインパクト,ラッシュラッシーズ(GB)
ボナジョルナータ,クロフネ(USA),スペシャルフロート
ボナッソーラ,ストーミングホーム(GB),ボーナラテルツァ
ボナデア,ルーラーシップ,コンコルディア
ボナテスタ,フレンチデピュティ(USA),サニーデイサンデー
ボナパルト,キングズベスト(USA),ワイドサファイア
ボナマティーナ,キングズベスト(USA),モーニングタイド(USA)
ボナリー,キングズベスト(USA),トシザマキ
ボニーケイティ,トーセンホマレボシ,パールレディ
ボニータミノル,ワークフォース(GB),セブンシークィーン
ボニートラボ,クロフネ(USA),ブルーベルベット
ホノカ,ロージズインメイ(USA),ヴイプラド(USA)
ホノルア,リーチザクラウン,ボストンビクトリア
ボビンレース,コンデュイット(IRE),レースウィング
ポベーダテソーロ,ブラックタイド,スターカットジェム
ホホエムオンナ,ミスキャスト,エガオヨシ
ポポカテペトル,ディープインパクト,ミスパスカリ
ポボス,キングカメハメハ,セクシーディナー
ポポチカ,ロージズインメイ(USA),ラゴマジョーレ
ホマレ,シニスターミニスター(USA),ドゥオナー
ホマレトリポス,フォーティナイナーズサン(USA),ブルートリポス
ホムラ,ヴィクトワールピサ,オールモストフォーエヴァー(USA)
ポメロ,ワークフォース(GB),オレンジピール
ポライトリー,スターリングローズ,ラガーファンタジー
ボラテリティパズル,ネオユニヴァース,プリティカウガール(USA)
ボランテレオ,ロードカナロア,プラウドビューティー(IRE)
ボリウッド,ルーラーシップ,ビスクドール
ポリカ,スマートボーイ,ポエマリリカ
ホリデイ,マツリダゴッホ,シンクオブミー
ホリデーモード(USA),Point of Entry(USA),Ski Holiday(USA)
ホリノフェイス,パイロ(USA),クイーンブルー
ボリュームラベル,ドリームジャーニー,クリッピングエリア
ホリーセクション,タートルボウル(IRE),ダイヤモンドギフト
ボリーバル,オルフェーヴル,アルゼンチンスター(ARG)
ホリーユニコーン,タニノギムレット,イエローパピヨン
ポルカ,アドマイヤムーン,ダンスフォージョーイ(GB)
ポルカシュネル,タートルボウル(IRE),ポルカマズルカ
ボルゾイ,ダノンゴーゴー(USA),オスカル
ポルタヴィオン,クロフネ(USA),アグネスショコラ
ポルタディソーニ,ネオユニヴァース,イズミコマンダー
ポルターレ,ブライアンズタイム(USA),アーペレーヌ
ポルックス,キャプテントゥーレ,トウカイウェーブ
ボルティモア,ステイゴールド,カチバ(USA)
ボルテージアップ,クーリンガー,ダンスミュージカル
ポルトゲーザ,スターリングローズ,セレクトレディ
ポルトサンベント,エイシンフラッシュ,ツクバビューティ
ポルトドレーヴ,ハーツクライ,フォーチュネイトダムゼル(USA)
ポルトドートウィユ,ディープインパクト,ポルトフィーノ
ボルドネス,ハーツクライ,エンプレスティアラ
ポルトボナール,ハイアーゲーム,ダイコーマリーン
ボルドー,プリサイスエンド(USA),イチコロ
ボルドーアストル,スクワートルスクワート(USA),シゲルダンヤバード
ボルドーシエル,タイキシャトル(USA),マイネソシオ
ボルドーバーグ,ケイムホーム(USA),ファーマソフト
ボルドープラージュ,アイルハヴアナザー(USA),マイネマリアンヌ
ボルドーフレーズ,グラスワンダー(USA),テイエムサイレン
ボルドーラパン,ストラヴィンスキー(USA),リアクションレート
ホルニッセ,カジノドライヴ(USA),ホーネットピアス
ポルボローネ,フレンチデピュティ(USA),ボーンザスカイ
ポロス,バトルプラン(USA),チチンプイプイ
ホロスコープ,アドマイヤムーン,スタリア
ポロンチャン,エイシンアポロン(USA),アペイロン
ホローポ,ゼンノロブロイ,シルクスパークル
ホワイトウィングス,フサイチリシャール,ゲラウトマイウエイ
ホワイトウォッシュ,オルフェーヴル,ランフォーイット(USA)
ホワイトガンベルト,フサイチリシャール,ミヤビダンサー
ホワイトキングダム,シルバーチャーム(USA),シーズゲイル
ホワイトクック,カジノドライヴ(USA),エイコークック
ホワイトクリスマス,スウェプトオーヴァーボード(USA),アラマサブレーヴ
ホワイトサクセス(USA),Stormy Atlantic(USA),Amazon Lily(USA)
ホワイトシスネ,ロージズインメイ(USA),キョウワスピカ
ホワイトスパロウ,トビーズコーナー(USA),アキノガイア
ホワイトタイガー,スパイキュール,ハウンドトゥース
ホワイトドラゴン(USA),Cowboy Cal(USA),Spot of Beauty(USA)
ホワイトニング,クロフネ(USA),デンタルハイジーン
ホワイトハピネス,エンパイアメーカー(USA),レッドフォーチュン
ホワイトパンドラ,キャプテントゥーレ,ベンテンヒカル
ホワイトフォース,ステイゴールド,シャルマンダー(USA)
ホワイトフリル,マンハッタンカフェ,マイダイナマイト
ホワイトブレンド,カネヒキリ,テンフォー(USA)
ホワイトフローラ,スズカフェニックス,ホワイトクルーザー
ホワイトリリー,シンボリクリスエス(USA),ドルチェアモール(USA)
ポワソンダブリル,メイショウボーラー,フェールクークー
ポワンセティ,ロードカナロア,アドマイヤカグラ
ポンエペレ,アイルハヴアナザー(USA),ミュージカルパレス
ボンカマラード,タニノギムレット,ススズカレン
ボンシュマン,フィガロ(USA),ビーボーン
ボンジュールヴォレ,ロードカナロア,ボンジュールメロン
ボンジュールボーラ,メイショウボーラー,リープリング
ポンズチャン,ハービンジャー(GB),プリティプリンセス
ボンセルヴィーソ,ダイワメジャー,バイモユリ
ボンテアトル,ダノンシャンティ,ユメノクラリティー
ポンテアンジェロ,サウスヴィグラス(USA),ヒロアンジェロ
ポンデザムール,マイネルラヴ(USA),クールドフランス(FR)
ポンデザール,ハーツクライ,ジョコンダ２(IRE)
ポンテファブリチオ,ダイワメジャー,ローマンブリッジ
ボンテン,アッミラーレ,ラブルビー
ボンデージ,スターリングローズ,ニシノシャトル
ポントス,シニスターミニスター(USA),フリートサクシード
ボンドストリート,ホワイトマズル(GB),サイレンスブランド
ポンドゼルク,カネヒキリ,アイディアルクイン
ボンナヴァン,シンボリクリスエス(USA),シナノネージュ
ボンナキュイ(IRE),Intikhab(USA),Warm Welcome(GB)
ポンポン,ブラックタイド,ポポチャン
ボンボンキャスト,ゼンノロブロイ,リターンキャスト
ボンホープ,パイロ(USA),ボンナターレ
ボンマルシェ,ソングオブウインド,モルフェプリンセス
ボンヤリ,タイキシャトル(USA),ロキロキ
ボンルット,ワークフォース(GB),キリエ
ボーアムルーズ,タニノギムレット,ダイワチャーム
ボーイズストーン,ロージズインメイ(USA),スウィートダンス
ボーイフレンド,リンカーン,タオルミーナ
ホーカスポーカス,オルフェーヴル,プリティウイッチ
ホーガンブリッジ,ブラックタイド,スカーレピーコック
ホーカーテンペスト,Hawk Wing(USA),リッチダンサー(GB)
ボーサンシー(USA),Tiz Wonderful(USA),Izzy Kate(USA)
ボーシエル,シンボリクリスエス(USA),オーゾラヲマウトキ
ボージャンシー,パイロ(USA),シルクマイホーム
ホーセズネック,ゴールドアリュール,トレッビアーノ
ボーダレスガール,ゴールドアリュール,マサノミネルバ
ボーダーオブライフ,キンシャサノキセキ(AUS),サクラサク２
ホーチャム,ステイゴールド,ラプターセイハート
ボーディングパス,ディープスカイ,エリーゼパレス(IRE)
ボードウォーク,オルフェーヴル,ハーマジェスティ
ポートオブコール,シニスターミニスター(USA),アズサローレル
ポートカナベラル,カンパニー,ソルスティス
ポートナイトサイト,ダノンシャンティ,ルックアミリオン
ポートフィリップ,ハーツクライ,アドマイヤテレサ
ホーネットドリーム,スーパーホーネット,ドリームスター
ホープインザスカイ,ダイタクリーヴァ,ファイティングナナ
ホープウイング,スマートファルコン,スギノエスペランザ
ホープクリスエス,シンボリクリスエス(USA),ライトレール
ホープスター,トーセンホマレボシ,カンタベリーラヴ
ホープトウショウ,メイショウボーラー,ストームトウショウ
ホープバイオ,カンパニー,シーダーブレイクス
ホーププラウド,ディープブリランテ,シゲルハチマンタイ
ホープフルスター,ゼンノロブロイ,ストラテジー
ホープフロムノース,ローマンエンパイア,マイホープ(IRE)
ホープライズ,トビーズコーナー(USA),プリマビスティー
ホーマンビジュー,キングカメハメハ,ゴレラ(FR)
ホーミー,サウスヴィグラス(USA),ユウフジ
ホームゲーム,オレハマッテルゼ,シルクマイホーム
ホームズ,スズカマンボ,リュウヨウ
ホームルーム,ストーミングホーム(GB),ステージスクール(USA)
ボーラトウショウ,チーフベアハート(CAN),コルサトウショウ
ボーラーハット,メイショウボーラー,セリーナトロフィー
ポーラーブレイズ,キャプテントゥーレ,スイリンカ
ボーリン,アドマイヤマックス,ターキッシュブルー
ホーリーアーマー,ハービンジャー(GB),サンセットバレー
ホーリーエンジェル,ダイワメジャー,トーワトレジャー
ホーリーカバージョ,ハードスパン(USA),モンローライン
ホーリークロス,タイキシャトル(USA),マヤノアンズ
ホーリーシュラウド,Cape Cross(IRE),オンヴェラ(IRE)
ホーリーデーンズ,ロージズインメイ(USA),ベルモントデーンズ
ホーリーパワー,カンパニー,イニシエノウタ
ホーリーバーン,マルカシェンク,エーシンメインダム
ホーリーブレイズ,フリオーソ,スキャニングジョイ
ホーリーレジェンド,アイルハヴアナザー(USA),セイングレンド
ポールヴァンドル,ダイワメジャー,レディドーヴィル(FR)
ポールウィン,オルフェーヴル,アンファミーユ(USA)
ポールダンサー,ホワイトマズル(GB),ラヴァーズテーラー
ボールドアテンプト,ゴールドアリュール,タイムトラベリング
ボールドカレント,スウィフトカレント,ラブミラー
ホールドザボール,ヴァーミリアン,レディマハロ
ボールドジャパン,アドマイヤジャパン,ラブミラー
ボールドスパルタン,アドマイヤジャパン,ラブカーナ
ボールドハート,エンパイアメーカー(USA),ラブハート
ボールライトニング,ダイワメジャー,デフィニット(USA)
ボーンインメイ,ロージズインメイ(USA),カデンツァ
ボーンスキルフル,ショウナンカンプ,ボーンスター
ボーンストーン,ブライアンズタイム(USA),キャロットウイン
ボーントゥレイン,エンパイアメーカー(USA),ボーントゥブーギー(GER)
ボーンレガシー,ショウナンカンプ,ボーンスター
