

オアシスクイーン,シニスターミニスター(USA),リッピアピンク
オアハカ,キングズベスト(USA),グワダラハラ(GER)
オイチ,シンボリクリスエス(USA),ケージーフジムスメ
オイデ,エイシンフラッシュ,カネスヴィバーチェ
オイヌサマ,キンシャサノキセキ(AUS),セイカシリアス
オイランドウチュウ,スターリングローズ,ダイメイジュエリー
オイルタウン,タイムパラドックス,スーパーオアシス
オウガ,クロフネ(USA),チャンピオンダイヤ
オウケノヒメミコ,ヴァーミリアン,シネマライン
オウケンヴィクトリ,オウケンブルースリ,リーチトゥピース(USA)
オウケンキング,キングカメハメハ,メロウメロディ
オウケンゴールド,ワイルドラッシュ(USA),ワイエムサチ
オウケンシスター,ジャングルポケット,シルバージョイ(CAN)
オウケンジョーカー,トーセンホマレボシ,オウケンハート
オウケンスターダム,ルーラーシップ,メロウメロディ
オウケンダイヤ,オウケンマジック,オウケンハート
オウケンビリーヴ,クロフネ(USA),ビスクドール
オウケンブライト,クロフネ(USA),クヴァルダ
オウケンブラック,アグネスデジタル(USA),メジロバーミューズ
オウケンムーン,オウケンブルースリ,ムーンフェイズ
オウケンラブ,オウケンマジック,トゥルーラブ
オウケンワールド,クロフネ(USA),オウケンガール
オウシュウソング,フリオーソ,ベティボルテクス
オウノミチ,オレハマッテルゼ,ナゾ
オウマタイム,タイムパラドックス,ケイウンブルーム
オエドノハヤテ,ファスリエフ(USA),マーベラスリリー
オオアナカモ,モンテロッソ(GB),ジーピークロス
オオイニイコウヨ,ファルブラヴ(IRE),マレットベガ
オオイハピネス,ベーカバド(FR),ハローハピネス
オオイリ,ルーラーシップ,パッショナルダンス
オオエピクシー,アドマイヤマックス,ゲイリーピクシー
オオオヤブン,ゴールドヘイロー,スティッチ
オオカリベグット,ソングオブウインド,ワレンダークイン
オオカリベフレアイ,ビービーガルダン,ワレンダークイン
オオシマテティス,ディープブリランテ,オオシマセリーヌ
オオタカ,ジャイアントレッカー(USA),チャームピクチャー
オオヤマネコ,アッミラーレ,プリンセスゴーラン
オカゲサマ,アドマイヤマックス,スイートグラーツ
オガシ,ネオユニヴァース,ジェイケイラン
オカミサン,ハーツクライ,プランシングレディ
オキテスグメシ,アグネスデジタル(USA),ラインクリスタル
オキニメスママ,ストーミングホーム(GB),シルクジュリエット
オキノクィーン,シンボリクリスエス(USA),オキノキセキ
オキノプリマ,サウスヴィグラス(USA),アドマイヤバレー
オクシー,スターリングローズ,ヴィーナスキャット
オクタヴィウス,ゴールドアリュール,オオトリヘプバーン
オクタゴン,バトルプラン(USA),チャームラブ
オグマンテ,ダノンシャンティ,スサーナトウショウ
オクラクオウ,ロッコウオロシ(USA),プリンセスレール
オクラホマ,ケープブランコ(IRE),フラーテイシャスミス(USA)
オグリガール,スマートボーイ,オグリピンキー
オグリグラス,サウスヴィグラス(USA),オグリダイアン
オグリタイム,タイムパラドックス,オグリビーナス
オグリノース,サウスヴィグラス(USA),オグリビーナス
オグリバード,タイムパラドックス,ビューティアイ
オグリランダル,デュランダル,サツキアラシ
オケアノス,プリサイスエンド(USA),オーミチェリッシュ
オコルデヤスシ,スウェプトオーヴァーボード(USA),モントレゾール
オコルミラクル,ファスリエフ(USA),コパノジャーノー
オサキバライ,キングヘイロー,フェスティヴキティ
オシキャット,スクリーンヒーロー,イシブミ
オシノイッテ,フサイチリシャール,コハルカントリー
オジュウチョウサン,ステイゴールド,シャドウシルエット
オジョーノキセキ,キンシャサノキセキ(AUS),キャプテンガール
オスカークイーン,シニスターミニスター(USA),カリビアンセレブ
オスカールビー,ハーツクライ,リキセレナード
オスカーレーヴ,ネオユニヴァース,トゥースペシャル(USA)
オスズ,ローエングリン,ギタートウショウ
オスティナート,スマートファルコン,カシノリボン
オストラコン,ゴールドアリュール,ドリームマイウエイ
オタカラハッケン,オペラハウス(GB),スナークサクセス
オダツ,アジュディミツオー,サンデーシャドウ
オッズオン,カネヒキリ,カメレオン
オッティー,ローレルゲレイロ,アートレインボー
オッドアイ,ロージズインメイ(USA),マイネウインク
オツボネサマ,フォーティナイナーズサン(USA),チルシーカー(USA)
オデュッセイア,ヴィクトワールピサ,ドライアッド
オデュッセウス,ファルブラヴ(IRE),ライツェント
オテンバキッズ,オルフェーヴル,ドメーヌ(CHI)
オテンバランナー,メイショウボーラー,モカサンデー
オトコギ,サウスヴィグラス(USA),プリモスペシャル
オトコギイッポン,キングヘイロー,ビクトリーステップ
オトコギマサムネ,ジャングルポケット,レッドベリル
オトメノスガタ,フリオーソ,メグリ
オドルタロウ,トビーズコーナー(USA),メインロージ
オドロキ,ナカヤマフェスタ,シルキーメイン(IRE)
オニチャン,アグネスデジタル(USA),ナリタジュエリー
オニニカナボー,サムライハート,フェーヴ(USA)
オニノシタブル,ストーミングホーム(GB),マジックミラージュ(IRE)
オニノヘイゾウ,ロージズインメイ(USA),トランスルーセント
オニパンダ,メイショウボーラー,ガイアアーティスト
オネダリ,ショウナンカンプ,ラヴォイラ(FR)
オノリシャス,カネヒキリ,オイスターチケット
オノリス,トーセンホマレボシ,フェリスタス
オノーレペスカ,トーセンホマレボシ,メイショウアルペン
オハナ,ディープインパクト,ハウオリ
オヒアレフア,ワイルドラッシュ(USA),グランマモーゼス
オビシャ,ヴァーミリアン,ワンモアミイチュー
オヒナサマ,カジノドライヴ(USA),バンデリータ
オフィシエ,サムライハート,カレンダーガール
オフクヒメ,キンシャサノキセキ(AUS),シーソング
オフコース,エイシンアポロン(USA),セイカドミノ
オフザウォール,ヴァーミリアン,メイショウフレスコ
オフザロック,ゼンノロブロイ,オフジオールドブロック(USA)
オブセッション,ディープインパクト,パーシステントリー(USA)
オプティカルビート,ディープブリランテ,ピンクトルマリン(USA)
オブラプリーマ,ハーツクライ,オブザーヴァント(USA)
オブリゲーション,アドマイヤマックス,カンシャノキモチ
オプレスバイオ,ディープブリランテ,アマゾネスバイオ
オペラアクター,シニスターミニスター(USA),フォルクスオーパー
オペラカイジン,メイショウボーラー,オペラガール
オペラグローブ(USA),Speightstown(USA),Funny Moon(USA)
オペラサンデー,ローエングリン,ミサトペニー
オペラシーズン,キングズベスト(USA),チェルビム
オペラハット,メイショウサムソン,ボウレジュ
オペレッタスキー,フサイチコンコルド,プラススキー
オベロンホワイト,スウェプトオーヴァーボード(USA),アーチストダンス
オベーション,マーベラスサンデー,ピサノケリー
オマツリサワギ,マツリダゴッホ,ローズウッド
オミマイスルゾー,ヴァーミリアン,ムーンビスコッティ
オミミオメメオデコ,ハービンジャー(GB),ジョイフルステージ
オメガヴェンデッタ,ゼンノロブロイ,ビハインドザマスク
オメガクオリティー(USA),Elusive Quality(USA),フーハイナ(ARG)
オメガグランディス,チチカステナンゴ(FR),オメガトゥルカラー
オメガジェルベーラ,ジャングルポケット,クインリーグレイス
オメガシンドバッド,ノヴェリスト(IRE),ワイキューブ
オメガスカイツリー,ゼンノロブロイ,オメガアイランド
オメガタックスマン,ショウナンカンプ,オメガフォーチュン
オメガドラクロワ,ステイゴールド,カチバ(USA)
オメガパフューム,スウェプトオーヴァーボード(USA),オメガフレグランス
オメガハートビート,ヴィクトワールピサ,オメガアイランド
オメガプランタン,ロードカナロア,スプリングチケット
オメガベントレー,サクラバクシンオー,オメガロンド
オメガラヴィサン,ロードカナロア,オメガグレイス
オメガレイノワール,ステイゴールド,ヴェストリーレディ(USA)
オモイサイフ,ディープスカイ,ファスキナーレ
オモイデイロイロ,スマートロビン,アサクサロータス
オモイノママ,ローエングリン,タイキエルドール
オモウツボ,サムライハート,ペリドット(GB)
オモシロソウ,モンテロッソ(GB),アナタゴノミ
オモテナシ,ブライアンズタイム(USA),トップオブザヒル
オヤカタ,メイショウボーラー,ヤマカツジャスミン
オヤコダカ,サムライハート,オメガカリビアン
オヤジノハナミチ,パイロ(USA),ペスカトリーチェ
オラシオン,ダイワメジャー,ジョウノボレロ
オランジェリー,マヤノトップガン,ツジノローズ
オランタイ,ゼンノロブロイ,マスカラーダ
オリアナフィオーレ,グラスワンダー(USA),マイネレーツェル
オリアナロゼッタ,ナカヤマフェスタ,エリザベススイート
オリヴァー,ネオユニヴァース,シルヴァーグレイル(CAN)
オリエンタルダンス,キングカメハメハ,ダンスノワール
オリエンタルブーケ,シルポート,レアシルウィア
オリエンタルポリス,アドマイヤコジーン,カントリーギャル
オリエンタルボーン,タイキシャトル(USA),ウィスキーカラー
オリエンタルローズ,ゴールドヘイロー,レアシルウィア
オリエント,ゴールドアリュール,ルタンデスリーズ
オリエントワークス,ワークフォース(GB),オリエントチャーム
オリオリ,ロードカナロア,スマイルビジン
オリオンアンジュ,ダノンバラード,マイネパトリシア
オリオンエール,タイムパラドックス,ザリリーレイナ
オリオンザジャパン,クロフネ(USA),パーシャンブルー
オリオンローラ,フリオーソ,ムーランヴェール
オリジナルデザイン,ボストンハーバー(USA),トピカ
オリジナルポイント,グラスワンダー(USA),クロースハーモニー
オリジネイター,エンパイアメーカー(USA),ローレルマロン
オリヒメ(USA),マジェスティックウォリアー(USA),Champagne Royale(USA)
オリンピアスカイ,ロージズインメイ(USA),シルクオリンピア
オリンピアン,キンシャサノキセキ(AUS),ゴールデンベティー
オルガンパイプ,サウスヴィグラス(USA),キャッツプライド(USA)
オルキスリアン,キングカメハメハ,アクイレジア
オルティラアスール,キンシャサノキセキ(AUS),サングレアズール
オルディル,サウスヴィグラス(USA),ノルブリンカ
オルティンド,ジャングルポケット,オルトリンデ
オルデトワール,ゴールドアリュール,マイベストスター(AUS)
オルトシア,ディープインパクト,メーデイア
オルトルート,ローエングリン,スワンキーポーチ
オルトロス,ワークフォース(GB),ライラプス
オルナ,キングカメハメハ,ショウナンアクト
オルニス,マンハッタンカフェ,サーキットレディ(USA)
オルノス,ゴールドアリュール,ミコノス
オルファクト,ロードカナロア,ブーケフレグランス
オルファリオン(USA),Midnight Lute(USA),Trophy Bride(USA)
オルボンディール,ステイゴールド,サダムグランジュテ
オルレアンローズ,ベーカバド(FR),テンザンローズ
オルロフ,スペシャルウィーク,ラビットフット(USA)
オレイアス,フォーティナイナーズサン(USA),エンジェルフェザー
オレオールカフェ,ネオユニヴァース,コミラス(FR)
オレカーニバル,ダイワメジャー,ワインレッド
オレノヴィジョン,アイルハヴアナザー(USA),ジャングルムーン(IRE)
オレノソラ,ヴァーミリアン,アオモミジ
オレノマニラ,フリオーソ,フクウマ
オレハツライヨ,トランセンド,キャンディームーン(USA)
オレンジウォーク,ショウナンカンプ,ブザムカレッサー
オレンジチェルロ,ローエングリン,セフティパラダイス
オレンジノート,ゼンノロブロイ,グリーリーレイ
オレンジヒロイン,スクリーンヒーロー,ライプオレンジ
オレンジポピー,ハイアーゲーム,シルキーコースト(AUS)
オレンジホープ,ストラヴィンスキー(USA),タニノクラリッジ
オロフィナアスール,キンシャサノキセキ(AUS),リメインフォレスト
オロマップレディ,ケイムホーム(USA),レディスウィフト(USA)
オワゾードール,ノヴェリスト(IRE),パラダイスバード
オンアクラウド,ロージズインメイ(USA),カリビアンセレブ
オンザウインド,ヴィクトワールピサ,ジュリエット(IRE)
オンザヒル,ブレイクランアウト(USA),ギフト
オンザフロウ,ホワイトマズル(GB),ワイメアビーチ
オンザロックス,サムライハート,ベルモントエルメス
オンタケハート,サムライハート,プリティラパス
オンディーヌ,ネオユニヴァース,ニチドウルチル
オンファサイト,ブラックタイド,ミラグロレディ
オンフリーク,キンシャサノキセキ(AUS),ハピネスデスネ
オンベンデッドニー,スマートロビン,グレンチェック
オンマイステージ,キンシャサノキセキ(AUS),クリスティーナサンチェス(USA)
オンリゲットベター,ヴィクトワールピサ,センスオブアート(USA)
オンリートゥモロー,ディープインパクト,アコースティクス
オンリーワンスター,スタチューオブリバティ(USA),ローランシノワーズ
オンワードハドソン,エンパイアメーカー(USA),オンワードイイデス
オンワードハンター,パイロ(USA),オンワードイイデス
オンワードマリー,ステイゴールド,オンワードマルタ
オンワードミシガン,ステイゴールド,オンワードマルタ
オンワードラスター,ゴールドアリュール,オンワードイイデス
オンワードリビエラ,バゴ(FR),オンワードイイデス
オンワードリベルタ,バゴ(FR),オンワードミシェル
オーヴァルブーケ,アドマイヤジャパン,ニシノハナグルマ
オーヴァーライト,ヘニーヒューズ(USA),オーヴァーアンダー(USA)
オーヴィレール,シンボリクリスエス(USA),シャンパンフルート
オーヴェルニュ,スマートファルコン,ギュイエンヌ
オーヴェール,マツリダゴッホ,エレガントキャット
オーヴォドーロ,ローエングリン,ステラマリス
オーガニックライフ,アドマイヤジャパン,ユウタージェンヌ
オーキッドテソーロ,ディープインパクト,シスタリーラヴ(USA)
オーキッドメモリー,ヴァーミリアン,ミストラルグリーン(AUS)
オークヒルロッジ,ハービンジャー(GB),オークヒルパーク
オークフィールド,スターリングローズ,ハルジオン
オークレール,オルフェーヴル,セリメーヌ(IRE)
オーケストラ,ハーツクライ,オメガスピリット
オーゴンアレッタ,シニスターミニスター(USA),レディービスティー
オーゴンボルト,アッミラーレ,スパイシーレディー
オーゴンワンダー,スクリーンヒーロー,キーツヨイ
オーサミスト,ベーカバド(FR),ハネダテンシ
オーサム,ゴールドアリュール,チャーミングオーラ
オーサムクイーン,クロフネ(USA),オーサムチャーム(USA)
オーサムバローズ,ネオユニヴァース,スイートブレナム
オーサムミッション,ディープインパクト,ウィラビーオーサム(USA)
オーサムロード,ロードカナロア,オーサムチャーム(USA)
オージャイト,キングカメハメハ,ジェダイト
オーシャンアロー,ロードアルティマ(USA),オーシャンレディー
オーシャンケリー,シンボリクリスエス(USA),ベイルリ
オーシャンセブン,ディープインパクト,ロリーフォードリー(IRE)
オーシャンティ,ダノンシャンティ,リングレット
オーシャンデイジー,アッミラーレ,カネショウバナナ
オーシャンビュー,マヤノトップガン,アスコットビコー
オーシャンムーサ,アグネスデジタル(USA),クロカミノマイ
オーシャンルクス,スマートファルコン,シャルフミニョンヌ
オーズ,ソングオブウインド,ロサガリカ
オースオブオフィス,Street Cry(IRE),リージェンシーロマンス(GB)
オースオブゴールド,オルフェーヴル,ティッカーテープ(GB)
オースタラ,ヴィクトワールピサ,トリアノンパレス
オースティン,ストーミングホーム(GB),エイプリルスカイズ(GB)
オースミイージー,ハーツクライ,ナリタレインボウ
オースミジョージ,ノヴェリスト(IRE),オースミハルカ
オースミストーン,ファルブラヴ(IRE),プレイアローン(USA)
オースミチャド,ネオユニヴァース,レディオブチャド(IRE)
オースミナイン,ディープインパクト,エアイゾルテ
オースミハナチャン,ハーツクライ,オースミリンド
オースミバレル,クロフネ(USA),デリキットピース
オースミベリル,ダイワメジャー,ティティカカ
オースミペンタス,キングズベスト(USA),オースミコスモ
オースミホイップ,マヤノトップガン,ベツレヘムスター
オースミマルス,ジャングルポケット,オースミマコ
オースミメテオール,マンハッタンカフェ,エアイゾルテ
オースミラナキラ,ハーツクライ,オースミハルカ
オーダシティー,エンパイアメーカー(USA),クロチェーラ(USA)
オータムスカイ,ステイゴールド,スターベゴニア(GB)
オータムヘイロー,ゴールドヘイロー,ウインクセレネ
オーダードリブン,ディープインパクト,コマーサント(FR)
オーデットエール,ハーツクライ,スカイアライアンス(CAN)
オートヴィル,アイルハヴアナザー(USA),シチリアーナ
オートクレール,デュランダル,ジョイアサーティン
オートーリーブ,アポロキングダム(USA),マルガリータ
オーネットタイガー,エイシンフラッシュ,エリモアクアポリス
オーネットダンディ,スズカマンボ,マツリバヤシ
オーネットハート,ローレルゲレイロ,トドロキエンジェル
オーネットヒーロー,メイショウサムソン,ハツネ
オーパ,ゼンノロブロイ,ヴィヤダーナ(FR)
オーパスサブリナ,ハービンジャー(GB),オーパスクイーン
オーバーカム,ネオユニヴァース,プラジェラート
オーバークロック,ゴールドアリュール,マサノミネルバ
オーバーザリミッツ,パイロ(USA),オリミツキネン
オーバースペック,プリサイスエンド(USA),オーミチェリッシュ
オーバーチュア,ディープインパクト,ドリームカムカム
オーバーハング,キングカメハメハ,ペディクラリス
オーバーラッキー,アイルハヴアナザー(USA),スペシャルウーマン
オーブスプリング,ディープブリランテ,ナスケンアイリス
オープニングアクト,ロージズインメイ(USA),エアリカコ
オーフルテソーロ,キングカメハメハ,ソニックグルーヴ
オーブルージュ,ルーラーシップ,クレヨンルージュ
オープンアーム,アポロキングダム(USA),ホッコーウエスタ
オープンキッチン,エイシンフラッシュ,ディナーパーティ(IRE)
オープンザウェイ,ヨハネスブルグ(USA),ヨウヨウ
オープンハート,マルカシェンク,ベルソング
オープンマインド,ロードカナロア,レッドベルフィーユ
オーマイガイ,パイロ(USA),リスティアアスリー
オーマイホース,チチカステナンゴ(FR),スナークエレガント
オーミエスティーム,ダノンシャンティ,イソノヴィーナス
オーミガボット,タニノギムレット,パープルパンチ
オーミカンタービレ,タニノギムレット,カンタベリービート
オーミシェルー,サウスヴィグラス(USA),アムールエテルネル
オーミシャンクス,サウスヴィグラス(USA),カーディナルローズ
オーミシューマン,フサイチリシャール,パープルパンチ
オーミスマイル,コンデュイット(IRE),ルージュマジック
オーミソナタ,ビービーガルダン,ジャングルウィップ
オーミティグリス,ゼンノロブロイ,ポットアカデミー
オーミパドドゥ,マーベラスサンデー,ポットアカデミー
オーミバルー,グラスワンダー(USA),カーディナルローズ
オーミプレスト,キンシャサノキセキ(AUS),ローズロック
オーミリスペクト,パーソナルラッシュ(USA),スカイノリン
オーミルーティン,タニノギムレット,ツルマルグラマー
オーラティアラ,カネヒキリ,オーラミク
オーラパ,ダイワメジャー,ポポラス
オーラフォ,オルフェーヴル,サラトガ
オーラベガス,スマートファルコン,ラヴァリーズーム
オーラムカノーロ,ハードスパン(USA),ミステリアスオーラ
オーラムーン,アドマイヤムーン,サッサイア
オーラリー,シンボリクリスエス(USA),ゴッドフローラ
オーリャセブン,タニノギムレット,ルージュ
オールイン,ダイワメジャー,マジカルシェイプ
オールインワン,アドマイヤムーン,ゴールドコイン
オールウェイズゼア,フリオーソ,ニュースターガール
オールオブナイト,キングカメハメハ,ピサノグラフ
オールオブユー,ダイワメジャー,エフロレス
オールザゴー,ステイゴールド,アルーリングボイス
オールザベスト,Speightstown(USA),ファンダングル(USA)
オールジャパンラブ,ザール(GB),イージーラフター(UAE)
オールスマイル,エンパイアメーカー(USA),アディアフォーン
オールディーズ,マーベラスサンデー,ローランシノワーズ
オールデフィート,ブラックタイド,バアゼルローズ
オールデン,ディープスカイ,ビシャーラ(IRE)
オールトゥーウェル,ハーツクライ,チェリーフォレスト
オールドクラシック,ダノンシャンティ,ブローオブサンダー
オールドナシュワン,バゴ(FR),サパス(USA)
オールドベイリー(USA),To Honor and Serve(USA),Passion Du Coeur(USA)
オールドラヴ,スマートボーイ,ハヤブサラヴハート
オールドラゴン,ダノンシャンティ,ザライズドラゴン
オールトンパーク,キングヘイロー,アロマジュエリー
オールパスレル,ゴールドヘイロー,ブリッジトウショウ
オールフォーラヴ,ディープインパクト,レディアルバローザ
オールブラッシュ,ウォーエンブレム(USA),ブラッシングプリンセス(USA)
オールブリッジ,メイショウボーラー,イエロージャケット
オールポッシブル,ダイワメジャー,シーズインポッシブル(USA)
オールマイハート,ロードカナロア,ブルーモーメント
オールマイライフ,ネオユニヴァース,ドリームヴィーナス
オールマンリバー,キングカメハメハ,ペディクラリス
オールモストゼア,ディープインパクト,エヴァディングタンペット(GB)
オールラウンド,パーソナルラッシュ(USA),エンジェルルック
オールージュ,トビーズコーナー(USA),フィリグリーレース(USA)
オーレア,オルフェーヴル,コスモバルバラ
オーロスターキス,ヘニーヒューズ(USA),ニシノビギン
