
サノココ,サウスヴィグラス(USA),マイネアレグリア
サノサマー,サマーバード(USA),パピュラ
サノサン,バゴ(FR),エトレーヌ
サノシスター,ナカヤマフェスタ,コーラルビュー
サノノカガヤキ,カネヒキリ,ホウヨウターゲット
サノノジャングル,ジャングルポケット,ホッカイショコラ
サノノショウグン,サウスヴィグラス(USA),ビューティソルジャ
サノノスカイ,ディープスカイ,クリントンガール(USA)
サノノタテヤマ,エスポワールシチー,ハイセンスガール
サノノツルギ,ネオユニヴァース,シックファイター
サノノティアラ,クロフネ(USA),アニマートホウヨウ
サノノドラゴン,クロフネ(USA),エトレーヌ
サノノバクシン,ケイムホーム(USA),バクシンスクリーン
サノノヒカリ,メイショウボーラー,メモラブルワーズ
サノフェス,マツリダゴッホ,ウスイ
サノヘッド,ケイムホーム(USA),ホウヨウターゲット
サノマル,サウスヴィグラス(USA),ボヤージ
サノラブ,サウスヴィグラス(USA),カミヒコーキ
サノリュウ,クロフネ(USA),アドマイヤジュノー
サノルア,ヴァーミリアン,ナムララピス
サバイバルオオオク,ストロングリターン,トノノオナリー
サバイバルチャンス,グラスワンダー(USA),カザグルマ
サバイバルポケット,ジャングルポケット,メイカ
サパティアード,チャクラ,ロマンスアンダルザ(IRE)
サハラデザート,ワイルドラッシュ(USA),トップオブザヒル
サハラドゥ,ベーカバド(FR),ビクトリーレディー
サハラファイター,ロージズインメイ(USA),ビクトリーレディー
ザハンド,タニノギムレット,タイキロンド
サバンナロード(USA),Street Boss(USA),Trisha(USA)
サバーイ,カジノドライヴ(USA),インフィジャール
サピド,フィガロ(USA),エーグルドゥース
サビーナクレスタ,サクラバクシンオー,キョウエイアン
ザファーストバイオ,ハービンジャー(GB),ブライトネスバイオ
サフィロス,キンシャサノキセキ(AUS),ダークサファイア(USA)
サブノエガオ,マイネルラヴ(USA),タケショウティアラ
サブノキフジン,ダンスインザダーク,ユーワパンドラ
サブノクロヒョウ,ロージズインメイ(USA),サブノイナズマ
サブノシアワセ,ロードアルティマ(USA),メモラブルワーズ
サブノジュニア,サウスヴィグラス(USA),サブノイナズマ
サブノテイオー,ヴァーミリアン,サブノイナズマ
サブノハッピー,アジュディケーティング(USA),サブノイナズマ
サブノヒマワリ,ワイルドラッシュ(USA),ハンナリト
サブノプリンセス,ローエングリン,マチカネササメユキ(USA)
サブマリン,ステイゴールド,アスクレピアス
サプライズハッピー,ゴールドアリュール,ハナマル
サプライズハンター,サウスヴィグラス(USA),バーレーヘッズ
サブライムカイザー,キングカメハメハ,マドモアゼルシッシ(IRE)
サフランスター,サクラバクシンオー,ヨドノホープ
サフランタイヨウ,タニノギムレット,ヨドノホープ
サフランハート,アドマイヤオーラ,サフランカーネギー
サフランブーケ,スターリングローズ,サフランカーネギー
ザプリオレス,トゥザグローリー,テンザンジョイ
サブリナ,ダノンシャンティ,セイクリッドフレイム(USA)
ザブルグ,ヨハネスブルグ(USA),リュウメイ
サプルマインド,ディープインパクト,シリアスアティテュード(IRE)
サプール,フォーティナイナーズサン(USA),マイネフランシー
サプールコンゴ,キンシャサノキセキ(AUS),スイートクラフティ(USA)
ザベストエバー,キンシャサノキセキ(AUS),マイワイルドローズ(USA)
サマニー,スタチューオブリバティ(USA),ショコット
サマルカンドブルー,アッミラーレ,スズヒメ
サマーグレース,ケイムホーム(USA),キアーロ
サマーサプライズ,サマーバード(USA),サウンドアリュール
サマーサラファン,ダイワメジャー,クールリーヴ
サマースワロー,フォーティナイナーズサン(USA),サツマガイア
サマーソルスティス,サマーバード(USA),チアズヒカリ
サマーダイアリー,ケイムホーム(USA),ミヤビアルカディア
サマーダンディー,サマーバード(USA),エレガンスローズ
サマードレス,ハーツクライ,スパイシークラウン
サマーボーイ,キンシャサノキセキ(AUS),ノブクィーン
サマーマロン,サマーバード(USA),ミルリュユッテ
サマーローズ,ハービンジャー(GB),キャッスルトン
サミシガリヤノユメ,メイショウボーラー,エターナルドリーム
サミダレ,ロージズインメイ(USA),エアバドゥ
サミット,サウスヴィグラス(USA),タニノピカンテ
サミットプッシュ,エイシンフラッシュ,ブロードピーク
ザミーフォーリア,ヴァーミリアン,スカーレピーコック
サムキー,ディープスカイ,マリーシア
サムシングクール,ヘニーヒューズ(USA),ヤンゲストリーター
サムシングフレア,メイショウサムソン,シルクヴァルキリー
サムソンズライト,メイショウサムソン,スギノキューティー(USA)
サムソンフォンテン,メイショウサムソン,ナドレ
サムデイサムウェア,ネオユニヴァース,オンヴェラ(IRE)
サムバディトゥラブ,スマートボーイ,オボロヅキ
サムライサーベル,サムライハート,マイネフォクシー
サムライズム,カンパニー,パッションメイト
サムライダマシー,サムライハート,アサクサロータス
サムライッコ,サムライハート,エイダイハート
サムライテイオー,サムライハート,ミスハヤテ
サムライドライブ,シニスターミニスター(USA),ユニティ
サムライノモン(USA),Medaglia d'Oro(USA),Sonoma Song(USA)
サムライフォンテン,サムライハート,ヨーカンドパリ
サムライブルー,キングカメハメハ,スティールパス
サムライレジェンド,サムライハート,グレイスキッス
サムライロード,ルーラーシップ,インユアアームス
サメノコキック,タイムパラドックス,ニシノグレート(USA)
サヤカチャン,リーチザクラウン,アップルトウショウ
サヤカローレル,アドマイヤマックス,チャーミングギャル
サヤネエ,ファルブラヴ(IRE),ミユキ
サラキア,ディープインパクト,サロミナ(GER)
サラザン,ハーツクライ,エービーヌードル(USA)
サラス,オルフェーヴル,ララア(USA)
サラセニア,ワイルドワンダー,オービーレディー
サラセルバ,タップダンスシチー(USA),ベンテンサクラ
サラダガール,サンライズペガサス,プリモピアット
サラデコラシオン,タニノギムレット,アースツリー
サラトガスピリット,ハーツクライ,サラトガ
サラドリーム,ロードカナロア,サイレントソニック
サラヒメ,フリオーソ,サムタイムレーター
サラマンカ,ダノンシャンティ,ガバーナ(IRE)
サラート,マルカシェンク,メジロアニマート
サラーブ,ルーラーシップ,サマーハ(GB)
サリエット,マンハッタンカフェ,ウェイクアップマギー(IRE)
サリネロ(USA),Uncle Mo(USA),Aguilera(USA)
サリュダムール,ハーツクライ,グリーティングス(GB)
ザリーティー,フリオーソ,ミヤビリーティー
サリーバットマン,スクリーンヒーロー,ダービーズポケット
サルガッソ,ハービンジャー(GB),タニノカリス
サルサディオーネ,ゴールドアリュール,サルサクイーン
サルサデージャ,ヴァーミリアン,グリーリーランド(USA)
サルタート,ゴールドアリュール,アイルビーバウンド
サルダーナ,ルーラーシップ,バイラオーラ
サルトグリーン,ジャングルポケット,レディーダービー
サルバドールガロ,スウィフトカレント,リンデンルレーブ
サルバドールサクラ,シルポート,ヒシエンジェル
サルバドールジャズ,ホワイトマズル(GB),ホウライホーセキ
サルーテ,オルフェーヴル,シンディ(USA)
サルートアゲン,キャプテントゥーレ,キュートアゲン(USA)
サルーバアスール,ディープブリランテ,サングレアズール
サレルノ,シニスターミニスター(USA),ユメノティアラ
サレンティーナ,キングカメハメハ,サルヴェジェルマニア(IRE)
サロニカ,ディープインパクト,サロミナ(GER)
サワオウジョ,ヒルノダムール,サワキック
サワセンフロント,バンブーエール,ヴィンテージ
サワノヴェローチェ,ボストンハーバー(USA),サワノシャンテ
サワノココチャン,エイシンサンディ,ケイアイチャチャ
サワヤカショウ,ダンスインザダーク,ウェイクアンドテイク(USA)
サワヤカタイド,ブラックタイド,サワヤカスズカ
サワヤカフェスタ,ナカヤマフェスタ,サワヤカスズカ
サワヤカミスター,スズカフェニックス,サワヤカラスカル
ザワールド,シルポート,レヴェトン(USA)
サンアソシエ,カンパニー,ヒシレイホウ(USA)
サンアニストン,ローレルゲレイロ,ガランティサーダ
サンアンカレッジ,アッミラーレ,オンワードファニー
サンアンダーソン,オレハマッテルゼ,オウバイ
サンアース,ローレルゲレイロ,サンライトロバリー
サンウィチタ,アイルハヴアナザー(USA),デンジャーマネー
サンウィノナ,スニッツェル(AUS),スイートミルド(IRE)
サンエイイーグル,シニスターミニスター(USA),アマノブラウニイー
サンエイヴィーナス,エイシンフラッシュ,サファーガ
サンエイエンジェル,スウェプトオーヴァーボード(USA),リードリズム
サンエイキャピタル,シニスターミニスター(USA),ホクセツクィーン
サンエイゴールド,ステイゴールド,ノーチェリンダ(CHI)
サンエイスターダム,アイルハヴアナザー(USA),マイネカプリース
サンエイダイヤ,ゼンノロブロイ,アナモリ
サンエイプリンス,バトルプラン(USA),スロットル(USA)
サンエイホープ,アドマイヤオーラ,パレスレディー
サンエイリシャール,フサイチリシャール,カミノウエスト(USA)
サンエイルビー,ヴァーミリアン,ディスイズザライフ
サンエルパソ,ジャングルポケット,アップロー
サンオデッサ,スウェプトオーヴァーボード(USA),ベルモントフェリス
サンオーガスタ,バンブーエール,ベア
サンオークランド,ロージズインメイ(USA),チアズスワロー
サンオースティン,スクリーンヒーロー,ファーストタッチ
サンオーロラ,トーホウエンペラー,トーホウグレース
サンガイヤ,フサイチリシャール,ガイヤクイン
サンガッロ,キングカメハメハ,ファルネーゼ
サンカーメル,アルデバラン２(USA),マリスカ
サンキャスパー,アドマイヤムーン,マジックペイントブラッシュ(USA)
サンキュー,タイキシャトル(USA),ユキノマーメイド
サンキューゴッド,ハービンジャー(GB),アンナヴァン
サンクエトワール,ステイゴールド,マイネエストレヤ
サンクタリリアス,スウェプトオーヴァーボード(USA),シルクアンフィニ
サンクトゥスレーン,マツリダゴッホ,サクセスストレイン
サンクボヌール,ハービンジャー(GB),ミュゲドボヌール
サングラス,スタチューオブリバティ(USA),ノッティングギャル
サングラスポテト,ディープスカイ,イソノスワロー
サンクララ,スクリーンヒーロー,プリティハーワ
サングレーザー,ディープインパクト,マンティスハント
サンクロワ,ハービンジャー(GB),サンヴィクトワール
サンケネット,スウィフトカレント,ホッコーマイクイン
サンゲーリー,スマートファルコン,エーシンミモザ
サンコロナ,タイムパラドックス,クーニャン
サンゴーハム,アドマイヤマックス,スイートミーシャ
サンゴールドスター,パーソナルラッシュ(USA),コンゴウマドンナ
サンサクラメント,ファスリエフ(USA),ホシノテンビー
サンシアトル,シンボリクリスエス(USA),ムカラファ(USA)
サンシャイアン,オウケンブルースリ,キタノフラワー
サンジャクソン,アッミラーレ,キャンディスマイル
サンシャワー,Candy Ride(ARG),スウィートアンドセイヴォリー(USA)
サンシャンペーン,セイントアレックス(USA),コージネット
サンシャーロット,カジノドライヴ(USA),シズパンチ
サンジュウシ,アーネストリー,コウユーヒカリママ
サンジレット,カネヒキリ,テンノベニバラ
サンシロウ,ネオユニヴァース,テンイムホウ
サンシンシナティ,タイキシャトル(USA),トミケンブライト
サンシール,エイシンサンディ,クルールヴィオラ
サンズエーガル,サウスヴィグラス(USA),トロピカルラヴ
サンスペンサー,デュランダル,ブイルージュ
サンセイラム,ベーカバド(FR),シェーンレーヴェ
サンセットオーラ,アドマイヤオーラ,セトウチダイヤ
サンセットニース,フェデラリスト,ルミエールブーケ
サンセットバラッド,ムーンバラッド(IRE),レガート
サンセットビーチ,ステイゴールド,ビーチアイドル
サンセドナ,ロッコウオロシ(USA),ソニャトーレ
サンセリテ,ゼンノロブロイ,シーガルサリー
サンタアズライト,マツリダゴッホ,プレシャスドロップ
サンダカン,スターリングローズ,ゲイリーレディ(USA)
サンタガール,キンシャサノキセキ(AUS),コンパスローズ
サンタナブルー,ソングオブウインド,バイオレントムーヴ(USA)
サンタフェサン,シベリアンホーク(USA),スズカジェム
サンタフェチーフ(IRE),Wiesenpfad(FR),Saldentigerin(GER)
サンダベンポート,ストロングリターン,アテナチャン
サンダラボッチ,アポロキングダム(USA),トコロロ
サンダルエチケット,サウスヴィグラス(USA),シロキタカーニバル
サンダルース,ヒルノダムール,イシノビリーヴミー
サンタレジーナ,タニノギムレット,ホーリーブラウン
サンタローザ,ゼンノロブロイ,オルティスローザ(USA)
サンタンパ,ウォーターリーグ(USA),ワタリレディー
サンダーオーシャン,クロフネ(USA),シュガーミント
サンダーキング,キングヘイロー,クイーンブルー
サンダースプリング,トワイニング(USA),キープザチェンジ
サンダーチーフ,スクリーンヒーロー,キョウワノメガミ
サンダーバード,ジャングルポケット,ミステリー
サンダーブラスト,カネヒキリ,ダイタクドクター
サンダーマックス,アドマイヤマックス,プモ
サンダーラム,メイショウボーラー,メイショウアゲハ
サンチェサピーク,ヴァーミリアン,マスターギラティナ
サンチャゴボラーレ,ヴィクトワールピサ,ヴォークリンデ
サンチャールストン,トーセンホマレボシ,シナル
サンチュータ,ケイムホーム(USA),リトルジュリエット
サンチルネッタ,グランプリボス,リライアブル
サンディアタッチ,ゼンノロブロイ,ミルフィアタッチ
サンディー,ジャングルポケット,メイクミーシャイン
サンティーニ,ダイワメジャー,オリジナルスピン(IRE)
サンティール,ハービンジャー(GB),サンヴィクトワール
サンデトロイト,ストーミングホーム(GB),レインボーリップル(GB)
サンテプリエール,パイロ(USA),ニシエイビュレット
サンデュランゴ,バトルプラン(USA),イケイケサンドリン
サンデリアーナ,シンボリクリスエス(USA),オンシジューム
サンテルモ,ヴィクトワールピサ,エヴィータアルゼンティーナ(USA)
サンデンクレール,プリサイスエンド(USA),オータムリーフ
サンデンバロン,モルフェデスペクタ(USA),モルフェナンバー
サンデンファーム,スウィフトカレント,リンデンルレーブ
サンデーアゲイン,マーベラスサンデー,シルキーアゲイン
サンデーウィザード,ネオユニヴァース,シーズインクルーデッド(USA)
サンデーストリート,ストリートセンス(USA),サンデーローザ
サンデードライブ,カジノドライヴ(USA),ピューマカフェ
サンデーヒカル,アドマイヤコジーン,プリティエスト
サンデーヒロ,ハイアーゲーム,ミアジョイア
サンデーフーガ,ストロングリターン,メイショウフーガ
サンデーポスト,メジロベイリー,ポストイグニション
サンデームーティエ,タニノギムレット,ミサトペニー
サンドアート,ゴールドアリュール,タスクミストレス
サンドクイーン,ゴールドアリュール,フィエラメンテ
サンドスピーダー,キンシャサノキセキ(AUS),スプリングドリュー
サントスフレイバー,クロフネ(USA),タカノベンチャー
サントノーレ,ゴールドアリュール,キャトルキャール
サンドバレエ,サウスヴィグラス(USA),アドマイヤシズカ
サンドピット,プリサイスエンド(USA),サンドヴィーナス
サンドファースト,スズカマンボ,シスターエレキング
サンドプラチナ,カジノドライヴ(USA),ステイウィズユー
サンドブルー,マンハッタンカフェ,ディナーパーティ(IRE)
サンドフレイバー,クロフネ(USA),ゴールドプライシズライジング(USA)
サンドベージュ,トビーズコーナー(USA),アムネリス
サンドラ,スクリーンヒーロー,ジネブラルスキー
サンドラフラッシュ,エイシンフラッシュ,イイデサンドラ
サントリーニ,ローエングリン,スターキャンドル
サンドルトン,カネヒキリ,ダノンクラフト
サンドワン,アジュディミツオー,ホワイトドレス
サンドーバー,マツリダゴッホ,コスモディアレスト
サンナイト,マンハッタンカフェ,アリー(USA)
サンニコーラ,パイロ(USA),メイショウアレーナ
サンニューオリンズ,ストーミングホーム(GB),ピエナキューティー
サンノゼ,マツリダゴッホ,アルフェッカ
サンノーマン,キングズベスト(USA),ビバムールフィユ
サンパスコ,ロージズインメイ(USA),ハイランドカクテル
サンバッファロー,ロージズインメイ(USA),ピンクショットガン
サンバディ,クロフネ(USA),マリア
サンバデハーバー,ファンタスティックライト(USA),エイシンナポリタン
サンバノリズム,スタチューオブリバティ(USA),パラダイスコースト(USA)
サンパラソル,ソングオブウインド,ベストウーマン
サンバーナル,アッミラーレ,エリモメロディー
サンビショップ,メイショウボーラー,トウヨウテースト
サンピラー,フィガロ(USA),エンゼルアーチ(USA)
サンビリングス,モンテロッソ(GB),ヴィヴァヴォーチェ
サンファニート,カジノドライヴ(USA),ロンダドール
サンフラワー,エイシンサンディ,フロディーバラード
サンブリリアント,タイキシャトル(USA),グッドファッション
サンフレイム,キンシャサノキセキ(AUS),ササファイヤー(USA)
サンフレデリック,カンパニー,エレン
サンブレナード,アサクサキングス,ブリンダーレ
ザンブローネ(USA),Smart Strike(CAN),Tejida(USA)
サンペドロ,カネヒキリ,ハイセンスガール
サンベリーニ,ハーツクライ,サンヴァンサン
サンヘレナ,パイロ(USA),クーニャン
サンベンド,フォーティナイナーズサン(USA),シルキーアゲイン
サンボウ,バトルプラン(USA),カチョウフウゲツ
サンボストン,カンパニー,シェーナビアンカ
サンホッブズ,メイショウサムソン,パピュラ
サンホノルル,ローレルゲレイロ,メダリオンスター
サンボルチモア,ジャイアントレッカー(USA),チャレンジセイエン
サンマリエッタ,アドマイヤマックス,プットリー
サンマルアナザー,アイルハヴアナザー(USA),キミホウセキ
サンマルアリュール,ゴールドアリュール,ミスサイベリア(USA)
サンマルアルティマ,ロードアルティマ(USA),サンマルフェアー
サンマルヴェール,ストロングリターン,サンマルバンベール
サンマルエンパイア,エンパイアメーカー(USA),ケイアイベローナ
サンマルオーロラ,シンボリクリスエス(USA),ジョウノオーロラ
サンマルガイア,メイショウボーラー,ガイアアーティスト
サンマルクラウン,ディープスカイ,サンマルアンサー
サンマルコ,ダイタクリーヴァ,マルターズクラシカ(USA)
サンマルゴージャス,メイショウボーラー,マイネマニフィーク
サンマルジョイ,ハービンジャー(GB),シルバージョイ(CAN)
サンマルスイート,シンボリクリスエス(USA),スイートリトリート(GB)
サンマルスカイ,アルデバラン２(USA),ジョウノオーロラ
サンマルスター,トーセンホマレボシ,サンマルセイコー
サンマルスピリット,メイショウサムソン,ハートランドコマチ
サンマルタイトル,ハーツクライ,ヒシタイトル
サンマルティン,ハービンジャー(GB),ディアデラノビア
サンマルデューク,ロージズインメイ(USA),キミホウセキ
サンマルトゥーレ,キャプテントゥーレ,サンマルセイコー
サンマルトビー,トビーズコーナー(USA),サンマルバンベール
サンマルドライヴ,カジノドライヴ(USA),サンマルバンベール
サンマルバクシン,サクラバクシンオー,マサノメジャー
サンマルバロン,バゴ(FR),ジョウノエリザベス
サンマルパール,シンボリクリスエス(USA),ヒシパール
サンマルベラータ,ハービンジャー(GB),ウンベラータ
サンマルホマレ,トーセンホマレボシ,マサノメジャー
サンマルホーム,ストーミングホーム(GB),アイエスシャイン
サンマルミヤビ,ストーミングホーム(GB),ジョウノオーロラ
サンマルメジャール,カネヒキリ,マサノメジャー
サンマルライバル,アンライバルド,サンマルセイコー
サンマルラグーン,キンシャサノキセキ(AUS),ムーンライトガルチ
サンマルリトリート,ハードスパン(USA),スイートリトリート(GB)
サンミゲル,フリオーソ,フジバラード
サンメイコン,スペシャルウィーク,シナル
サンメサベルデ,ファルブラヴ(IRE),ワニタレスタリ
サンモントレー,クリストワイニング(USA),ヤングエブロス
サンライズアイドル,モンテロッソ(GB),トシキャンディ
サンライズアミーゴ,ハービンジャー(GB),ラトーヌタキオン
サンライズヴァイゼ,ワークフォース(GB),サンデーサンライズ
サンライズウィズ,サンライズペガサス,フォローミー
サンライズウェイ,ゴールドアリュール,アルウェン
サンライズウォー,ウォーエンブレム(USA),ラブリープリンセス
サンライズカイザー,ダイワメジャー,ウィルダネスストーム(CAN)
サンライズカナロア,ロードカナロア,ストリートスタイル
サンライズカラマ,サンライズペガサス,ティボリサンライズ
サンライズクロンヌ,ヴィクトワールピサ,オルティスローザ(USA)
サンライズコロン,マルカシェンク,レッドグラス
サンライズサーカス,シンボリクリスエス(USA),クラシックチュチュ
サンライズシェル,キンシャサノキセキ(AUS),シェルズレイ
サンライズシーズン,サウスヴィグラス(USA),ハロードリーム
サンライズセイハ,ワークフォース(GB),クラシックルージュ
サンライズセナ,カジノドライヴ(USA),ビッグマリーン
サンライズソア,シンボリクリスエス(USA),アメーリア
サンライズソウマ,ダイワメジャー,シースナイプ
サンライズソル,タートルボウル(IRE),ブラボージャングル
サンライズタイセイ,ディープインパクト,タイセイエトワール
サンライズタキオン,ノヴェリスト(IRE),イエロータキオン
