
サンライズチャージ,クロフネ(USA),スプリングフェスタ
サンライズトーク,ダイワメジャー,タイトーク(USA)
サンライズナイト,クロフネ(USA),ラブリーアリュール
サンライズネオ,ネオユニヴァース,リオニアンレディー(USA)
サンライズノヴァ,ゴールドアリュール,ブライトサファイヤ
サンライズハニー,サンライズペガサス,ハニーメロンチャン
サンライズバード,タニノギムレット,イズミバード
サンライズビーム,ハービンジャー(GB),ラトーヌサンライズ
サンライズフォルテ,ワークフォース(GB),シャイニングアレキ
サンライズブリッツ,ノヴェリスト(IRE),サンデーサンライズ
サンライズフルメン,ゴールドアリュール,ラウンドダンス
サンライズフレンチ,フレンチデピュティ(USA),ブロンドサンライズ
サンライズホーム,ケイムホーム(USA),エピーメロン
サンライズマジック,ハービンジャー(GB),サンデーサンライズ
サンライズマーチ,ハードスパン(USA),オールウェイズウィリング(USA)
サンライズミライ,クロフネ(USA),ハニーメロンチャン
サンライズメジャー,ダイワメジャー,ティファニータッチ(USA)
サンライズルーク,ステイゴールド,パッションローズ
サンライズレーヴ,サンライズペガサス,ティボリサンライズ
サンラヴィエール,ボストンハーバー(USA),パールフレイヤ
サンラスベガス,スクリーンヒーロー,トシメロディー
サンラファエル,ディープブリランテ,ポトリザリス(ARG)
サンラボック,マツリダゴッホ,チャームエンジェル(USA)
サンラモンバレー,ロードカナロア,モンローブロンド
サンリヴァル,ルーラーシップ,アンフィルージュ
サンリットデュー,ノヴェリスト(IRE),サンコロネット
サンルイビル,スウィフトカレント,トシメロディー
サンレイウインザー,スズカマンボ,サンウインダー
サンレイサワヤカ,スズカフェニックス,サワヤカラスカル
サンレイシンボル,ゼンノロブロイ,シンプリーラヴリー(CAN)
サンレイデューク,デュランダル,サンレイククイン
サンレイトピック,トビーズコーナー(USA),シャンパンセラー
サンレイハリケーン,パイロ(USA),プリモレディ
サンレイファミリー,スズカフェニックス,スズカフローラ
サンレイフレンチ,スズカフェニックス,スズカフローラ
サンレイフローラ,スズカマンボ,スズカフローラ
サンレイポケット,ジャングルポケット,アドマイヤパンチ
サンレイレッカー,ジャイアントレッカー(USA),サンレイキセキ
サンローガン,パイロ(USA),ミスワカウエイ(USA)
サンローズ,フォーティナイナーズサン(USA),マーベラスローズ
サンローズピンク,ロージズインメイ(USA),エフテーストライク
サンローレンス,スズカマンボ,プットリー
サンワラワラ,グラスワンダー(USA),ピントゥハティ
サーカディアン,アドマイヤムーン,アナステーシア
サーカムスタンス,ハービンジャー(GB),レティセントガール
サーキュラーリング,ディープブリランテ,スパイラルリング
サークルブリーズ,アッミラーレ,アカギトップヒメ
サーシスリーフ,マイネルラヴ(USA),ネオメープルリーフ
サージュ,サクラプレジデント,サクラブルース
サージュミノル,エンパイアメーカー(USA),マウンテンミステリー(CAN)
サーストンアクセス,ブレイクランアウト(USA),アドマイヤサクラ
サーストンウィナー,プリサイスエンド(USA),サウスエンピリカル
サーストンコラルド,キングカメハメハ,シークレットコサージュ(USA)
サーストンニケ,ネオユニヴァース,ニチドウルチル
サーストンバッカ,ストリートセンス(USA),パラフレーズ(GB)
サーストンヒーロー,ストリートセンス(USA),サイレントセンティネル(USA)
サーストンファラオ,キングズベスト(USA),レッダンゴールド
サーティグランド,サウスヴィグラス(USA),サザンカ(IRE)
サーデューク,アッミラーレ,ウンビジョン
サードアイ,スズカマンボ,マイウィン
サードグラッド,バゴ(FR),エスワイジュピター
サードレディ,フリオーソ,キタサンアカデミー(AUS)
サーヒューストン,ダイワメジャー,ウルトラブレンド(USA)
サーフィンサファリ,キングカメハメハ,ホクレレ
サーブルオール,ハービンジャー(GB),モンローブロンド
サーブルクイーン,キングズベスト(USA),ヴェルヴェットクイーン(GB)
サーブルクーリール(USA),Tale of the Cat(USA),Savviest(USA)
サーブルデエース,タニノギムレット,レセヴィブレ
サーブルノワール,ブラックタイド,マイネナデシコ
サーベイヤー,フリオーソ,ブッチ
サーベイヤースリー,ワークフォース(GB),マギストラ
サーベラージュ,ヴィクトワールピサ,アスペンアベニュー
サーボプレス,ディープスカイ,ベラミロード
サーム,ヴィクトワールピサ,モンピュア(IRE)
サーリアル,スウェプトオーヴァーボード(USA),ディアボレッサ
サーレンブラント,ディープインパクト,ブライトアバンダンス(USA)
サーロンドン,ファルブラヴ(IRE),ハッピーペインター
サーワシントン,ディープインパクト,マイジェン(USA)
