

サイエン,バゴ(FR),トウカイルックス
ザイオン,パイロ(USA),レッドジュピター
サイキセキ,フジキセキ,サニーサイチャン
サイキョウカグラ,エスポワールシチー,サイキョウレディー
サイゴンスター,スウェプトオーヴァーボード(USA),シャークブロード
サイタスリーレッド,ダノンシャンティ,ユメノラッキー(USA)
ザイディックメア,ゼンノロブロイ,シルキーラグーン
サイドストリート,ヨハネスブルグ(USA),メアリーズガーデン
サイドチェンジ,バトルプラン(USA),ナムラミステリー
サイバーエレキング,スマートファルコン,シスターエレキング
サイファー,ブラックタイド,マチカネミネルヴァ
ザイマカ,ハーツクライ,ダイアモンドコア
サイモンガオ,バトルプラン(USA),キャンディーストア
サイモンキンバリー,ダイワメジャー,リリアーレ
サイモンサーマル,エイシンフラッシュ,サイモンドルチェ
サイモンジェッター,アドマイヤムーン,スイートストームクリーク(USA)
サイモンジルバ,タートルボウル(IRE),メイショウチルチェ
サイモンゼーレ,キンシャサノキセキ(AUS),ポールポジション２(GB)
サイモントルナーレ,ゴールドアリュール,ユーモレスク
サイモンバイタル,フリオーソ,シルクスパイシー
サイモンミラベル,ダイワメジャー,ミリアム
サイモンラムセス,ブラックタイド,コパノマルコリーニ
サイモンルチアーノ,ロードアルティマ(USA),ファイヤーフレンチ
サイレンスディガ,パイロ(USA),シャンディガフ
サイレンスミラー,エイシンサンディ,ミラージェネス
サイレントアスカ,ハーツクライ,クイックリトルミス(USA)
サイレントウイナー,ソングオブウインド,マミークイーン
サイレントサード,タニノギムレット,アートオブダンサー
サイレントムーン,アドマイヤムーン,バランバ(GB)
サイン,オルフェーヴル,ラティール
サインズストーム,スタチューオブリバティ(USA),メイショウユウゼン
サヴァアルジャン,アメリカンボス(USA),シャイニングベガ
サヴァティアーノ,スペシャルウィーク,レツィーナ
ザウアー,フィガロ(USA),エーグルドゥース
サヴィ,ストリートセンス(USA),ヴィヴァヴォーチェ
サヴォアフェール,オルフェーヴル,ターキー
ザウォルドルフ,ディープインパクト,ウィーミスフランキー(USA)
サウザンアイランド,サウスヴィグラス(USA),ケチャップ
サウザンドエース,スウェプトオーヴァーボード(USA),パワーオブフェイス
サウザー,デザートキング(IRE),クラクエンウィーク
サウスアミューズ,サウスヴィグラス(USA),ショウリノホホエミ
サウスアメリカン,アドマイヤマックス,サンバホイッスル
サウスウインド,マイネルセレクト,サダムアカイカゼ
サウスオブボーダー,ゼンノロブロイ,パールシャドウ
サウスカップ,サウスヴィグラス(USA),ブライアンマリア
サウスカントリー,ロージズインメイ(USA),オースミブラッシー
サウスギガパワー,サウスヴィグラス(USA),シャイアーズエンデ(USA)
サウスキング,サウスヴィグラス(USA),シルクテンダー
サウスクイーン,アイルハヴアナザー(USA),リナミクドリーム(USA)
サウスグローリー,サウスヴィグラス(USA),シャンハイギャル
サウスコンサート,サウスヴィグラス(USA),セラフ
サウスザスナイパー,サウスヴィグラス(USA),ショウリノホホエミ
サウスシュネル(USA),Scat Daddy(USA),サウスヒューマー(USA)
サウススターマン,サウスヴィグラス(USA),シャンハイギャル
サウスディアマンテ,ナカヤマフェスタ,サンキンレター
サウスデイウォーク,タイムパラドックス,ガレリアトウショウ
サウストラベラー,サウスヴィグラス(USA),サルガソシー(USA)
サウスブレーヴ,サウスヴィグラス(USA),ディアダンサー
サウスポー,ディープスカイ,アンニュイブルース
サウスヤクモ,サウスヴィグラス(USA),ヤクモビーナス
サウスリバティー,サウスヴィグラス(USA),サザンジュエリー
サウンズオブアース,ネオユニヴァース,ファーストバイオリン(USA)
サウンズグレイト,カジノドライヴ(USA),スペシャルクイン
サウンディングベル,スクリーンヒーロー,メダーリア
サウンドアプローズ,コンデュイット(IRE),タイキシャイン
サウンドウイング,サウンドボルケーノ(USA),サウンドモニカ
サウンドオブビット,スウェプトオーヴァーボード(USA),スローアキッス
サウンドガバーナ,アドマイヤムーン,ガッビア
サウンドキアラ,ディープインパクト,サウンドバリアー
サウンドギャツビー,マツリダゴッホ,コスマグレース
サウンドコラード,リーチザクラウン,オトヒメ
サウンドサムデイ,サウンドボルケーノ(USA),ハートアンドハート
サウンドシップ,ルーラーシップ,シージョー
サウンドジャンゴ(USA),Desert Party(USA),Salt Water Reign(USA)
サウンドスカイ,ディープスカイ,アンジェラスキッス(USA)
サウンドスカイメサ(USA),ケープブランコ(IRE),Skymynx(USA)
サウンドスタジオ,ワークフォース(GB),アートスタジオ(USA)
サウンドスター,ハーツクライ,シュウザンアイ
サウンドストリート,ストリートセンス(USA),ラヴァリーノ(USA)
サウンドテーブル,シルバーチャーム(USA),サンデーストーリー
サウンドドゥイット,コンデュイット(IRE),シージョー
サウンドトゥルー,フレンチデピュティ(USA),キョウエイトルース
サウンドバーニング,ハーツクライ,モスコーバーニング(USA)
サウンドビクトリー,サウスヴィグラス(USA),メジャービクトリー
サウンドピース,プリサイスエンド(USA),ロンドインディ
サウンドベティ,ディープスカイ,キハク
サウンドマジック,トビーズコーナー(USA),ヘイローマジック
サウンドメジャー(USA),Harlan's Holiday(USA),Di Machine(ARG)
サウンドローズ,フリオーソ,スカイトウショウ
サエズリ,マツリダゴッホ,ソニックバード(USA)
サカイチファイア,オンファイア,ノースランサー
サカイヤデモズ,アドマイヤジャパン,プレインエンジェル
サカエダビクトリー,カンパニー,エアミジェーン
サカショウクィーン,ロードアルティマ(USA),キャットニップ
サカショウレオ,ストーミングホーム(GB),マイネレヴェランス
サカジロキクチャン,ラスカルスズカ,カルメンジョオー
サカジロチュウオー,キンシャサノキセキ(AUS),サイキョウレディー
サカジロテンオー,タイキシャトル(USA),スイートカトマンズ
サカジロビューティ,シンボリクリスエス(USA),スイートクラフティ(USA)
サカジロマリン,トワイニング(USA),マイネカプリース
サカダッシュ,ローレルゲレイロ,デュランティ
サカノフォワード,エーシンフォワード(USA),サカノエンジェル
サカベンタロー,パイロ(USA),パチョリ(GB)
サカベンツヨシ,ブラックタキシード,グリーンヒルスター(USA)
サキコトレーヴォ,ダノンシャンティ,エーシンアガペー
サキノブライアン,タイムパラドックス,サキノローレル
ザクイーン,ヴィクトワールピサ,サマーハ(GB)
サクステッド,タートルボウル(IRE),メガクライト
サクセスイースター,マツリダゴッホ,サクセスストレイン
サクセスウィング,アッミラーレ,リトルマーメード
サクセスウエイ,サクラプレジデント,ミスベルツリー
サクセスエナジー,キンシャサノキセキ(AUS),サクセスアイニー
サクセスクイーン,ジャングルポケット,ゴルトクローネ
サクセスコード,ファスリエフ(USA),コードネーム
サクセスストーリー,モエレプルトス,ロマンスフリージア
サクセステーラー,アンライバルド,ティアレ
サクセスムーン,ダノンシャンティ,ミスベルツリー
サクセスライン,トーセンファントム,トーセンエキコ
ザグマシンガン,キングカメハメハ,ボルドグザグ(FR)
サクヤメイ,トビーズコーナー(USA),ラフィーク
サクラアウェイク,ハービンジャー(GB),サクラエンプレス
サクラアリュール,ゴールドアリュール,シロガネーゼカフェ(USA)
サクラアルカンジュ,サクラプレジデント,サクラフォルトゥナ
サクラアンプルール,キングカメハメハ,サクラメガ
サクライザベル,プリサイスエンド(USA),サクセスイザベラ
サクライスピラート,サクラプレジデント,サクラヴァニータ
ザクライングマシン,ネオユニヴァース,アンジェラスキッス(USA)
サクラインザスカイ,ワイルドラッシュ(USA),サクラヴィッキー
サクライーグル,サクラプレジデント,サクラミヤビ
サクラヴァローレ,サクラプレジデント,サクラスイートキス
サクラヴァンデロア,チーフベアハート(CAN),サクラテンシ
サクラエ,ディープスカイ,ウェディングギフト
サクラエクレール,サクラゼウス,サクラヴィーナス
サクラエルカミーノ,サウスヴィグラス(USA),サクラメガマックス
サクラエンパイア,エンパイアメーカー(USA),シロガネーゼカフェ(USA)
サクラエール,ケイムホーム(USA),サクラロマンス
サクラオハナ,サウスヴィグラス(USA),サクラフロンティア
サクラガオカ,サクラプレジデント,トサノデピュティ
サクラカレン,アルデバラン２(USA),サクラプリファー
サクラキングオー,キングカメハメハ,サクラフォーエバー
サクラグレイス,ハービンジャー(GB),サクラメガ
サクラクロノス,サクラゼウス,サクラスウィープ
サクラゴスペル,サクラプレジデント,サクラブルース
サクラゴーズアイ,サクラプレジデント,サクラグリッター
サクラゴール,ゴールドアリュール,ブリリアントスター(USA)
サクラサイレンス,オレハマッテルゼ,ラブドリーム
サクラシェンロン,サクラプレジデント,サクラレイリ
サクラシャイニー,サクラプレジデント,サクラフューチャー
サクラシュトローム,サクラプレジデント,サクラブラッサム(USA)
サクラセンティーレ,マンハッタンカフェ,シロガネーゼカフェ(USA)
サグラダファミリア,ローエングリン,エイシンガンマ
サクラダムール,サクラプレジデント,サクラジュノー
サクラテイオー,ブライアンズタイム(USA),サクラアカツキ
サクラティンクル,ステイゴールド,サクラキャンドル
サクラデラルース,アルデバラン２(USA),サクラコールミー
サクラトップキング,クロフネ(USA),グロリアスアーチ
サクラトップスター,シニスターミニスター(USA),サクラトップクイン
サクラトップタイム,ブラックタイド,トウカイパートナー
サクラトップビクト,アグネスデジタル(USA),シンシンパッション
サクラトップライフ,ネオユニヴァース,ヒラボクミラクル
サクラトップロマン,ケイムホーム(USA),ホットファッション
サクラノハナビラ,ディープブリランテ,スイートブレナム
サクラパイロット,サクラプレジデント,ナイキチャーミング
サクラパリュール,サクラプレジデント,サクラドルチェ
サクラバリー,トーセンホマレボシ,コールミークイーン
サクラバーニング,ワイルドラッシュ(USA),サクラバラダ
サクラビクトワール,サクラローレル,サクラメガマックス
サクラフィアーブル,サクラプレジデント,サクラシャンティ
サクラブチャン,アッミラーレ,オークションマニア(USA)
サクラプリズム,ブライアンズタイム(USA),サクラプリファー
サクラプリマドンナ,サクラゼウス,サクラプリメーラ
サクラブレイブ,ブライアンズタイム(USA),サクラバラダ
サクラプレミア,メイショウボーラー,サクラインザダーク
サクラヘラクレス,サクラゼウス,サクラベッシー
サクラベリー,ボストンハーバー(USA),サクラワイズ
サクラベルカント,サクラゼウス,サクラブルース
サクラボルテージ,サクラメガワンダー,サクラアカツキ
サクラマニフィーク,バゴ(FR),サクラユスラウメ
サクラメジャー,ダイワメジャー,サクラプリファー
サクラメント,アイルハヴアナザー(USA),スペシャルウーマン
サクララフェスタ,サクラプレジデント,サクラシャンティ
サクラリヤン,ティンバーカントリー(USA),サクラキセキ
サクラルコール,サクラプレジデント,サクラセレーネ
サクラレイメイ,サクラプレジデント,サクラアカツキ
サクラレインボー,サクラプレジデント,ニジノカナタヘ
サクラレガーロ,ハービンジャー(GB),サクラローズマリー
サクラレグナム,サクラプレジデント,グローリーゲイト
サクラレグルス,サクラオリオン,サクラインザダーク
サクラレディ(IRE),Galileo(IRE),La Sylvia(IRE)
サクレエクスプレス,クロフネ(USA),ビーポジティブ
サクレディーヴァ,クロフネ(USA),ラフェクレール
サコウイッパク,ゴールドアリュール,ベイビーローズ(IRE)
サザナミ,ディープインパクト,クーデンビーチ(IRE)
ササノユキオルフェ,オルフェーヴル,ハッピーリクエスト
サザンヴィグラス,サウスヴィグラス(USA),スプライトダンス
サザンオーヴァー,スウェプトオーヴァーボード(USA),サザンレイスター
サザンオールスター,フリオーソ,クレバーユーミン
サザンキング,スズカマンボ,サウスライズ
サザンソレイユ,サウスヴィグラス(USA),トロピカルラヴ
サザンブリーズ,エンパイアメーカー(USA),モーニングフェイス
サザンベルン,ブラックタキシード,サザンシーラ
サザンボルケーノ,サウスヴィグラス(USA),サザンジュエリー
サザンライツ,サクラバクシンオー,サザンフェアリー(USA)
サジカゲン,スウェプトオーヴァーボード(USA),ビフォーダーク
ザストリート,ストリートセンス(USA),ロイヤルガラ(GB)
サスナーアディーン,タイキシャトル(USA),リトゥルスター
サスナーシルニー,ダノンシャンティ,リトゥルスター
サダクビア,ブラックタイド,ドルフィンダンス(USA)
サダコチャン,ローレルゲレイロ,プレミールサダコ
サダムグラシアス,ジャングルポケット,レッドターキー
サダムジャポン,アドマイヤオーラ,エクリチュール
サダムシーズン,タイキシャトル(USA),ワカサイティング
サダムドミニック,タートルボウル(IRE),スプンキーウーマン
サダムノンノ,ディープインパクト,ショウナンカラット
サダムフジコ,クロフネ(USA),メヤディーニ(USA)
サダムヤマビコ,キングカメハメハ,マイダイナマイト
サダムラピュタ,マンハッタンカフェ,アートスタジオ(USA)
サダムリスペクト,キンシャサノキセキ(AUS),ハナランマン
サダムロードショー,シンボリクリスエス(USA),グランオマージュ
サタンズクラウン,ダイワメジャー,オリーブクラウン
サターン,ディープインパクト,シャンロッサ(IRE)
サチタカチャンス,カルストンライトオ,ネイビーズドーター
サチノクイーン,ダイワメジャー,ノーススポット
サチノシェーバー,リンドシェーバー(USA),オーロラヒメ
サチノマリアージュ,サウスヴィグラス(USA),ヒシアリアケ
サチノリーダース,ザール(GB),バクシンオージョ
ザッカリーア,エンパイアメーカー(USA),エフティアクトレス
サッカーチョウサン,オルフェーヴル,ナデシコチョウサン
サツキオーラ,アドマイヤオーラ,ストロングヒロイン
サツキジョオウ,ジャングルポケット,マキハタスリリング
サツキシラユリ,スズカマンボ,ベルモントヤマユリ
サツキチャン,ダノンシャンティ,カワイコチャン
サツキハイセンス,ハイアーゲーム,ミスルピナス
サツキブライド,タニノギムレット,バブリングブライド
サツキユニヴァース,ネオユニヴァース,ブリズデロートンヌ
サツキロビン,スマートロビン,コープランズナニー(USA)
サツキワルツ,アーネストリー,パンテール
サッキーエクシード,カジノドライヴ(USA),フジブルーハート
サッキージョー,ジョーカプチーノ,フェーヴ(USA)
サッキーゼウス,ケイムホーム(USA),サッキーエンジェル
サッキーバリアント,キングヘイロー,ローレルヴェロッサ
サッキープリンス,ディープスカイ,マキノジョリエ
サッキーヘラクレス,ロージズインメイ(USA),ハートフルビコー
サッチン,エンパイアメーカー(USA),ベラルーナ
ザッツアモーレ,ジャングルポケット,アンピエッツア
ザッツクール,ダイワメジャー,ルージュクール(AUS)
サッポロキングオー,ストーミングホーム(GB),フォレストベイビー
サッポロローズ,スターリングローズ,イシノショウ
サツマ,アドマイヤコジーン,ユウワンチョイス
サツマノクロジョカ,サムライハート,オグリピンキー
サテラノサト,ディープブリランテ,ウアジェト
サテンドール,ステイゴールド,メジロスプレンダー
サトコンサムソン,メイショウサムソン,グリンタ
サトコンボク,フィガロ(USA),シュベリーン
サトノアイリ,ステイゴールド,サーキットレディ(USA)
サトノアッシュ,キングカメハメハ,ディナーブレイク(USA)
サトノアビリティ,ダイワメジャー,サーキットレディ(USA)
サトノアリシア,ハービンジャー(GB),ラルーチェ
サトノアレス,ディープインパクト,サトノアマゾネス(IRE)
サトノアンジュ,ヴィクトワールピサ,アオゾラペダル
サトノアーサー,ディープインパクト,キングスローズ(NZ)
サトノインプレス,タイキシャトル(USA),レアシルウィア
サトノヴィクトリー,ディープインパクト,ジョコンダ２(IRE)
サトノエターナル,ディープインパクト,ソーメニーウェイズ(USA)
サトノエメラルド,キングカメハメハ,トレアンサンブル
サトノオニキス,ディープインパクト,ミスティックリップス(GER)
サトノオンリーワン,ディープインパクト,クリームオンリー(USA)
サトノオーサム,オルフェーヴル,ピュアチョコレート(USA)
サトノガバナー,ディープインパクト,タイキクリスティー(USA)
サトノギャラクシー,シンボリクリスエス(USA),シェリルピンク
サトノキングダム,ディープインパクト,ダリシア(GER)
サトノキングベル,ネオユニヴァース,ダリシア(GER)
サトノキングリー,ダイワメジャー,ファンジカ(IRE)
サトノクラウン,Marju(IRE),ジョコンダ２(IRE)
サトノグラン,ハーツクライ,スネガエクスプレス
サトノクリエション,ゴールドアリュール,サンデア(USA)
サトノグリッター,ワークフォース(GB),バンドゥッチ(USA)
サトノクロニクル,ハーツクライ,トゥーピー(GB)
サトノクロノス,ディープインパクト,トゥーアイテムリミット(USA)
サトノグロワール,ディープインパクト,シャムロッカー(NZ)
サトノゲイル,ディープインパクト,フィリス
サトノケンシロウ,ディープインパクト,マジックストーム(USA)
サトノコスミック,ゼンノロブロイ,オールピュール(USA)
サトノコメット,ダイワメジャー,リリサイド(FR)
サトノジェームス,ディープインパクト,ハニーローズ(ARG)
サトノシャイニング,ステイゴールド,ビーフェアー(BRZ)
サトノジャスティス,ハーツクライ,スーア(IRE)
サトノシャーク,ディープインパクト,オジャグワ(ARG)
サトノジュウザ,ワークフォース(GB),サトノユリア
サトノシリウス,ディープインパクト,パールシャドウ
サトノシンゲキ,エンパイアメーカー(USA),ホームスイートホーム(USA)
サトノジーガー,ディープインパクト,ルアーズストリート
サトノスティング,フジキセキ,ジェットスパークル
サトノスピードオー,ダノンシャンティ,ストームティグレス
サトノスーペリア,ハーツクライ,オスティエンセ
サトノセレリティ,ディープスカイ,ディアウィンク
サトノソルタス,ディープインパクト,アイランドファッション(USA)
サトノタイガー,キングカメハメハ,ファビラスターン
サトノダイヤモンド,ディープインパクト,マルペンサ(ARG)
サトノダヴィンチ,ディープインパクト,ラグジャリークラス(USA)
サトノティターン,シンボリクリスエス(USA),マチカネチコウヨレ(USA)
サトノディード,ディープインパクト,ゴジップガール(USA)
サトノデプロマット,ブライアンズタイム(USA),ピサノバーキン
サトノテラス,オルフェーヴル,サトノアマゾネス(IRE)
サトノネビュラ(USA),Medaglia d'Oro(USA),Swift Girl(USA)
サトノノブレス,ディープインパクト,クライウィズジョイ
サトノバイアリー(IRE),Canford Cliffs(IRE),Kaaba(GB)
サトノファンタシー,クロフネ(USA),ディナーブレイク(USA)
サトノファンタス,ステイゴールド,レディインディ(USA)
サトノフェイバー,ゼンノロブロイ,ヴィヴァシャスヴィヴィアン(USA)
サトノプライド,ハードスパン(USA),ダイワエンジェル
サトノプライム,ストリートセンス(USA),ラストアロー
サトノフラム,マンハッタンカフェ,タイキマドレーヌ
サトノプリンシパル(USA),Bernardini(USA),Toroca(USA)
サトノブレイズ,Kitten's Joy(USA),チョウチョウキャット(USA)
サトノフレイム,ロージズインメイ(USA),ダームドゥラック
サトノプレスト,キングカメハメハ,ラリズ(ARG)
サトノマイヒメ,ダイワメジャー,ダイワエンジェル
サトノマサムネ,ゼンノロブロイ,エリドゥバビロン(USA)
サトノマスター,エンパイアメーカー(USA),ヴィヴァシャスヴィヴィアン(USA)
サトノマックス,ディープインパクト,ラシャルマンテ(ARG)
サトノメサイア,ハーツクライ,ダリシア(GER)
サトノメダリスト,ゼンノロブロイ,ハニーローズ(ARG)
サトノユニゾン,シニスターミニスター(USA),ハニーパイ
サトノリュウガ,ハービンジャー(GB),サトノユリア
サトノルーラー,ディープインパクト,コンテスティッド(USA)
サトノルーリー,ディープインパクト,クライウィズジョイ
サトノレックス,ダイワメジャー,ライジングクロス(GB)
サトノレーヌ,キングカメハメハ,シンシアー
サトノワイバーン,キングカメハメハ,マイプラーナ
サトノワルキューレ,ディープインパクト,ヒアトゥウィン(BRZ)
サドルオン,ステイゴールド,ケリーケイズプレジャー(USA)
サトーリアス,ストーミングホーム(GB),ザミリア(IRE)
サナコ,ダイワメジャー,スイートハビタット(IRE)
サニツ,ロードカナロア,ダンスザクラシックス(IRE)
サニーゴールド,スペシャルウィーク,サニークラッシック
サニーサウス,サウスヴィグラス(USA),ダマスクローズ
サニーサンシャイン,トーセンホマレボシ,ピアニスト
サニージューク,エンパイアメーカー(USA),スパーブクィーン
サニーダンサー,バンブーエール,バンビーナココ
サニーデイズ,フジキセキ,ピンククラウド
サニーデイヒーロー,マツリダゴッホ,ジャスミンリーフ
サニーリスペクト,クロフネ(USA),サニークラッシック
サニーリバル,サムライハート,ゴールドバニヤン
サニーレイ,ステイゴールド,ティエッチマンボ(USA)
サニーロマンス,デュランダル,サニーアンジェリカ
サノイチ,サウスヴィグラス(USA),エトレーヌ
