
ラベンダーヒスイ,サウスヴィグラス(USA),ラインレジーナ
ラベンデュラン,ドリームジャーニー,カレイジャスミン
ラペールノアール,ディープインパクト,バイコースタル(USA)
ラホヤ,サウスヴィグラス(USA),グランドヒート
ラポートトーク,ディープインパクト,リラックススマイル
ラボーナ,ルーラーシップ,ハッピーパス
ラホーヤビーチ,タイキシャトル(USA),エアラホーヤ
ラマッダレーナ,ケイムホーム(USA),コスタズメラルダ
ラマレ,ゼンノロブロイ,クールレディ
ラミアカーサ,ゴールドアリュール,ファミッリア(USA)
ラミングアタック,ヴィクトワールピサ,レディピアレス
ラムセスバローズ(USA),Curlin(USA),Devious Intent(USA)
ラモントルドール,ゴールドアリュール,タイムウィルテル
ラユロット,エンパイアメーカー(USA),ユメノオーラ
ララエクラテール,ステイゴールド,オリミツキネン
ララオーロ,ステイゴールド,カルディーン(ARG)
ララクードゥリオン,ジャングルポケット,ストロングレダ
ララシャンパーニュ,ディープインパクト,ミメティコ(IRE)
ララバイ,クロフネ(USA),ホーリーグレイル
ララパルーザ,カネヒキリ,アンダルシア
ララプリムヴェール,クロフネ(USA),マチカネハナサソウ
ララペイフォワード(USA),Scat Daddy(USA),Blushing Issue(USA)
ララベスラーナ,デュランダル,ディアコメット
ララベル,ゴールドアリュール,ブリージーウッズ
ララマ,スズカマンボ,ヴィクトリアローズ
ララムリ,ゼンノロブロイ,シネマスコープ
ララメダイユドール,ゴールドアリュール,テイクザケイク
ララメンテ,ディープスカイ,レイニータ
ラララライ,ロードアルティマ(USA),サマークイーン
ラララルジェス,ファルブラヴ(IRE),イオス
ララルラシオン,アドマイヤムーン,ヴィミーリッジ(FR)
ラリュール,ローエングリン,プティプランセス
ラルウア,ノボジャック(USA),トキノナイス
ラルク,ディープインパクト,ライラックスアンドレース(USA)
ラルグス,スズカフェニックス,デコトウショウ
ラルゴスパーダ,ゼンノロブロイ,フサイチエレガンス(USA)
ラルジュ,カネヒキリ,エコパン
ラルノンキュル,ナカヤマフェスタ,エリモエクレール
ラルムドランジュ(IRE),Dansili(GB),Mer de Corail(IRE)
ラルムドール,ハーツクライ,フラムドール
ラルーナ,アイルハヴアナザー(USA),コスモサンチャン
ラレゾン,ハーツクライ,ラリーズン(USA)
ラレッサングル,キングカメハメハ,オーベルゲイド(FR)
ラレータ,ダイワメジャー,エヴィータアルゼンティーナ(USA)
ラローデ(USA),Shackleford(USA),ミリオンセラー２(USA)
ランウェイデビュー,ストロングリターン,デビュートウショウ
ランウェイワルツ,ゴールドアリュール,ラウンドダンス
ランガディア,キングカメハメハ,マリーシャンタル
ランガージュ,ゴールドアリュール,エクリチュール
ランギオラ,ネオユニヴァース,カナンダクイーン(NZ)
ラングドック,キングヘイロー,モンルージュ
ラングレー,ディープインパクト,ラヴズオンリーミー(USA)
ランジャタイ,アジュディケーティング(USA),ウォーターグイネス
ランスタン,ダイワメジャー,マシュール(USA)
ランスマン,ダイワメジャー,ラフアップ
ランディーニ,ブラックタイド,ノーモアクライ(USA)
ラントゥユー,オネストジョン,ピンクキャンドル
ランドオザリール,ゼンノロブロイ,アイリッシュカーリ(IRE)
ラントカルテ,オルフェーヴル,ラルナデミエル(GER)
ランドギャラクシー,プリサイスエンド(USA),キシュウアゲイン
ランドキングスター,トーセンホマレボシ,ユウキビバ
ランドグローリー,ゼンノロブロイ,メイショウヤヨイ
ラントシャフト,ステイゴールド,マイネトゥインクル
ランドジュピター,サマーバード(USA),フィールザファン
ランドスター,タイキシャトル(USA),キシュウウインド
ランドネ(USA),Blame(USA),Loure(USA)
ランドハイパワー,メイショウボーラー,ホーマンキュート
ランドヘルメース,タートルボウル(IRE),ウィステリアカフナ
ランドマスタング,シンボリクリスエス(USA),ハートオンウェーブ(USA)
ランドマーキュリー,サウスヴィグラス(USA),メジロカンナ
ランドロワ,クロフネ(USA),モントレゾール
ランナーズハイ,カネヒキリ,ベルナデッタ
ランニングウインド,Discreetly Mine,ランニングボブキャッツ(USA)
ランニングクラウド,スターリングローズ,シェアザハート
ランニングセンス,アドマイヤムーン,セレーサ
ランニングマン,スウェプトオーヴァーボード(USA),カワカミパイン
ランバージャック,ネオユニヴァース,スウィートデジャヴ(USA)
ランバート,ヘニーヒューズ(USA),シャルロッカ
ランパートエース,ゼンノロブロイ,セカンドノホシ
ランフォージン,タニノギムレット,ライクリーティナ
ランプフィーバー(USA),Ghostzapper(USA),Gold Vault(USA)
ランブリングマン,ホワイトマズル(GB),ナムラコウラン
ランプルール,マンハッタンカフェ,カトマンドゥ(FR)
ランペイジ,ケイムホーム(USA),プレイリーウインド
ランベルティ,ブラックタイド,ドクターベローナ
ランボシ,メイショウボーラー,ファイヤーフレンチ
ランメライト,ドリームジャーニー,カレイメモワール
ランランラン,エクラヴァンクール,ラメラメ
ランリーナ,エイシンフラッシュ,アップルティー
ランローララン,デュランダル,ソーアラート
ラーケン,エンパイアメーカー(USA),スズカグレイス
ラーゴブルー,ハーツクライ,ベネンシアドール
ラーナアズーラ,パイロ(USA),グロッタアズーラ
ラームリュンヌ,ブライアンズタイム(USA),プリティジョディー
ラーリオ(USA),Ice Box(USA),Lake Como(USA)
